Q伯特,Q伯特.7z,Q bo te.7z
暴风雪,暴风雪.7z,bao feng xue.7z
爆破彗星,爆破彗星.7z,bao po hui xing.7z
爆炸啦,爆炸啦.7z,bao zha la.7z
超级吃豆人,超级吃豆人.7z,chao ji chi dou ren.7z
超级打砖块,超级打砖块.7z,chao ji da zhuan kuai.7z
超级狂热,超级狂热.7z,chao ji kuang re.7z
超级眼镜蛇直升机,超级眼镜蛇直升机.7z,chao ji yan jing she zhi sheng ji.7z
城堡爆破,城堡爆破.7z,cheng bao bao po.7z
城堡危机,城堡危机.7z,cheng bao wei ji.7z
吃豆女士,吃豆女士.7z,chi dou nv shi.7z
吃豆人Jr.,吃豆人Jr..7z,chi dou ren Jr..7z
吃豆人,吃豆人.7z,chi dou ren.7z
丛林狩猎,丛林狩猎.7z,cong lin shou lie.7z
打空气,打空气.7z,da kong qi.7z
大力水手,大力水手.7z,da li shui shou.7z
袋鼠营救,袋鼠营救.7z,dai shu ying jiu.7z
导弹指令,导弹指令.7z,dao dan zhi ling.7z
地球保卫战,地球保卫战.7z,di qiu bao wei zhan.7z
顶尖车手1,顶尖车手1.7z,ding jian che shou 1.7z
嘟先生的城堡,嘟先生的城堡.7z,du xian sheng de cheng bao.7z
飞奔鸵鸟,飞奔鸵鸟.7z,fei ben tuo niao.7z
飞天蜈蚣,飞天蜈蚣.7z,fei tian wu gong.7z
疯狂枪战,疯狂枪战.7z,feng kuang qiang zhan.7z
刚果冒险,刚果冒险.7z,gang guo mao xian.7z
光束飞船,光束飞船.7z,guang shu fei chuan.7z
滚球大战,滚球大战.7z,gun qiu da zhan.7z
航天飞机 宇宙之旅,航天飞机 宇宙之旅.7z,hang tian fei ji yu zhou zhi lv.7z
黑带格斗,黑带格斗.7z,hei dai ge dou.7z
机械冲击,机械冲击.7z,ji xie chong ji.7z
机械创元2084,机械创元2084.7z,ji xie chuang yuan 2084.7z
尖兵,尖兵.7z,jian bing.7z
紧急对抗,紧急对抗.7z,jin ji dui kang.7z
金塔纳罗奥冒险,金塔纳罗奥冒险.7z,jin ta na luo ao mao xian.7z
警察抓小偷,警察抓小偷.7z,jing cha zhua xiao tou.7z
酒吧棒球,酒吧棒球.7z,jiu ba bang qiu.7z
救援行动,救援行动.7z,jiu yuan xing dong.7z
巨舰强袭,巨舰强袭.7z,ju jian qiang xi.7z
卡罗尔肖的运河大战,卡罗尔肖的运河大战.7z,ka luo er xiao de yun he da zhan.7z
矿工大冒险,矿工大冒险.7z,kuang gong da mao xian.7z
狂战士,狂战士.7z,kuang zhan shi.7z
蓝图,蓝图.7z,lan tu.7z
乐一通酒店,乐一通酒店.7z,le yi tong jiu dian.7z
立体空战,立体空战.7z,li ti kong zhan.7z
离子射线,离子射线.7z,li zi she xian.7z
马里奥兄弟,马里奥兄弟.7z,ma li ao xiong di.7z
梅布佐克,梅布佐克.7z,mei bu zuo ke.7z
蒙特祖玛的复仇,蒙特祖玛的复仇.7z,meng te zu ma de fu chou.7z
迷宫连结,迷宫连结.7z,mi gong lian jie.7z
迷你高尔夫,迷你高尔夫.7z,mi ni gao er fu.7z
面向仪表盘,面向仪表盘.7z,mian xiang yi biao pan.7z
魔幻历险2,魔幻历险2.7z,mo huan li xian 2.7z
鸟骑士,鸟骑士.7z,niao qi shi.7z
喷火战斗机,喷火战斗机.7z,pen huo zhan dou ji.7z
企鹅推冰,企鹅推冰.7z,qi e tui bing.7z
千足虫,千足虫.7z,qian zu chong.7z
青蛙过河1,青蛙过河1.7z,qing wa guo he 1.7z
青蛙过河2,青蛙过河2.7z,qing wa guo he 2.7z
萨里斗技场,萨里斗技场.7z,sa li dou ji chang.7z
山魔王,山魔王.7z,shan mo wang.7z
赏金猎人鲍勃归来,赏金猎人鲍勃归来.7z,shang jin lie ren bao bo gui lai.7z
十项全能,十项全能.7z,shi xiang quan neng.7z
守卫者,守卫者.7z,shou wei zhe.7z
水管工汤姆,水管工汤姆.7z,shui guan gong tang mu.7z
太空侵略者,太空侵略者.7z,tai kong qin lve zhe.7z
太空危机,太空危机.7z,tai kong wei ji.7z
太阳系战机,太阳系战机.7z,tai yang xi zhan ji.7z
田径运动会,田径运动会.7z,tian jing yun dong hui.7z
铁板阵,铁板阵.7z,tie ban zhen.7z
微型双陆棋,微型双陆棋.7z,wei xing shuang lu qi.7z
巫师沃尔,巫师沃尔.7z,wu shi wo er.7z
陷阱I,陷阱I.7z,xian jing I.7z
陷阱II 迷失溶洞,陷阱II 迷失溶洞.7z,xian jing II mi shi rong dong.7z
小蜜蜂,小蜜蜂.7z,xiao mi feng.7z
小魔怪,小魔怪.7z,xiao mo guai.7z
小直升机科菲,小直升机科菲.7z,xiao zhi sheng ji ke fei.7z
星际迷航 模拟战略行动,星际迷航 模拟战略行动.7z,xing ji mi hang mo ni zhan lve xing dong.7z
星际奇兵,星际奇兵.7z,xing ji qi bing.7z
星际游侠,星际游侠.7z,xing ji you xia.7z
星际之门,星际之门.7z,xing ji zhi men.7z
星球大战 街机版,星球大战 街机版.7z,xing qiu da zhan jie ji ban.7z
行星飞行,行星飞行.7z,xing xing fei xing.7z
星战外传 死星之战,星战外传 死星之战.7z,xing zhan wai zhuan si xing zhi zhan.7z
银河系轨道机械部队,银河系轨道机械部队.7z,yin he xi gui dao ji xie bu dui.7z
英雄,英雄.7z,ying xiong.7z
宇宙精灵,宇宙精灵.7z,yu zhou jing ling.7z
宇宙追逐,宇宙追逐.7z,yu zhou zhui zhu.7z
月球战车,月球战车.7z,yue qiu zhan che.7z
运动高飞狗,运动高飞狗.7z,yun dong gao fei gou.7z
陨石射击,陨石射击.7z,yun shi she ji.7z
詹姆斯邦德007,詹姆斯邦德007.7z,zhan mu si bang de 007.7z
战争地带,战争地带.7z,zhan zheng di dai.7z
真实棒球,真实棒球.7z,zhen shi bang qiu.7z
真实橄榄球,真实橄榄球.7z,zhen shi gan lan qiu.7z
真实篮球,真实篮球.7z,zhen shi lan qiu.7z
真实网球,真实网球.7z,zhen shi wang qiu.7z
真实足球,真实足球.7z,zhen shi zu qiu.7z
直升机大战,直升机大战.7z,zhi sheng ji da zhan.7z
最后的星空战士,最后的星空战士.7z,zui hou de xing kong zhan shi.7z
最后的遗赠,最后的遗赠.7z,zui hou de yi zeng.7z
