JoJo的奇妙冒险 未来遗产,JoJo的奇妙冒险 未来遗产.zip,JoJo de qi miao mao xian wei lai yi chan.zip
JoJo的奇妙冒险,JoJo的奇妙冒险.zip,JoJo de qi miao mao xian.zip
SD斗士,SD斗士.zip,SD dou shi.zip
SNK VS CAPCOM,SNK VS CAPCOM.zip,SNK VS CAPCOM.zip
WWF疯狂摔角,WWF疯狂摔角.zip,WWF feng kuang shuai jiao.zip
X战警 磁场原子人,X战警 磁场原子人.zip,X zhan jing ci chang yuan zi ren.zip
X战警对街头霸王,X战警对街头霸王.zip,X zhan jing dui jie tou ba wang.zip
傲剑狂刀 加强版,傲剑狂刀 加强版.zip,ao jian kuang dao jia qiang ban.zip
傲剑狂刀,傲剑狂刀.zip,ao jian kuang dao.zip
奥特曼,奥特曼.zip,ao te man.zip
霸王忍法帖,霸王忍法帖.zip,ba wang ren fa tie.zip
暴力格斗,暴力格斗.zip,bao li ge dou.zip
爆裂人复仇,爆裂人复仇.zip,bao lie ren fu chou.zip
爆裂人,爆裂人.zip,bao lie ren.zip
bloodwar,bloodwar.zip,bloodwar.zip
超级街头霸王2-新的挑战者,超级街头霸王2-新的挑战者.zip,chao ji jie tou ba wang 2- xin de tiao zhan zhe.zip
超级街头霸王2-Turbo,超级街头霸王2-Turbo.zip,chao ji jie tou ba wang 2-Turbo.zip
超级口袋战士,超级口袋战士.zip,chao ji kou dai zhan shi.zip
超级漫画英雄对街头霸王,超级漫画英雄对街头霸王.zip,chao ji man hua ying xiong dui jie tou ba wang.zip
超级漫画英雄对卡普空,超级漫画英雄对卡普空.zip,chao ji man hua ying xiong dui ka pu kong.zip
超级漫画英雄,超级漫画英雄.zip,chao ji man hua ying xiong.zip
超级拳无虚发,超级拳无虚发.zip,chao ji quan wu xu fa.zip
超级战斗棋,超级战斗棋.zip,chao ji zhan dou qi.zip
超人学园钢帝王,超人学园钢帝王.zip,chao ren xue yuan gang di wang.zip
沉默战士,沉默战士.zip,chen mo zhan shi.zip
成龙传说1,成龙传说1.zip,cheng long chuan shuo 1.zip
成龙传说2,成龙传说2.zip,cheng long chuan shuo 2.zip
赤色大地,赤色大地.zip,chi se da di.zip
大江户格斗,大江户格斗.zip,da jiang hu ge dou.zip
斗姬传承,斗姬传承.zip,dou ji chuan cheng.zip
斗士的历史 卡诺夫的复仇,斗士的历史 卡诺夫的复仇.7z,dou shi de li shi ka nuo fu de fu chou.7z
斗士的历史,斗士的历史.7z,dou shi de li shi.7z
断仇牙,断仇牙.zip,duan chou ya.zip
堕落天使,堕落天使.zip,duo luo tian shi.zip
饿狼传说1,饿狼传说1.zip,e lang chuan shuo 1.zip
饿狼传说2,饿狼传说2.zip,e lang chuan shuo 2.zip
饿狼传说3,饿狼传说3.zip,e lang chuan shuo 3.zip
饿狼传说RB特别版,饿狼传说RB特别版.zip,e lang chuan shuo RB te bie ban.zip
饿狼传说RB1,饿狼传说RB1.zip,e lang chuan shuo RB1.zip
饿狼传说RB2,饿狼传说RB2.zip,e lang chuan shuo RB2.zip
饿狼传说SP,饿狼传说SP.zip,e lang chuan shuo SP.zip
饿狼传说 狼之印记,饿狼传说 狼之印记.zip,e lang chuan shuo lang zhi yin ji.zip
恶魔救世主 吸血鬼贵族,恶魔救世主 吸血鬼贵族.zip,e mo jiu shi zhu xi xue gui gui zu.zip
恶魔猎人2 恶魔的复仇,恶魔猎人2 恶魔的复仇.zip,e mo lie ren 2 e mo de fu chou.zip
恶魔战士1 午夜斗士,恶魔战士1 午夜斗士.zip,e mo zhan shi 1 wu ye dou shi.zip
恶魔战士2 恶魔救世主,恶魔战士2 恶魔救世主.zip,e mo zhan shi 2 e mo jiu shi zhu.zip
风云默示录1,风云默示录1.zip,feng yun mo shi lu 1.zip
风云默示录2,风云默示录2.zip,feng yun mo shi lu 2.zip
高达格斗战记,高达格斗战记.zip,gao da ge dou zhan ji.zip
格斗机器人,格斗机器人.zip,ge dou ji qi ren.zip
哥斯拉,哥斯拉.zip,ge si la.zip
功夫小子,功夫小子.zip,gong fu xiao zi.zip
豪血寺 新豪血寺一族 斗婚,豪血寺 新豪血寺一族 斗婚.zip,hao xue si xin hao xue si yi zu dou hun.zip
豪血寺一族1,豪血寺一族1.zip,hao xue si yi zu 1.zip
豪血寺一族2 外传,豪血寺一族2 外传.zip,hao xue si yi zu 2 wai zhuan.zip
豪血寺一族2,豪血寺一族2.zip,hao xue si yi zu 2.zip
黑暗边缘,黑暗边缘.zip,hei an bian yuan.zip
火激,火激.zip,huo ji.zip
火热火热7,火热火热7.zip,huo re huo re 7.zip
火线摔跤,火线摔跤.zip,huo xian shuai jiao.zip
机动战士高达EX复仇,机动战士高达EX复仇.zip,ji dong zhan shi gao da EX fu chou.zip
机甲战士2 全金属狂潮,机甲战士2 全金属狂潮.zip,ji jia zhan shi 2 quan jin shu kuang chao.zip
街头霸王1,街头霸王1.zip,jie tou ba wang 1.zip
街头霸王2 MIX,街头霸王2 MIX.zip,jie tou ba wang 2 MIX.zip
街头霸王2 加速版,街头霸王2 加速版.zip,jie tou ba wang 2 jia su ban.zip
街头霸王2 四大天王 (屠龙),街头霸王2 四大天王 (屠龙).zip,jie tou ba wang 2 si da tian wang ( tu long ).zip
街头霸王2 四大天王 (降龙),街头霸王2 四大天王 (降龙).zip,jie tou ba wang 2 si da tian wang ( xiang long ).zip
街头霸王2 四大天王,街头霸王2 四大天王.zip,jie tou ba wang 2 si da tian wang.zip
街头霸王2 天下斗士,街头霸王2 天下斗士.zip,jie tou ba wang 2 tian xia dou shi.zip
街头霸王3 1.0,街头霸王3 1.0.zip,jie tou ba wang 3 1.0.zip
街头霸王3 2.0,街头霸王3 2.0.zip,jie tou ba wang 3 2.0.zip
街头霸王3 3.0,街头霸王3 3.0.zip,jie tou ba wang 3 3.0.zip
街头霸王电影版,街头霸王电影版.zip,jie tou ba wang dian ying ban.zip
竞技场,竞技场.zip,jing ji chang.zip
可爱战士,可爱战士.zip,ke ai zhan shi.zip
恐龙大格斗,恐龙大格斗.zip,kong long da ge dou.zip
空手道大赛,空手道大赛.zip,kong shou dao da sai.zip
快打布兰达,快打布兰达.zip,kuai da bu lan da.zip
狂热格斗,狂热格斗.zip,kuang re ge dou.zip
狂热摔角,狂热摔角.zip,kuang re shuai jiao.zip
龙的天堂,龙的天堂.zip,long de tian tang.zip
龙吼,龙吼.zip,long hou.zip
龙虎之拳1,龙虎之拳1.zip,long hu zhi quan 1.zip
龙虎之拳2,龙虎之拳2.zip,long hu zhi quan 2.zip
龙虎之拳3,龙虎之拳3.zip,long hu zhi quan 3.zip
龙圣,龙圣.zip,long sheng.zip
龙珠Z VR大对决,龙珠Z VR大对决.zip,long zhu Z VR da dui jue.zip
龙珠格斗Z2 超武斗大会,龙珠格斗Z2 超武斗大会.zip,long zhu ge dou Z2 chao wu dou da hui.zip
龙珠格斗z,龙珠格斗z.zip,long zhu ge dou z.zip
洛克人1 力量之战,洛克人1 力量之战.zip,luo ke ren 1 li liang zhi zhan.zip
洛克人2 强大的战士,洛克人2 强大的战士.zip,luo ke ren 2 qiang da de zhan shi.zip
罗媚斗,罗媚斗.zip,luo mei dou.zip
幕府快打,幕府快打.zip,mu fu kuai da.zip
女三四郎,女三四郎.zip,nv san si lang.zip
强中强,强中强.zip,qiang zhong qiang.zip
拳皇2000,拳皇2000.zip,quan huang 2000.zip
拳皇2001,拳皇2001.zip,quan huang 2001.zip
拳皇2002,拳皇2002.zip,quan huang 2002.zip
拳皇2003,拳皇2003.zip,quan huang 2003.zip
拳皇2004 特别版,拳皇2004 特别版.zip,quan huang 2004 te bie ban.zip
拳皇94,拳皇94.zip,quan huang 94.zip
拳皇95,拳皇95.zip,quan huang 95.zip
拳皇96,拳皇96.zip,quan huang 96.zip
拳皇97,拳皇97.zip,quan huang 97.zip
拳皇98,拳皇98.zip,quan huang 98.zip
拳皇99,拳皇99.zip,quan huang 99.zip
拳皇十周年纪念加强版,拳皇十周年纪念加强版.zip,quan huang shi zhou nian ji nian jia qiang ban.zip
拳击格斗,拳击格斗.zip,quan ji ge dou.zip
热血对决,热血对决.zip,re xue dui jue.zip
少年街霸3MIX出招表,少年街霸3MIX出招表/,shao nian jie ba 3MIX chu zhao biao
少年街霸A1,少年街霸A1.zip,shao nian jie ba A1.zip
少年街霸A2,少年街霸A2.zip,shao nian jie ba A2.zip
少年街霸A3,少年街霸A3.zip,shao nian jie ba A3.zip
少年街霸Z1,少年街霸Z1.zip,shao nian jie ba Z1.zip
少年街霸Z3 MIX,少年街霸Z3 MIX.zip,shao nian jie ba Z3 MIX.zip
神凰拳,神凰拳.zip,shen huang quan.zip
胜利者乔,胜利者乔.zip,sheng li zhe qiao.zip
圣魔世纪,圣魔世纪.zip,sheng mo shi ji.zip
侍魂1 十二剑客录,侍魂1 十二剑客录.zip,shi hun 1 shi er jian ke lu.zip
侍魂2 真侍魂 霸王丸地狱变,侍魂2 真侍魂 霸王丸地狱变.zip,shi hun 2 zhen shi hun ba wang wan di yu bian.zip
侍魂3 斩红郎无双剑,侍魂3 斩红郎无双剑.zip,shi hun 3 zhan hong lang wu shuang jian.zip
侍魂4 天草降临,侍魂4 天草降临.zip,shi hun 4 tian cao jiang lin.zip
侍魂零,侍魂零.zip,shi hun ling.zip
世纪战士,世纪战士.zip,shi ji zhan shi.zip
世界英雄1,世界英雄1.zip,shi jie ying xiong 1.zip
世界英雄2喷射版,世界英雄2喷射版.zip,shi jie ying xiong 2 pen she ban.zip
世界英雄2,世界英雄2.zip,shi jie ying xiong 2.zip
世界英雄 完美版,世界英雄 完美版.zip,shi jie ying xiong wan mei ban.zip
时空杀手,时空杀手.zip,shi kong sha shou.zip
shogwarr,shogwarr.zip,shogwarr.zip
摔角霸王1,摔角霸王1.zip,shuai jiao ba wang 1.zip
摔角霸王2 连环爆裂,摔角霸王2 连环爆裂.zip,shuai jiao ba wang 2 lian huan bao lie.zip
摔角霸王2 最终之战,摔角霸王2 最终之战.zip,shuai jiao ba wang 2 zui zhong zhi zhan.zip
摔角机器人,摔角机器人.zip,shuai jiao ji qi ren.zip
双截龙格斗,双截龙格斗.zip,shuang jie long ge dou.zip
死亡艺术,死亡艺术.zip,si wang yi shu.zip
台风之眼-极超豪拳,台风之眼-极超豪拳.zip,tai feng zhi yan - ji chao hao quan.zip
天堂之门,天堂之门.zip,tian tang zhi men.zip
天外魔境真传 东方伊甸园,天外魔境真传 东方伊甸园.zip,tian wai mo jing zhen chuan dong fang yi dian yuan.zip
痛快进行曲,痛快进行曲.zip,tong kuai jin xing qu.zip
完美战士,完美战士.zip,wan mei zhan shi.zip
纹身刺客,纹身刺客.zip,wen shen ci ke.zip
武术冠军,武术冠军.zip,wu shu guan jun.zip
吸血鬼猎人 恶魔的复仇,吸血鬼猎人 恶魔的复仇.zip,xi xue gui lie ren e mo de fu chou.zip
星宿会战,星宿会战.zip,xing xiu hui zhan.zip
形意拳,形意拳.zip,xing yi quan.zip
血剑王朝1 魔刃降临,血剑王朝1 魔刃降临.zip,xue jian wang chao 1 mo ren jiang lin.zip
血剑王朝2 永恒战士,血剑王朝2 永恒战士.zip,xue jian wang chao 2 yong heng zhan shi.zip
血腥暴风,血腥暴风.zip,xue xing bao feng.zip
异种角斗士,异种角斗士.zip,yi zhong jue dou shi.zip
银河复仇者,银河复仇者.zip,yin he fu chou zhe.zip
银河快打,银河快打.zip,yin he kuai da.zip
隐忍,隐忍.zip,yin ren.zip
月华剑士1,月华剑士1.zip,yue hua jian shi 1.zip
月华剑士2,月华剑士2.zip,yue hua jian shi 2.zip
战斗之路,战斗之路.zip,zhan dou zhi lu.zip
真人快打1,真人快打1.zip,zhen ren kuai da 1.zip
真人快打2,真人快打2.zip,zhen ren kuai da 2.zip
真人快打3,真人快打3.zip,zhen ren kuai da 3.zip
至尊对决,至尊对决.zip,zhi zun dui jue.zip
终极街头霸王2,终极街头霸王2.zip,zhong ji jie tou ba wang 2.zip
终极真人快打3,终极真人快打3.zip,zhong ji zhen ren kuai da 3.zip
最强拳击手,最强拳击手.zip,zui qiang quan ji shou.zip
最终打击,最终打击.zip,zui zhong da ji.zip
