CT特种部队1,CT特种部队1.zip,CT te zhong bu dui 1.zip
CT特种部队2,CT特种部队2.zip,CT te zhong bu dui 2.zip
CT特种部队3,CT特种部队3.zip,CT te zhong bu dui 3.zip
F-Zero 巅峰之战,F-Zero 巅峰之战.zip,F-Zero dian feng zhi zhan.zip
F-Zero 极速传说,F-Zero 极速传说.zip,F-Zero ji su chuan shuo.zip
F1 2002,F1 2002.zip,F1 2002.zip
GT3锦标赛,GT3锦标赛.zip,GT3 jin biao sai.zip
RPG制造,RPG制造.zip,RPG zhi zao.zip
SD高达 G世纪,SD高达 G世纪.zip,SD gao da G shi ji.zip
SD高达 力量,SD高达 力量.zip,SD gao da li liang.zip
V拉力赛车3,V拉力赛车3.zip,V la li sai che 3.zip
Z.O.E.星域毁灭者 2173,Z.O.E.星域毁灭者 2173.zip,Z.O.E. xing yu hui mie zhe 2173.zip
阿滋漫画大王,阿滋漫画大王.zip,a zi man hua dai wang.zip
艾莉与安丝的炼金工房,艾莉与安丝的炼金工房.zip,ai li yu an si de lian jin gong fang.zip
奥特曼警备队,奥特曼警备队.zip,ao te man jing bei dui.zip
班卓卡祖伊格兰蒂的复仇,班卓卡祖伊格兰蒂的复仇.zip,ban zhuo ka zu yi ge lan di de fu chou.zip
宝贝龙 阴谋的本质与橙色古惑狼,宝贝龙 阴谋的本质与橙色古惑狼.zip,bao bei long yin mou de ben zhi yu cheng se gu huo lang.zip
暴力摩托,暴力摩托.zip,bao li mo tuo.zip
爆转陀螺 G点旋转,爆转陀螺 G点旋转.zip,bao zhuan tuo luo G dian xuan zhuan.zip
爆转陀螺,爆转陀螺.zip,bao zhuan tuo luo.zip
冰河世纪,冰河世纪.zip,bing he shi ji.zip
博德之门 黑暗联盟,博德之门 黑暗联盟.zip,bo de zhi men hei an lian meng.zip
波斯王子 时之沙,波斯王子 时之沙.zip,bo si wang zi shi zhi sha.zip
彩虹六号,彩虹六号.zip,cai hong liu hao.zip
仓鼠天堂,仓鼠天堂.zip,cang shu tian tang.zip
超级躲避球,超级躲避球.zip,chao ji duo bi qiu.zip
超级方块战士2,超级方块战士2.zip,chao ji fang kuai zhan shi 2.zip
超级猴子球,超级猴子球.zip,chao ji hou zi qiu.zip
超级火枪英雄,超级火枪英雄.zip,chao ji huo qiang ying xiong.zip
超级机器人大战A,超级机器人大战A.zip,chao ji ji qi ren da zhan A.zip
超级机器人大战D,超级机器人大战D.zip,chao ji ji qi ren da zhan D.zip
超级机器人大战J,超级机器人大战J.zip,chao ji ji qi ren da zhan J.zip
超级机器人大战OG1,超级机器人大战OG1.zip,chao ji ji qi ren da zhan OG1.zip
超级机器人大战OG2,超级机器人大战OG2.zip,chao ji ji qi ren da zhan OG2.zip
超级机器人大战R,超级机器人大战R.zip,chao ji ji qi ren da zhan R.zip
超级街头霸王2X,超级街头霸王2X.zip,chao ji jie tou ba wang 2X.zip
超级马里奥A1,超级马里奥A1.zip,chao ji ma li ao A1.zip
超级马里奥A2,超级马里奥A2.zip,chao ji ma li ao A2.zip
超级马里奥A3,超级马里奥A3.zip,chao ji ma li ao A3.zip
超级马里奥A4,超级马里奥A4.zip,chao ji ma li ao A4.zip
超级马里奥弹珠台,超级马里奥弹珠台.zip,chao ji ma li ao dan zhu tai.zip
超级马里奥对大金刚,超级马里奥对大金刚.zip,chao ji ma li ao dui da jin gang.zip
超级忍 复仇,超级忍 复仇.zip,chao ji ren fu chou.zip
超魔界村R,超魔界村R.zip,chao mo jie cun R.zip
超人特攻队,超人特攻队.zip,chao ren te gong dui.zip
超写真麻雀同窗会,超写真麻雀同窗会.zip,chao xie zhen ma que tong chuang hui.zip
车神3,车神3.zip,che shen 3.zip
沉默的狙击手,沉默的狙击手.zip,chen mo de ju ji shou.zip
沉默的遗迹 四狂神战记,沉默的遗迹 四狂神战记.zip,chen mo de yi ji si kuang shen zhan ji.zip
吃豆人精选集,吃豆人精选集.zip,chi dou ren jing xuan ji.zip
吃豆小精灵世界,吃豆小精灵世界.zip,chi dou xiao jing ling shi jie.zip
充填方块,充填方块.zip,chong tian fang kuai.zip
纯情房东俏房客,纯情房东俏房客.zip,chun qing fang dong qiao fang ke.zip
大盗伍佑卫门 新世代出动,大盗伍佑卫门 新世代出动.zip,da dao wu you wei men xin shi dai chu dong.zip
大金刚 摇摆之王,大金刚 摇摆之王.zip,da jin gang yao bai zhi wang.zip
打开天堂大门,打开天堂大门.zip,da kai tian tang da men.zip
打野鸡,打野鸡.zip,da ye ji.zip
大战略GBA,大战略GBA.zip,da zhan lve GBA.zip
地球冒险1+2,地球冒险1+2.zip,di qiu mao xian 1+2.zip
地球冒险3,地球冒险3.zip,di qiu mao xian 3.zip
迪士尼 全明星体育系列之摩托车,迪士尼 全明星体育系列之摩托车.zip,di shi ni quan ming xing ti yu xi lie zhi mo tuo che.zip
迪士尼 星际宝贝,迪士尼 星际宝贝.zip,di shi ni xing ji bao bei.zip
第一神拳 格斗赛,第一神拳 格斗赛.zip,di yi shen quan ge dou sai.zip
电梯大战,电梯大战.zip,dian ti da zhan.zip
动物管理员,动物管理员.zip,dong wu guan li yuan.zip
动物横町 心跳心跳救出大作战,动物横町 心跳心跳救出大作战.zip,dong wu heng ting xin tiao xin tiao jiu chu da zuo zhan.zip
都市的雪人,都市的雪人.zip,du shi de xue ren.zip
断剑 圣堂武士之迷,断剑 圣堂武士之迷.zip,duan jian sheng tang wu shi zhi mi.zip
多卡波王国Q,多卡波王国Q.zip,duo ka bo wang guo Q.zip
恶灵骑士,恶灵骑士.zip,e ling qi shi.zip
恶魔城1 月之轮回,恶魔城1 月之轮回.zip,e mo cheng 1 yue zhi lun hui.zip
恶魔城2 白夜协奏曲改版,恶魔城2 白夜协奏曲改版.zip,e mo cheng 2 bai ye xie zou qu gai ban.zip
恶魔城2 白夜协奏曲,恶魔城2 白夜协奏曲.zip,e mo cheng 2 bai ye xie zou qu.zip
恶魔城3 玛利亚之章,恶魔城3 玛利亚之章.zip,e mo cheng 3 ma li ya zhi zhang.zip
恶魔城3 晓月圆舞曲改版,恶魔城3 晓月圆舞曲改版.zip,e mo cheng 3 xiao yue yuan wu qu gai ban.zip
恶魔城3 晓月圆舞曲,恶魔城3 晓月圆舞曲.zip,e mo cheng 3 xiao yue yuan wu qu.zip
恶魔城 三饶传奇,恶魔城 三饶传奇.zip,e mo cheng san rao chuan qi.zip
范海辛,范海辛.zip,fan hai xin.zip
番茄酱王国大冒险,番茄酱王国大冒险.zip,fan qie jiang wang guo da mao xian.zip
蜂巢,蜂巢.zip,feng chao.zip
疯狂大脚车,疯狂大脚车.zip,feng kuang da jiao che.zip
疯狂驾驶员,疯狂驾驶员.zip,feng kuang jia shi yuan.zip
风之克罗诺亚1 梦之帝国,风之克罗诺亚1 梦之帝国.zip,feng zhi ke luo nuo ya 1 meng zhi di guo.zip
风之克罗诺亚2 梦之锦标赛,风之克罗诺亚2 梦之锦标赛.zip,feng zhi ke luo nuo ya 2 meng zhi jin biao sai.zip
钢铁帝国,钢铁帝国.zip,gang tie di guo.zip
钢之炼金术师 回忆之奏鸣曲,钢之炼金术师 回忆之奏鸣曲.zip,gang zhi lian jin shu shi hui yi zhi zou ming qu.zip
钢之炼金术师 迷走的轮舞曲,钢之炼金术师 迷走的轮舞曲.zip,gang zhi lian jin shu shi mi zou de lun wu qu.zip
高达Seed Destiny,高达Seed Destiny.zip,gao da Seed Destiny.zip
高达Seed 战场上的朋友与你,高达Seed 战场上的朋友与你.zip,gao da Seed zhan chang shang de peng you yu ni.zip
高达Seed 战斗突击,高达Seed 战斗突击.zip,gao da Seed zhan dou tu ji.zip
高级战争1,高级战争1.zip,gao ji zhan zheng 1.zip
高级战争2 Sami强化版,高级战争2 Sami强化版.zip,gao ji zhan zheng 2 Sami qiang hua ban.zip
高级战争2,高级战争2.zip,gao ji zhan zheng 2.zip
高速改装赛车,高速改装赛车.zip,gao su gai zhuang sai che.zip
公路之旅 变速齿轮,公路之旅 变速齿轮.zip,gong lu zhi lv bian su chi lun.zip
公主同盟,公主同盟.zip,gong zhu tong meng.zip
古惑狼1,古惑狼1.zip,gu huo lang 1.zip
古惑狼2,古惑狼2.zip,gu huo lang 2.zip
古惑狼 暴跳的罗彼德与紫色宝贝龙,古惑狼 暴跳的罗彼德与紫色宝贝龙.zip,gu huo lang bao tiao de luo bi de yu zi se bao bei long.zip
古惑狼赛车,古惑狼赛车.zip,gu huo lang sai che.zip
古惑狼 泰坦,古惑狼 泰坦.zip,gu huo lang tai tan.zip
咕噜咕噜火箭,咕噜咕噜火箭.zip,gu lu gu lu huo jian.zip
咕噜咕噜转转棒,咕噜咕噜转转棒.zip,gu lu gu lu zhuan zhuan bang.zip
古墓丽影 初代移植版,古墓丽影 初代移植版.zip,gu mu li ying chu dai yi zhi ban.zip
古墓丽影 传奇,古墓丽影 传奇.zip,gu mu li ying chuan qi.zip
古墓丽影 预言,古墓丽影 预言.zip,gu mu li ying yu yan.zip
怪兽小屋,怪兽小屋.zip,guai shou xiao wu.zip
怪物牧场A,怪物牧场A.zip,guai wu mu chang A.zip
怪物牧场A2,怪物牧场A2.zip,guai wu mu chang A2.zip
怪物史莱克2,怪物史莱克2.zip,guai wu shi lai ke 2.zip
怪物守护者,怪物守护者.zip,guai wu shou hu zhe.zip
怪物召唤士,怪物召唤士.zip,guai wu zhao huan shi.zip
光明与黑暗(光明力量),光明与黑暗(光明力量).zip,guang ming yu hei an ( guang ming li liang ).zip
光明之魂1,光明之魂1.zip,guang ming zhi hun 1.zip
光明之魂2,光明之魂2.zip,guang ming zhi hun 2.zip
鬼太郎 危机一发!,鬼太郎 危机一发!.zip,gui tai lang wei ji yi fa !.zip
鬼武者战略版,鬼武者战略版.zip,gui wu zhe zhan lve ban.zip
鬼眼狂刀,鬼眼狂刀.zip,gui yan kuang dao.zip
哈利波特 阿兹卡班的囚徒,哈利波特 阿兹卡班的囚徒.zip,ha li bo te a zi ka ban de qiu tu.zip
哈利波特 消失的密室,哈利波特 消失的密室.zip,ha li bo te xiao shi de mi shi.zip
哈姆太郎4,哈姆太郎4.zip,ha mu tai lang 4.zip
海底总动员,海底总动员.zip,hai di zong dong yuan.zip
海贼王 棒球进行曲,海贼王 棒球进行曲.zip,hai zei wang bang qiu jin xing qu.zip
海贼王 目标!赏金之王,海贼王 目标!赏金之王.zip,hai zei wang mu biao ! shang jin zhi wang.zip
海贼王 少年jump,海贼王 少年jump.zip,hai zei wang shao nian jump.zip
好狗狗星系,好狗狗星系.zip,hao gou gou xing xi.zip
合金弹头,合金弹头.zip,he jin dan tou.zip
合金之枪,合金之枪.zip,he jin zhi qiang.zip
后院运动 篮球,后院运动 篮球.zip,hou yuan yun dong lan qiu.zip
花火大会,花火大会.zip,hua huo da hui.zip
幻想传说,幻想传说.zip,huan xiang chuan shuo.zip
幻星神正义战士 地球的战士们,幻星神正义战士 地球的战士们.zip,huan xing shen zheng yi zhan shi di qiu de zhan shi men.zip
皇家骑士团外传,皇家骑士团外传.zip,huang jia qi shi tuan wai zhuan.zip
黄金太阳1 开启的封印,黄金太阳1 开启的封印.zip,huang jin tai yang 1 kai qi de feng yin.zip
黄金太阳2 失落的时代,黄金太阳2 失落的时代.zip,huang jin tai yang 2 shi luo de shi dai.zip
毁灭战士2,毁灭战士2.zip,hui mie zhan shi 2.zip
毁灭战士,毁灭战士.zip,hui mie zhan shi.zip
徽章战士 甲胄版,徽章战士 甲胄版.zip,hui zhang zhan shi jia zhou ban.zip
徽章战士 锹型虫版,徽章战士 锹型虫版.zip,hui zhang zhan shi qiao xing chong ban.zip
魂斗罗A,魂斗罗A.zip,hun dou luo A.zip
火焰纹章 奥莱西亚公主的重生之旅,火焰纹章 奥莱西亚公主的重生之旅.zip,huo yan wen zhang ao lai xi ya gong zhu de zhong sheng zhi lv.zip
火焰纹章 冰风烈焰,火焰纹章 冰风烈焰.zip,huo yan wen zhang bing feng lie yan.zip
火焰纹章 苍炎之勇者+晓之女神,火焰纹章 苍炎之勇者+晓之女神.zip,huo yan wen zhang cang yan zhi yong zhe + xiao zhi nv shen.zip
火焰纹章 封印之剑,火焰纹章 封印之剑.zip,huo yan wen zhang feng yin zhi jian.zip
火焰纹章 回声 另一个英雄王,火焰纹章 回声 另一个英雄王.zip,huo yan wen zhang hui sheng ling yi ge ying xiong wang.zip
火焰纹章 僵尸道长,火焰纹章 僵尸道长.zip,huo yan wen zhang jiang shi dao zhang.zip
火焰纹章 烈火之剑,火焰纹章 烈火之剑.zip,huo yan wen zhang lie huo zhi jian.zip
火焰纹章 魔剑镇魂曲,火焰纹章 魔剑镇魂曲.zip,huo yan wen zhang mo jian zhen hun qu.zip
火焰纹章 圣魔之光石,火焰纹章 圣魔之光石.zip,huo yan wen zhang sheng mo zhi guang shi.zip
火焰纹章 圣邪的意志,火焰纹章 圣邪的意志.zip,huo yan wen zhang sheng xie de yi zhi.zip
火焰纹章 四国之王,火焰纹章 四国之王.zip,huo yan wen zhang si guo zhi wang.zip
火焰纹章 天地之剑,火焰纹章 天地之剑.zip,huo yan wen zhang tian di zhi jian.zip
火焰纹章 祝福之心,火焰纹章 祝福之心.zip,huo yan wen zhang zhu fu zhi xin.zip
火炎职业摔跤,火炎职业摔跤.zip,huo yan zhi ye shuai jiao.zip
火影忍者 木叶战记,火影忍者 木叶战记.zip,huo ying ren zhe mu ye zhan ji.zip
火影忍者 最强忍者大集合1,火影忍者 最强忍者大集合1.zip,huo ying ren zhe zui qiang ren zhe da ji he 1.zip
火影忍者 最强忍者大集合2,火影忍者 最强忍者大集合2.zip,huo ying ren zhe zui qiang ren zhe da ji he 2.zip
击倒王,击倒王.zip,ji dao wang.zip
机动人,机动人.zip,ji dong ren.zip
几何世代 点点潮流,几何世代 点点潮流.zip,ji he shi dai dian dian chao liu.zip
几何世代 六角形针盘,几何世代 六角形针盘.zip,ji he shi dai liu jiao xing zhen pan.zip
几何世代 颜色方块,几何世代 颜色方块.zip,ji he shi dai yan se fang kuai.zip
机甲宝贝2 铃铛版,机甲宝贝2 铃铛版.zip,ji jia bao bei 2 ling dang ban.zip
机甲宝贝2 十字版,机甲宝贝2 十字版.zip,ji jia bao bei 2 shi zi ban.zip
寂静岭,寂静岭.zip,ji jing ling.zip
极品飞车10卡本峡谷,极品飞车10卡本峡谷.zip,ji pin fei che 10 ka ben xia gu.zip
机械化军队,机械化军队.zip,ji xie hua jun dui.zip
机械兽新世纪,机械兽新世纪.zip,ji xie shou xin shi ji.zip
甲虫王者 迈上冠军之路,甲虫王者 迈上冠军之路.zip,jia chong wang zhe mai shang guan jun zhi lu.zip
加勒比海盗2 亡者财宝,加勒比海盗2 亡者财宝.zip,jia le bi hai dao 2 wang zhe cai bao.zip
剑齿虎,剑齿虎.zip,jian chi hu.zip
降世神通 燃烧的大地,降世神通 燃烧的大地.zip,jiang shi shen tong ran shao de da di.zip
街头霸王 ZERO3,街头霸王 ZERO3.zip,jie tou ba wang ZERO3.zip
街头涂鸦,街头涂鸦.zip,jie tou tu ya.zip
节奏天国,节奏天国.zip,jie zou tian guo.zip
进化特区,进化特区.zip,jin hua te qu.zip
禁货猎人 时空的冒险者,禁货猎人 时空的冒险者.zip,jin huo lie ren shi kong de mao xian zhe.zip
金童卡修,金童卡修.zip,jin tong ka xiu.zip
究极截拳道 金太郎的复仇,究极截拳道 金太郎的复仇.zip,jiu ji jie quan dao jin tai lang de fu chou.zip
决斗！奥特曼英雄,决斗！奥特曼英雄.zip,jue dou ！ ao te man ying xiong.zip
恐龙猎人进化,恐龙猎人进化.zip,kong long lie ren jin hua.zip
空战神鹰2,空战神鹰2.zip,kong zhan shen ying 2.zip
口袋梦幻! 梦幻寻宝幸存挑战!,口袋梦幻! 梦幻寻宝幸存挑战!.zip,kou dai meng huan ! meng huan xun bao xing cun tiao zhan !.zip
口袋实况棒球5,口袋实况棒球5.zip,kou dai shi kuang bang qiu 5.zip
口袋妖怪 不可思议的迷宫,口袋妖怪 不可思议的迷宫.zip,kou dai yao guai bu ke si yi de mi gong.zip
口袋妖怪弹珠台 红宝石蓝宝石,口袋妖怪弹珠台 红宝石蓝宝石.zip,kou dai yao guai dan zhu tai hong bao shi lan bao shi.zip
口袋妖怪 红宝石,口袋妖怪 红宝石.zip,kou dai yao guai hong bao shi.zip
口袋妖怪 火红,口袋妖怪 火红.zip,kou dai yao guai huo hong.zip
口袋妖怪 剑盾v10.2 铠之孤岛&冠之雪原,口袋妖怪 剑盾v10.2 铠之孤岛&冠之雪原.zip,kou dai yao guai jian dun v10.2 kai zhi gu dao & guan zhi xue yuan.zip
口袋妖怪 究极绿宝石v5.4 虹之抹灭者,口袋妖怪 究极绿宝石v5.4 虹之抹灭者.zip,kou dai yao guai jiu ji lv bao shi v5.4 hong zhi mo mie zhe.zip
口袋妖怪 蓝宝石,口袋妖怪 蓝宝石.zip,kou dai yao guai lan bao shi.zip
口袋妖怪 绿宝石,口袋妖怪 绿宝石.zip,kou dai yao guai lv bao shi.zip
口袋妖怪 梦想,口袋妖怪 梦想.zip,kou dai yao guai meng xiang.zip
口袋妖怪 漆黑的魅影 5.0EX+ BW,口袋妖怪 漆黑的魅影 5.0EX+ BW.zip,kou dai yao guai qi hei de mei ying 5.0EX+ BW.zip
口袋妖怪 漆黑的魅影 5.0EX+ DP,口袋妖怪 漆黑的魅影 5.0EX+ DP.zip,kou dai yao guai qi hei de mei ying 5.0EX+ DP.zip
口袋妖怪 去吧！皮卡丘,口袋妖怪 去吧！皮卡丘.zip,kou dai yao guai qu ba ！ pi ka qiu.zip
口袋妖怪 去吧！伊布,口袋妖怪 去吧！伊布.zip,kou dai yao guai qu ba ！ yi bu.zip
口袋妖怪 叶绿,口袋妖怪 叶绿.zip,kou dai yao guai ye lv.zip
快打旋风One,快打旋风One.zip,kuai da xuan feng One.zip
快乐小赛车,快乐小赛车.zip,kuai le xiao sai che.zip
蜡笔小新1 电影王国大冒险,蜡笔小新1 电影王国大冒险.zip,la bi xiao xin 1 dian ying wang guo da mao xian.zip
蜡笔小新2 食玩都大冒险,蜡笔小新2 食玩都大冒险.zip,la bi xiao xin 2 shi wan dou da mao xian.zip
乐高生化战士 英雄,乐高生化战士 英雄.zip,le gao sheng hua zhan shi ying xiong.zip
乐高星球大战1,乐高星球大战1.zip,le gao xing qiu da zhan 1.zip
乐高星球大战2,乐高星球大战2.zip,le gao xing qiu da zhan 2.zip
雷曼3,雷曼3.zip,lei man 3.zip
雷曼A,雷曼A.zip,lei man A.zip
雷曼 疯兔,雷曼 疯兔.zip,lei man feng tu.zip
雷蒙斯尼奇的不幸历险,雷蒙斯尼奇的不幸历险.zip,lei meng si ni qi de bu xing li xian.zip
雷霆万钧,雷霆万钧.zip,lei ting wan jun.zip
李小龙 英雄再现,李小龙 英雄再现.zip,li xiao long ying xiong zai xian.zip
烈火之炎,烈火之炎.zip,lie huo zhi yan.zip
龙战士1,龙战士1.zip,long zhan shi 1.zip
龙战士2,龙战士2.zip,long zhan shi 2.zip
龙珠Z 布欧的愤怒,龙珠Z 布欧的愤怒.zip,long zhu Z bu ou de fen nu.zip
龙珠Z 悟空的遗产2,龙珠Z 悟空的遗产2.zip,long zhu Z wu kong de yi chan 2.zip
龙珠Z 舞空斗剧,龙珠Z 舞空斗剧.zip,long zhu Z wu kong dou ju.zip
龙珠大冒险改版,龙珠大冒险改版.zip,long zhu da mao xian gai ban.zip
龙珠大冒险,龙珠大冒险.zip,long zhu da mao xian.zip
露娜传说,露娜传说.zip,lu na chuan shuo.zip
陆行鸟大陆,陆行鸟大陆.zip,lu xing niao da lu.zip
洛克人 EXE1,洛克人 EXE1.zip,luo ke ren EXE1.zip
洛克人 EXE2,洛克人 EXE2.zip,luo ke ren EXE2.zip
洛克人 EXE3 白,洛克人 EXE3 白.zip,luo ke ren EXE3 bai.zip
洛克人 EXE3 蓝,洛克人 EXE3 蓝.zip,luo ke ren EXE3 lan.zip
洛克人 EXE4 红日,洛克人 EXE4 红日.zip,luo ke ren EXE4 hong ri.zip
洛克人 EXE4 蓝月,洛克人 EXE4 蓝月.zip,luo ke ren EXE4 lan yue.zip
洛克人 EXE4.5 真实演习,洛克人 EXE4.5 真实演习.zip,luo ke ren EXE4.5 zhen shi yan xi.zip
洛克人 EXE5 布鲁斯之队,洛克人 EXE5 布鲁斯之队.zip,luo ke ren EXE5 bu lu si zhi dui.zip
洛克人 EXE5 卡奈尔之队,洛克人 EXE5 卡奈尔之队.zip,luo ke ren EXE5 ka nai er zhi dui.zip
洛克人 EXE6 凤凰对战,洛克人 EXE6 凤凰对战.zip,luo ke ren EXE6 feng huang dui zhan.zip
洛克人 EXE6 麒麟对战,洛克人 EXE6 麒麟对战.zip,luo ke ren EXE6 qi lin dui zhan.zip
洛克人 ZERO1,洛克人 ZERO1.zip,luo ke ren ZERO1.zip
洛克人 ZERO2,洛克人 ZERO2.zip,luo ke ren ZERO2.zip
洛克人 ZERO3,洛克人 ZERO3.zip,luo ke ren ZERO3.zip
洛克人 ZERO4,洛克人 ZERO4.zip,luo ke ren ZERO4.zip
洛克人与佛鲁迪,洛克人与佛鲁迪.zip,luo ke ren yu fu lu di.zip
螺旋破坏者,螺旋破坏者.zip,luo xuan po huai zhe.zip
马达加斯加,马达加斯加.zip,ma da jia si jia.zip
马里奥高尔夫A,马里奥高尔夫A.zip,ma li ao gao er fu A.zip
马里奥赛车,马里奥赛车.zip,ma li ao sai che.zip
马里奥网球 力量之旅,马里奥网球 力量之旅.zip,ma li ao wang qiu li liang zhi lv.zip
马里奥与路易基RPG,马里奥与路易基RPG.zip,ma li ao yu lu yi ji RPG.zip
美国龙 杰克龙,美国龙 杰克龙.zip,mei guo long jie ke long.zip
美丽新世界,美丽新世界.zip,mei li xin shi jie.zip
妹妹公主,妹妹公主.zip,mei mei gong zhu.zip
绵羊之心,绵羊之心.zip,mian yang zhi xin.zip
名侦探柯南 被狙击的侦探,名侦探柯南 被狙击的侦探.zip,ming zhen tan ke nan bei ju ji de zhen tan.zip
名侦探柯南 黎明之碑,名侦探柯南 黎明之碑.zip,ming zhen tan ke nan li ming zhi bei.zip
魔法封神,魔法封神.zip,mo fa feng shen.zip
魔法假期,魔法假期.zip,mo fa jia qi.zip
魔法老师涅吉 课外授业2,魔法老师涅吉 课外授业2.zip,mo fa lao shi nie ji ke wai shou ye 2.zip
魔法气泡,魔法气泡.zip,mo fa qi pao.zip
魔法元素,魔法元素.zip,mo fa yuan su.zip
模拟城市2000,模拟城市2000.zip,mo ni cheng shi 2000.zip
模拟大楼,模拟大楼.zip,mo ni da lou.zip
模拟人生 纯属意外,模拟人生 纯属意外.zip,mo ni ren sheng chun zhu yi wai.zip
模拟市民 上流社会,模拟市民 上流社会.zip,mo ni shi min shang liu she hui.zip
牧场物语 矿石镇的伙伴们 男孩篇,牧场物语 矿石镇的伙伴们 男孩篇.zip,mu chang wu yu kuang shi zhen de huo ban men nan hai pian.zip
牧场物语 矿石镇的伙伴们 女孩篇,牧场物语 矿石镇的伙伴们 女孩篇.zip,mu chang wu yu kuang shi zhen de huo ban men nv hai pian.zip
拿破仑,拿破仑.zip,na po lun.zip
逆转裁判1,逆转裁判1.zip,ni zhuan cai pan 1.zip
逆转裁判2,逆转裁判2.zip,ni zhuan cai pan 2.zip
逆转裁判3,逆转裁判3.zip,ni zhuan cai pan 3.zip
鸟人战队1 时空大作战,鸟人战队1 时空大作战.zip,niao ren zhan dui 1 shi kong da zuo zhan.zip
鸟人战队2 荒野力量,鸟人战队2 荒野力量.zip,niao ren zhan dui 2 huang ye li liang.zip
鸟人战队3 忍者风暴,鸟人战队3 忍者风暴.zip,niao ren zhan dui 3 ren zhe feng bao.zip
鸟人战队4 巨龙雷鸣,鸟人战队4 巨龙雷鸣.zip,niao ren zhan dui 4 ju long lei ming.zip
鸟人战队5 金刚战士S.P.D,鸟人战队5 金刚战士S.P.D.zip,niao ren zhan dui 5 jin gang zhan shi S.P.D.zip
女神战士西雅,女神战士西雅.zip,nv shen zhan shi xi ya.zip
叛星 战略指令,叛星 战略指令.zip,pan xing zhan lve zhi ling.zip
棋魂,棋魂.zip,qi hun.zip
奇奇怪界,奇奇怪界.zip,qi qi guai jie.zip
其他攻略,其他攻略/,qi ta gong lve
千年家族,千年家族.zip,qian nian jia zu.zip
侵略者,侵略者.zip,qin lve zhe.zip
轻松玩欢乐足球,轻松玩欢乐足球.zip,qing song wan huan le zu qiu.zip
拳皇EX1,拳皇EX1.zip,quan huang EX1.zip
拳皇EX2,拳皇EX2.zip,quan huang EX2.zip
热血物语EX加强版,热血物语EX加强版.zip,re xue wu yu EX jia qiang ban.zip
热血物语EX,热血物语EX.zip,re xue wu yu EX.zip
人型电脑天使心,人型电脑天使心.zip,ren xing dian nao tian shi xin.zip
人鱼恋曲,人鱼恋曲.zip,ren yu lian qu.zip
人猿泰山之重返丛林,人猿泰山之重返丛林.zip,ren yuan tai shan zhi chong fan cong lin.zip
忍者神龟1,忍者神龟1.zip,ren zhe shen gui 1.zip
忍者神龟2,忍者神龟2.zip,ren zhe shen gui 2.zip
忍者刑警,忍者刑警.zip,ren zhe xing jing.zip
融合方块,融合方块.zip,rong he fang kuai.zip
荣誉勋章 地下抵抗,荣誉勋章 地下抵抗.zip,rong yu xun zhang di xia di kang.zip
荣誉勋章 渗透者,荣誉勋章 渗透者.zip,rong yu xun zhang shen tou zhe.zip
塞尔达传说 四支剑,塞尔达传说 四支剑.zip,sai er da chuan shuo si zhi jian.zip
塞尔达传说 缩小帽,塞尔达传说 缩小帽.zip,sai er da chuan shuo suo xiao mao.zip
三国志 孔明传,三国志 孔明传.zip,san guo zhi kong ming chuan.zip
三国志 英杰传,三国志 英杰传.zip,san guo zhi ying jie chuan.zip
三国志,三国志.zip,san guo zhi.zip
森林寻宝历险记,森林寻宝历险记.zip,sen lin xun bao li xian ji.zip
闪灵二人组,闪灵二人组.zip,shan ling er ren zu.zip
上海,上海.zip,shang hai.zip
神奇四侠 霹雳火,神奇四侠 霹雳火.zip,shen qi si xia pi li huo.zip
神勇火星人 反冲大作战,神勇火星人 反冲大作战.zip,shen yong huo xing ren fan chong da zuo zhan.zip
圣诞夜惊魂,圣诞夜惊魂.zip,sheng dan ye jing hun.zip
圣铠传说,圣铠传说.zip,sheng kai chuan shuo.zip
圣石小子 光与暗的大决战,圣石小子 光与暗的大决战.zip,sheng shi xiao zi guang yu an de da jue zhan.zip
世嘉街机游戏集锦,世嘉街机游戏集锦.zip,shi jia jie ji you xi ji jin.zip
世界传说 换装迷宫2,世界传说 换装迷宫2.zip,shi jie chuan shuo huan zhuang mi gong 2.zip
世界传说 换装迷宫3,世界传说 换装迷宫3.zip,shi jie chuan shuo huan zhuang mi gong 3.zip
世界传说 召唤者的血统,世界传说 召唤者的血统.zip,shi jie chuan shuo zhao huan zhe de xue tong.zip
史酷比 原形毕露,史酷比 原形毕露.zip,shi ku bi yuan xing bi lu.zip
守护英雄,守护英雄.zip,shou hu ying xiong.zip
兽王记 王国的守护者,兽王记 王国的守护者.zip,shou wang ji wang guo de shou hu zhe.zip
蔬菜总动员 拉里男孩和坏苹果,蔬菜总动员 拉里男孩和坏苹果.zip,shu cai zong dong yuan la li nan hai he huai ping guo.zip
数独,数独.zip,shu du.zip
数码宝贝 战魂1,数码宝贝 战魂1.zip,shu ma bao bei zhan hun 1.zip
数码宝贝 战魂2,数码宝贝 战魂2.zip,shu ma bao bei zhan hun 2.zip
双截龙改版,双截龙改版.zip,shuang jie long gai ban.zip
双截龙,双截龙.zip,shuang jie long.zip
双刃,双刃.zip,shuang ren.zip
死神 血染尸魂界,死神 血染尸魂界.zip,si shen xue ran shi hun jie.zip
斯塔非的传说2,斯塔非的传说2.zip,si ta fei de chuan shuo 2.zip
死亡弹珠台,死亡弹珠台.zip,si wang dan zhu tai.zip
索尼克 A1,索尼克 A1.zip,suo ni ke A1.zip
索尼克 A2,索尼克 A2.zip,suo ni ke A2.zip
索尼克 A3,索尼克 A3.zip,suo ni ke A3.zip
索尼克 战斗,索尼克 战斗.zip,suo ni ke zhan dou.zip
塔克和符咒的神力,塔克和符咒的神力.zip,ta ke he fu zhou de shen li.zip
太空堡垒,太空堡垒.zip,tai kong bao lei.zip
太空频道5,太空频道5.zip,tai kong pin dao 5.zip
太空战斗机R,太空战斗机R.zip,tai kong zhan dou ji R.zip
泰思虎奇幻冒险2 丛林营救,泰思虎奇幻冒险2 丛林营救.zip,tai si hu qi huan mao xian 2 cong lin ying jiu.zip
淘金者,淘金者.zip,tao jin zhe.zip
桃太郎电铁G,桃太郎电铁G.zip,tao tai lang dian tie G.zip
天外魔境 青天之外,天外魔境 青天之外.zip,tian wai mo jing qing tian zhi wai.zip
铁臂阿童木,铁臂阿童木.zip,tie bi a tong mu.zip
铁拳,铁拳.zip,tie quan.zip
