通灵王 精神大师2,通灵王 精神大师2.zip,tong ling wang jing shen da shi 2.zip
通灵王 精神大师,通灵王 精神大师.zip,tong ling wang jing shen da shi.zip
通勤一笔,通勤一笔.zip,tong qin yi bi.zip
兔宝宝大冒险 糟糕的梦,兔宝宝大冒险 糟糕的梦.zip,tu bao bao da mao xian zao gao de meng.zip
图片攻略,图片攻略/,tu pian gong lve
托尼霍克的职业滑板2,托尼霍克的职业滑板2.zip,tuo ni huo ke de zhi ye hua ban 2.zip
托尼霍克的职业滑板3,托尼霍克的职业滑板3.zip,tuo ni huo ke de zhi ye hua ban 3.zip
瓦里奥世界,瓦里奥世界.zip,wa li ao shi jie.zip
瓦里奥制造,瓦里奥制造.zip,wa li ao zhi zao.zip
外星原始人,外星原始人.zip,wai xing yuan shi ren.zip
王国之心 记忆之链,王国之心 记忆之链.zip,wang guo zhi xin ji yi zhi lian.zip
网球王子2003 冰蓝,网球王子2003 冰蓝.zip,wang qiu wang zi 2003 bing lan.zip
网球王子2003 火红,网球王子2003 火红.zip,wang qiu wang zi 2003 huo hong.zip
网球王子2004 光荣之金,网球王子2004 光荣之金.zip,wang qiu wang zi 2004 guang rong zhi jin.zip
网球王子2004 时尚之银,网球王子2004 时尚之银.zip,wang qiu wang zi 2004 shi shang zhi yin.zip
网球王子 天才少年学院,网球王子 天才少年学院.zip,wang qiu wang zi tian cai shao nian xue yuan.zip
卧虎藏龙,卧虎藏龙.zip,wo hu cang long.zip
我们的太阳1,我们的太阳1.zip,wo men de tai yang 1.zip
我们的太阳2 太阳少年加戈,我们的太阳2 太阳少年加戈.zip,wo men de tai yang 2 tai yang shao nian jia ge.zip
我们的太阳3 逆袭的萨巴塔,我们的太阳3 逆袭的萨巴塔.zip,wo men de tai yang 3 ni xi de sa ba ta.zip
我是航空管制员,我是航空管制员.zip,wo shi hang kong guan zhi yuan.zip
武器种族传说 被封印的诗歌,武器种族传说 被封印的诗歌.zip,wu qi zhong zu chuan shuo bei feng yin de shi ge.zip
舞之刃 闪光,舞之刃 闪光.zip,wu zhi ren shan guang.zip
细胞分裂 明日潘多拉,细胞分裂 明日潘多拉.zip,xi bao fen lie ming ri pan duo la.zip
细胞分裂,细胞分裂.zip,xi bao fen lie.zip
西格马星际传奇,西格马星际传奇.zip,xi ge ma xing ji chuan qi.zip
侠盗猎车手A,侠盗猎车手A.zip,xia dao lie che shou A.zip
限制级特工,限制级特工.zip,xian zhi ji te gong.zip
小龙斯派罗1 冰冻的季节,小龙斯派罗1 冰冻的季节.zip,xiao long si pai luo 1 bing dong de ji jie.zip
小龙斯派罗2 火焰的季节,小龙斯派罗2 火焰的季节.zip,xiao long si pai luo 2 huo yan de ji jie.zip
小龙斯派罗传说 新的开始,小龙斯派罗传说 新的开始.zip,xiao long si pai luo chuan shuo xin de kai shi.zip
携带电兽2 力量版,携带电兽2 力量版.zip,xie dai dian shou 2 li liang ban.zip
携带电兽2 速度版,携带电兽2 速度版.zip,xie dai dian shou 2 su du ban.zip
辛普森之愤怒大道,辛普森之愤怒大道.zip,xin pu sen zhi fen nu da dao.zip
心跳烹饪系列2,心跳烹饪系列2.zip,xin tiao peng ren xi lie 2.zip
新约圣剑传说,新约圣剑传说.zip,xin yue sheng jian chuan shuo.zip
信长异闻录,信长异闻录.zip,xin zhang yi wen lu.zip
星光魔法使,星光魔法使.zip,xing guang mo fa shi.zip
星际传送者,星际传送者.zip,xing ji chuan song zhe.zip
幸运的卢克 通缉犯,幸运的卢克 通缉犯.zip,xing yun de lu ke tong ji fan.zip
星战前传III 西斯的复仇,星战前传III 西斯的复仇.zip,xing zhan qian chuan III xi si de fu chou.zip
星战前传 新帝国军队,星战前传 新帝国军队.zip,xing zhan qian chuan xin di guo jun dui.zip
星之卡比1 梦之泉,星之卡比1 梦之泉.zip,xing zhi ka bi 1 meng zhi quan.zip
星之卡比2 镜之大迷宫,星之卡比2 镜之大迷宫.zip,xing zhi ka bi 2 jing zhi da mi gong.zip
虚拟网球,虚拟网球.zip,xu ni wang qiu.zip
旋风特务 风暴突击者,旋风特务 风暴突击者.zip,xuan feng te wu feng bao tu ji zhe.zip
旋转瓦里奥,旋转瓦里奥.zip,xuan zhuan wa li ao.zip
眼镜君 让你喷饭,眼镜君 让你喷饭.zip,yan jing jun rang ni pen fan.zip
摇滚小姐妹,摇滚小姐妹.zip,yao gun xiao jie mei.zip
耀西的万有引力,耀西的万有引力.zip,yao xi de wan you yin li.zip
异次元敌人,异次元敌人.zip,yi ci yuan di ren.zip
伊登战机1,伊登战机1.zip,yi deng zhan ji 1.zip
伊登战机2,伊登战机2.zip,yi deng zhan ji 2.zip
异形战机3,异形战机3.zip,yi xing zhan ji 3.zip
银河战机,银河战机.zip,yin he zhan ji.zip
银河战士1 融合,银河战士1 融合.zip,yin he zhan shi 1 rong he.zip
银河战士2 零点任务,银河战士2 零点任务.zip,yin he zhan shi 2 ling dian ren wu.zip
银河战士 幽灵任务2 圣诞夜惊魂,银河战士 幽灵任务2 圣诞夜惊魂.zip,yin he zhan shi you ling ren wu 2 sheng dan ye jing hun.zip
勇者斗恶龙 旅团之心,勇者斗恶龙 旅团之心.zip,yong zhe dou e long lv tuan zhi xin.zip
勇者斗恶龙外传 特鲁内克大冒险2,勇者斗恶龙外传 特鲁内克大冒险2.zip,yong zhe dou e long wai zhuan te lu nei ke da mao xian 2.zip
勇者斗恶龙外传 特鲁内克大冒险3,勇者斗恶龙外传 特鲁内克大冒险3.zip,yong zhe dou e long wai zhuan te lu nei ke da mao xian 3.zip
勇者斗恶龙之元气史莱姆 冲击的尾巴团,勇者斗恶龙之元气史莱姆 冲击的尾巴团.zip,yong zhe dou e long zhi yuan qi shi lai mu chong ji de wei ba tuan.zip
幽灵陷阱,幽灵陷阱.zip,you ling xian jing.zip
友情足球4v4,友情足球4v4.zip,you qing zu qiu 4v4.zip
游戏王! 怪兽决斗8,游戏王! 怪兽决斗8.zip,you xi wang ! guai shou jue dou 8.zip
游戏王! 怪兽决斗EX2,游戏王! 怪兽决斗EX2.zip,you xi wang ! guai shou jue dou EX2.zip
游戏王! 怪兽决斗EX2006,游戏王! 怪兽决斗EX2006.zip,you xi wang ! guai shou jue dou EX2006.zip
游戏王! 怪兽决斗EX3,游戏王! 怪兽决斗EX3.zip,you xi wang ! guai shou jue dou EX3.zip
游戏王! 怪兽决斗GX,游戏王! 怪兽决斗GX.zip,you xi wang ! guai shou jue dou GX.zip
游戏王! 怪兽决斗国际版2,游戏王! 怪兽决斗国际版2.zip,you xi wang ! guai shou jue dou guo ji ban 2.zip
宇宙大作战,宇宙大作战.zip,yu zhou da zuo zhan.zip
宇宙巡航机,宇宙巡航机.zip,yu zhou xun hang ji.zip
原始人大进击,原始人大进击.zip,yuan shi ren da jin ji.zip
约束之地 利维艾拉,约束之地 利维艾拉.zip,yue shu zhi di li wei ai la.zip
越野摩托车A,越野摩托车A.zip,yue ye mo tuo che A.zip
炸弹人 Max2,炸弹人 Max2.zip,zha dan ren Max2.zip
炸弹人传说,炸弹人传说.zip,zha dan ren chuan shuo.zip
炸弹人杰特斯,炸弹人杰特斯.zip,zha dan ren jie te si.zip
战斗赛车,战斗赛车.zip,zhan dou sai che.zip
战国革命外传,战国革命外传.zip,zhan guo ge ming wai zhuan.zip
召唤之夜 铸剑物语1,召唤之夜 铸剑物语1.zip,zhao huan zhi ye zhu jian wu yu 1.zip
召唤之夜 铸剑物语2,召唤之夜 铸剑物语2.zip,zhao huan zhi ye zhu jian wu yu 2.zip
召唤之夜 铸剑物语3,召唤之夜 铸剑物语3.zip,zhao huan zhi ye zhu jian wu yu 3.zip
真女神转生,真女神转生.zip,zhen nv shen zhuan sheng.zip
真人快打 致命联盟,真人快打 致命联盟.zip,zhen ren kuai da zhi ming lian meng.zip
真三国无双A,真三国无双A.zip,zhen san guo wu shuang A.zip
侦探神宫寺三郎 白影少女,侦探神宫寺三郎 白影少女.zip,zhen tan shen gong si san lang bai ying shao nv.zip
侦探学园Q 挑战究极诡计,侦探学园Q 挑战究极诡计.zip,zhen tan xue yuan Q tiao zhan jiu ji gui ji.zip
正邪幻想史Zero,正邪幻想史Zero.zip,zheng xie huan xiang shi Zero.zip
正义联盟 闪电侠,正义联盟 闪电侠.zip,zheng yi lian meng shan dian xia.zip
指环王 双塔奇兵,指环王 双塔奇兵.zip,zhi huan wang shuang ta qi bing.zip
指环王 王者归来,指环王 王者归来.zip,zhi huan wang wang zhe gui lai.zip
植木的法则,植木的法则.zip,zhi mu de fa ze.zip
蜘蛛侠1 密斯特里奥的威胁,蜘蛛侠1 密斯特里奥的威胁.zip,zhi zhu xia 1 mi si te li ao de wei xie.zip
蜘蛛侠2 纽约之战,蜘蛛侠2 纽约之战.zip,zhi zhu xia 2 niu yue zhi zhan.zip
终极沙滩足球,终极沙滩足球.zip,zhong ji sha tan zu qiu.zip
终极蜘蛛侠,终极蜘蛛侠.zip,zhong ji zhi zhu xia.zip
重装机兵2 改,重装机兵2 改.zip,zhong zhuang ji bing 2 gai.zip
重装骑士,重装骑士.zip,zhong zhuang qi shi.zip
侏罗纪公园3,侏罗纪公园3.zip,zhu luo ji gong yuan 3.zip
壮志凌云 烈火风暴A,壮志凌云 烈火风暴A.zip,zhuang zhi ling yun lie huo feng bao A.zip
钻地小子2,钻地小子2.zip,zuan di xiao zi 2.zip
钻地小子A,钻地小子A.zip,zuan di xiao zi A.zip
最终幻想1+2,最终幻想1+2.zip,zui zhong huan xiang 1+2.zip
最终幻想4,最终幻想4.zip,zui zhong huan xiang 4.zip
最终幻想5,最终幻想5.zip,zui zhong huan xiang 5.zip
最终幻想6,最终幻想6.zip,zui zhong huan xiang 6.zip
最终幻想战略版A,最终幻想战略版A.zip,zui zhong huan xiang zhan lve ban A.zip
