阿比阿弟的冒险,阿比阿弟的冒险.zip,a bi a di de mao xian.zip
肮脏拉里 叛徒警察,肮脏拉里 叛徒警察.zip,ang zang la li pan tu jing cha.zip
暴力篮球,暴力篮球.zip,bao li lan qiu.zip
蝙蝠侠回归,蝙蝠侠回归.zip,bian fu xia hui gui.zip
冰球,冰球.zip,bing qiu.zip
超级毛球,超级毛球.zip,chao ji mao qiu.zip
超级障碍赛车,超级障碍赛车.zip,chao ji zhang ai sai che.zip
德古拉 不死神,德古拉 不死神.zip,de gu la bu si shen.zip
赌场,赌场.zip,du chang.zip
方程式赛车,方程式赛车.zip,fang cheng shi sai che.zip
废品狗,废品狗.zip,fei pin gou.zip
钢爪,钢爪.zip,gang zhao.zip
各多106 突变猴,各多106 突变猴.zip,ge duo 106 tu bian hou.zip
功夫饭馆,功夫饭馆.zip,gong fu fan guan.zip
海德拉,海德拉.zip,hai de la.zip
吉米康纳斯网球,吉米康纳斯网球.zip,ji mi kang na si wang qiu.zip
机器人橄榄球联赛2072,机器人橄榄球联赛2072.zip,ji qi ren gan lan qiu lian sai 2072.zip
机器人战场2084,机器人战场2084.zip,ji qi ren zhan chang 2084.zip
劲爆弹珠台,劲爆弹珠台.zip,jin bao dan zhu tai.zip
狂暴巨兽,狂暴巨兽.zip,kuang bao ju shou.zip
雷电,雷电.zip,lei dian.zip
领土之战,领土之战.zip,ling tu zhi zhan.zip
旅鼠总动员,旅鼠总动员.zip,lv shu zong dong yuan.zip
玛莉布沙滩排球,玛莉布沙滩排球.zip,ma li bu sha tan pai qiu.zip
迷宫任务,迷宫任务.zip,mi gong ren wu.zip
胖波比,胖波比.zip,pang bo bi.zip
泡泡危机,泡泡危机.zip,pao pao wei ji.zip
全面通缉,全面通缉.zip,quan mian tong ji.zip
忍者龙剑传1,忍者龙剑传1.zip,ren zhe long jian chuan 1.zip
忍者龙剑传3,忍者龙剑传3.zip,ren zhe long jian chuan 3.zip
沙漠风暴 重返海湾,沙漠风暴 重返海湾.zip,sha mo feng bao chong fan hai wan.zip
世界杯足球,世界杯足球.zip,shi jie bei zu qiu.zip
石器时代,石器时代.zip,shi qi shi dai.zip
兽之影,兽之影.zip,shou zhi ying.zip
双截龙,双截龙.zip,shuang jie long.zip
水管工人,水管工人.zip,shui guan gong ren.zip
四轮越野赛车,四轮越野赛车.zip,si lun yue ye sai che.zip
淘金者,淘金者.zip,tao jin zhe.zip
特技赛车,特技赛车.zip,te ji sai che.zip
万宝路向前冲,万宝路向前冲.zip,wan bao lu xiang qian chong.zip
腕刃战士2,腕刃战士2.zip,wan ren zhan shi 2.zip
维京少年,维京少年.zip,wei jing shao nian.zip
未来战士,未来战士.zip,wei lai zhan shi.zip
威力战士,威力战士.zip,wei li zhan shi.zip
异形VS铁血战士,异形VS铁血战士.zip,yi xing VS tie xue zhan shi.zip
异形任务,异形任务.zip,yi xing ren wu.zip
猿人传说,猿人传说.zip,yuan ren chuan shuo.zip
战车,战车.zip,zhan che.zip
战争地带2000,战争地带2000.zip,zhan zheng di dai 2000.zip
致命搏击 最终比赛,致命搏击 最终比赛.zip,zhi ming bo ji zui zhong bi sai.zip
