Vs. 宇宙巡航机,Vs. 宇宙巡航机.zip,Vs. yu zhou xun hang ji.zip
兵蜂 3,兵蜂 3.zip,bing feng 3.zip
苍穹红莲队,苍穹红莲队.zip,cang qiong hong lian dui.zip
超凤凰号,超凤凰号.zip,chao feng huang hao.zip
coh1000t,coh1000t.zip,coh1000t.zip
coh1002v,coh1002v.zip,coh1002v.zip
大流士G,大流士G.zip,da liu shi G.zip
konamigx,konamigx.zip,konamigx.zip
空间战机 汉化版,空间战机 汉化版.zip,kong jian zhan ji han hua ban.zip
镭射风暴,镭射风暴.zip,lei she feng bao.zip
棉花小魔女 2,棉花小魔女 2.zip,mian hua xiao mo nv 2.zip
棉花小魔女 回旋镖,棉花小魔女 回旋镖.zip,mian hua xiao mo nv hui xuan biao.zip
segabill,segabill.zip,segabill.zip
杀虫战记 汉化版,杀虫战记 汉化版.zip,sha chong zhan ji han hua ban.zip
沙罗曼蛇2,沙罗曼蛇2.zip,sha luo man she 2.zip
沙罗曼蛇 极上沙罗曼蛇,沙罗曼蛇 极上沙罗曼蛇.zip,sha luo man she ji shang sha luo man she.zip
沙罗曼蛇 性感沙罗曼蛇,沙罗曼蛇 性感沙罗曼蛇.zip,sha luo man she xing gan sha luo man she.zip
闪亮银枪,闪亮银枪.zip,shan liang yin qiang.zip
守护坦克,守护坦克.zip,shou hu tan ke.zip
四国战机1 特别版,四国战机1 特别版.zip,si guo zhan ji 1 te bie ban.zip
stvbios,stvbios.zip,stvbios.zip
宇宙巡航机 IV - 复活,宇宙巡航机 IV - 复活.zip,yu zhou xun hang ji IV - fu huo.zip
中东战争 汉化版,中东战争 汉化版.zip,zhong dong zhan zheng han hua ban.zip
