RB饿狼传说 I,RB饿狼传说 I.chd,RB e lang chuan shuo I.chd
RB饿狼传说 II,RB饿狼传说 II.chd,RB e lang chuan shuo II.chd
RB饿狼传说 特别版,RB饿狼传说 特别版.chd,RB e lang chuan shuo te bie ban.chd
霸王忍法帖,霸王忍法帖.chd,ba wang ren fa tie.chd
超铁战机,超铁战机.chd,chao tie zhan ji.chd
谍报飞龙,谍报飞龙.chd,die bao fei long.chd
斗士的历史,斗士的历史.chd,dou shi de li shi.chd
饿狼传说 I,饿狼传说 I.chd,e lang chuan shuo I.chd
饿狼传说 II,饿狼传说 II.chd,e lang chuan shuo II.chd
饿狼传说 III,饿狼传说 III.chd,e lang chuan shuo III.chd
饿狼传说 特别版,饿狼传说 特别版.chd,e lang chuan shuo te bie ban.chd
风云默示录,风云默示录.chd,feng yun mo shi lu.chd
合金弹头 I,合金弹头 I.chd,he jin dan tou I.chd
合金弹头 II,合金弹头 II.chd,he jin dan tou II.chd
惑星战机,惑星战机.chd,huo xing zhan ji.chd
极速英豪 拉力赛车,极速英豪 拉力赛车.chd,ji su ying hao la li sai che.chd
龙虎之拳 I,龙虎之拳 I.chd,long hu zhi quan I.chd
龙虎之拳 II,龙虎之拳 II.chd,long hu zhi quan II.chd
龙虎之拳 III,龙虎之拳 III.chd,long hu zhi quan III.chd
泡泡龙解谜,泡泡龙解谜.chd,pao pao long jie mi.chd
拳皇94,拳皇94.chd,quan huang 94.chd
拳皇95,拳皇95.chd,quan huang 95.chd
拳皇96,拳皇96.chd,quan huang 96.chd
拳皇97,拳皇97.chd,quan huang 97.chd
拳皇98,拳皇98.chd,quan huang 98.chd
拳皇99,拳皇99.chd,quan huang 99.chd
神凰拳,神凰拳.chd,shen huang quan.chd
圣十字剑 I,圣十字剑 I.chd,sheng shi zi jian I.chd
圣十字剑 II,圣十字剑 II.chd,sheng shi zi jian II.chd
侍魂 I,侍魂 I.chd,shi hun I.chd
侍魂 II,侍魂 II.chd,shi hun II.chd
侍魂 III,侍魂 III.chd,shi hun III.chd
侍魂 IV,侍魂 IV.chd,shi hun IV.chd
世界英雄 I,世界英雄 I.chd,shi jie ying xiong I.chd
世界英雄 II JET,世界英雄 II JET.chd,shi jie ying xiong II JET.chd
世界英雄 II,世界英雄 II.chd,shi jie ying xiong II.chd
世界英雄 完美版,世界英雄 完美版.chd,shi jie ying xiong wan mei ban.chd
视觉战机,视觉战机.chd,shi jue zhan ji.chd
双截龙,双截龙.chd,shuang jie long.chd
四国战机 II,四国战机 II.chd,si guo zhan ji II.chd
四国战机 III,四国战机 III.chd,si guo zhan ji III.chd
天外魔境真传,天外魔境真传.chd,tian wai mo jing zhen chuan.chd
银河快打,银河快打.chd,yin he kuai da.chd
月华剑士 I,月华剑士 I.chd,yue hua jian shi I.chd
月华剑士 II,月华剑士 II.chd,yue hua jian shi II.chd
战国传承 I,战国传承 I.chd,zhan guo chuan cheng I.chd
战国传承 II,战国传承 II.chd,zhan guo chuan cheng II.chd
真说侍魂武士道烈传,真说侍魂武士道烈传.chd,zhen shuo shi hun wu shi dao lie chuan.chd
