Capcom VS SNK PRO2000 HACK,Capcom VS SNK PRO2000 HACK.chd,Capcom VS SNK PRO2000 HACK.chd
阿兰多拉 HACK,阿兰多拉 HACK.chd,a lan duo la HACK.chd
北斗神拳 世纪末救世主传说 HACK,北斗神拳 世纪末救世主传说 HACK.chd,bei dou shen quan shi ji mo jiu shi zhu chuan shuo HACK.chd
北欧女神 HACK,北欧女神 HACK/menu.m3u,bei ou nv shen HACK
超级机器人大战F HACK,超级机器人大战F HACK.chd,chao ji ji qi ren da zhan F HACK.chd
超级机器人大战F完结篇 HACK,超级机器人大战F完结篇 HACK.chd,chao ji ji qi ren da zhan F wan jie pian HACK.chd
超级机器人大战α HACK,超级机器人大战α HACK.chd,chao ji ji qi ren da zhan α HACK.chd
出击飞龙2 HACK,出击飞龙2 HACK.chd,chu ji fei long 2 HACK.chd
大航海时代2 HACK,大航海时代2 HACK.chd,da hang hai shi dai 2 HACK.chd
第2次超级机器人大战 HACK,第2次超级机器人大战 HACK.chd,di 2 ci chao ji ji qi ren da zhan HACK.chd
独臂擎天 HACK,独臂擎天 HACK.chd,du bi qing tian HACK.chd
饿狼传说3D 野望 HACK,饿狼传说3D 野望 HACK.chd,e lang chuan shuo 3D ye wang HACK.chd
恶魔城X月下夜想曲 HACK,恶魔城X月下夜想曲 HACK.chd,e mo cheng X yue xia ye xiang qu HACK.chd
恶魔城X月下夜想曲 平衡版 HACK,恶魔城X月下夜想曲 平衡版 HACK.chd,e mo cheng X yue xia ye xiang qu ping heng ban HACK.chd
恶魔城历代记 HACK,恶魔城历代记 HACK.chd,e mo cheng li dai ji HACK.chd
公主西娜 HACK,公主西娜 HACK.chd,gong zhu xi na HACK.chd
合金装备 HACK,合金装备 HACK/menu.m3u,he jin zhuang bei HACK
魂斗罗进化 HACK,魂斗罗进化 HACK.chd,hun dou luo jin hua HACK.chd
魂斗罗战争遗产 HACK,魂斗罗战争遗产 HACK.chd,hun dou luo zhan zheng yi chan HACK.chd
寄生前夜1 HACK,寄生前夜1 HACK/menu.m3u,ji sheng qian ye 1 HACK
寄生前夜2 HACK,寄生前夜2 HACK/menu.m3u,ji sheng qian ye 2 HACK
街头霸王EX plus alpha HACK,街头霸王EX plus alpha HACK.chd,jie tou ba wang EX plus alpha HACK.chd
街头霸王EX2 Plus HACK,街头霸王EX2 Plus HACK.chd,jie tou ba wang EX2 Plus HACK.chd
恐龙危机2 HACK,恐龙危机2 HACK.chd,kong long wei ji 2 HACK.chd
雷电DX HACK,雷电DX HACK.chd,lei dian DX HACK.chd
镭射风暴 HACK,镭射风暴 HACK.chd,lei she feng bao HACK.chd
雷霆战机5 HACK,雷霆战机5 HACK.chd,lei ting zhan ji 5 HACK.chd
洛克人8 HACK,洛克人8 HACK.chd,luo ke ren 8 HACK.chd
洛克人X4 HACK,洛克人X4 HACK.chd,luo ke ren X4 HACK.chd
洛克人X5 HACK,洛克人X5 HACK.chd,luo ke ren X5 HACK.chd
洛克人X6 HACK,洛克人X6 HACK.chd,luo ke ren X6 HACK.chd
洛克人传奇合集 HACK,洛克人传奇合集 HACK.chd,luo ke ren chuan qi he ji HACK.chd
启示录 HACK,启示录 HACK.chd,qi shi lu HACK.chd
枪手天堂 HACK,枪手天堂 HACK.chd,qiang shou tian tang HACK.chd
热力公园 HACK,热力公园 HACK.chd,re li gong yuan HACK.chd
热血亲子 HACK,热血亲子 HACK.chd,re xue qin zi HACK.chd
荣誉勋章 HACK,荣誉勋章 HACK.chd,rong yu xun zhang HACK.chd
三国志2 霸王的大陆 HACK,三国志2 霸王的大陆 HACK.chd,san guo zhi 2 ba wang de da lu HACK.chd
三国志2 赤壁之战 HACK,三国志2 赤壁之战 HACK.chd,san guo zhi 2 chi bi zhi zhan HACK.chd
生化危机1 重制版 HACK,生化危机1 重制版 HACK.chd,sheng hua wei ji 1 zhong zhi ban HACK.chd
生化危机2 导剪版 HACK,生化危机2 导剪版 HACK/menu.m3u,sheng hua wei ji 2 dao jian ban HACK
生化危机3 导剪版 HACK,生化危机3 导剪版 HACK.chd,sheng hua wei ji 3 dao jian ban HACK.chd
侍魂新章 剑客异闻录 HACK,侍魂新章 剑客异闻录 HACK.chd,shi hun xin zhang jian ke yi wen lu HACK.chd
实况足球2000 HACK,实况足球2000 HACK.chd,shi kuang zu qiu 2000 HACK.chd
实况足球2002 HACK,实况足球2002 HACK.chd,shi kuang zu qiu 2002 HACK.chd
铁拳2 HACK,铁拳2 HACK.chd,tie quan 2 HACK.chd
铁拳3 HACK,铁拳3 HACK.chd,tie quan 3 HACK.chd
未来战警 HACK,未来战警 HACK.chd,wei lai zhan jing HACK.chd
武藏传 HACK,武藏传 HACK.chd,wu cang chuan HACK.chd
武装战斗车1 HACK,武装战斗车1 HACK.chd,wu zhuang zhan dou che 1 HACK.chd
武装战斗车2 HACK,武装战斗车2 HACK.chd,wu zhuang zhan dou che 2 HACK.chd
异形战机 HACK,异形战机 HACK.chd,yi xing zhan ji HACK.chd
尤特娜英雄战记 泪指轮传说 HACK,尤特娜英雄战记 泪指轮传说 HACK.chd,you te na ying xiong zhan ji lei zhi lun chuan shuo HACK.chd
宇宙巡航舰外传 HACK,宇宙巡航舰外传 HACK.chd,yu zhou xun hang jian wai zhuan HACK.chd
真魔装机神 HACK,真魔装机神 HACK.chd,zhen mo zhuang ji shen HACK.chd
装甲勇士 全金属狂潮 HACK,装甲勇士 全金属狂潮 HACK.chd,zhuang jia yong shi quan jin shu kuang chao HACK.chd
最终幻想2 HACK,最终幻想2 HACK.chd,zui zhong huan xiang 2 HACK.chd
最终幻想7 HACK,最终幻想7 HACK/menu.m3u,zui zhong huan xiang 7 HACK
最终幻想8 HACK,最终幻想8 HACK/menu.m3u,zui zhong huan xiang 8 HACK
最终幻想9 HACK,最终幻想9 HACK/menu.m3u,zui zhong huan xiang 9 HACK
