GT赛车 概念版 2002 东京日内瓦,GT赛车 概念版 2002 东京日内瓦.chd,GT sai che gai nian ban 2002 dong jing ri nei wa.chd
GT4 赛车,GT4 赛车.chd,GT4 sai che.chd
ICO古墓迷踪,ICO古墓迷踪.chd,ICO gu mu mi zong.chd
J联盟创造球会04,J联盟创造球会04.chd,J lian meng chuang zao qiu hui 04.chd
JOJO奇妙冒险 黄金旋风,JOJO奇妙冒险 黄金旋风.chd,JOJO qi miao mao xian huang jin xuan feng.chd
NBA2007,NBA2007.chd,NBA2007.chd
阿格斯战士,阿格斯战士.chd,a ge si zhan shi.chd
奥丁领域,奥丁领域.chd,ao ding ling yu.chd
暴走山地自行车,暴走山地自行车.chd,bao zou shan di zi xing che.chd
北欧女神2,北欧女神2.chd,bei ou nv shen 2.chd
比波猴  一起欢聚比波猴乐园,比波猴  一起欢聚比波猴乐园.chd,bi bo hou yi qi huan ju bi bo hou le yuan.chd
不可能的任务1,不可能的任务1.chd,bu ke neng de ren wu 1.chd
超级机器人大战 MX,超级机器人大战 MX.chd,chao ji ji qi ren da zhan MX.chd
超级机器人大战OG外传,超级机器人大战OG外传.chd,chao ji ji qi ren da zhan OG wai zhuan.chd
超级机器人大战OGS,超级机器人大战OGS.chd,chao ji ji qi ren da zhan OGS.chd
超级泡泡龙2,超级泡泡龙2.chd,chao ji pao pao long 2.chd
铳神(枪神)(枪墓),铳神(枪神)(枪墓).chd,chong shen ( qiang shen )( qiang mu ).chd
传颂之物 致逝者的摇篮,传颂之物 致逝者的摇篮.chd,chuan song zhi wu zhi shi zhe de yao lan.chd
大神传,大神传.chd,da shen chuan.chd
第二次超级机器人大战α,第二次超级机器人大战α.chd,di er ci chao ji ji qi ren da zhan α.chd
第三次超级机器人大战α 终焉的银河,第三次超级机器人大战α 终焉的银河.chd,di san ci chao ji ji qi ren da zhan α zhong yan de yin he.chd
多罗罗,多罗罗.chd,duo luo luo.chd
恶灵骑士,恶灵骑士.chd,e ling qi shi.chd
恶魔城 暗黑的诅咒,恶魔城 暗黑的诅咒.chd,e mo cheng an hei de zu zhou.chd
恶魔城 无罪的叹息,恶魔城 无罪的叹息.chd,e mo cheng wu zui de tan xi.chd
格林魔书,格林魔书.chd,ge lin mo shu.chd
各自的终曲,各自的终曲.chd,ge zi de zhong qu.chd
怪物猎人2,怪物猎人2.chd,guai wu lie ren 2.chd
怪物猎人G,怪物猎人G.chd,guai wu lie ren G.chd
鬼泣2 但丁篇,鬼泣2 但丁篇.chd,gui qi 2 dan ding pian.chd
鬼泣2 露西亚篇,鬼泣2 露西亚篇.chd,gui qi 2 lu xi ya pian.chd
鬼泣3 特别版,鬼泣3 特别版.chd,gui qi 3 te bie ban.chd
黑客帝国 尼奥之路,黑客帝国 尼奥之路.chd,hei ke di guo ni ao zhi lu.chd
红线,红线.chd,hong xian.chd
化解危机3,化解危机3.chd,hua jie wei ji 3.chd
皇牌空战5 不被歌颂的战争,皇牌空战5 不被歌颂的战争.chd,huang pai kong zhan 5 bu bei ge song de zhan zheng.chd
皇牌空战零 贝尔卡战争,皇牌空战零 贝尔卡战争.chd,huang pai kong zhan ling bei er ka zhan zheng.chd
魂斗罗neo,魂斗罗neo.chd,hun dou luo neo.chd
机动战士Z高达 奥古对泰坦斯,机动战士Z高达 奥古对泰坦斯.chd,ji dong zhan shi Z gao da ao gu dui tai tan si.chd
机动战士高达 一年战争,机动战士高达 一年战争.chd,ji dong zhan shi gao da yi nian zhan zheng.chd
寂静岭2 最期之诗,寂静岭2 最期之诗.chd,ji jing ling 2 zui qi zhi shi.chd
寂静岭4,寂静岭4.chd,ji jing ling 4.chd
九怨,九怨.chd,jiu yuan.chd
绝体绝命都市2 被冰封的记忆,绝体绝命都市2 被冰封的记忆.chd,jue ti jue ming du shi 2 bei bing feng de ji yi.chd
看我龙显神威（圣岛龙骑士）,看我龙显神威（圣岛龙骑士）.chd,kan wo long xian shen wei （ sheng dao long qi shi ）.chd
狂城丽影,狂城丽影.chd,kuang cheng li ying.chd
浪人传奇 心之迷宫,浪人传奇 心之迷宫.chd,lang ren chuan qi xin zhi mi gong.chd
泪指腕轮传说2 贝里克物语,泪指腕轮传说2 贝里克物语.chd,lei zhi wan lun chuan shuo 2 bei li ke wu yu.chd
两人的花火,两人的花火.chd,liang ren de hua huo.chd
零 刺青之声,零 刺青之声.chd,ling ci qing zhi sheng.chd
零 红蝶,零 红蝶.chd,ling hong die.chd
零 zero,零 zero.chd,ling zero.chd
龙背上的骑兵2,龙背上的骑兵2.chd,long bei shang de qi bing 2.chd
龙珠Z 武道会2,龙珠Z 武道会2.chd,long zhu Z wu dao hui 2.chd
麻雀派对 跟水著美女打几圈,麻雀派对 跟水著美女打几圈.chd,ma que pai dui gen shui zhu mei nv da ji quan.chd
梦幻骑士2,梦幻骑士2.chd,meng huan qi shi 2.chd
模拟人生 纯属意外,模拟人生 纯属意外.chd,mo ni ren sheng chun zhu yi wai.chd
摩托浪漫旅,摩托浪漫旅.chd,mo tuo lang man lv.chd
女忍,女忍.chd,nv ren.chd
蔷薇法则,蔷薇法则.chd,qiang wei fa ze.chd
荣誉勋章 突袭珍珠港,荣誉勋章 突袭珍珠港.chd,rong yu xun zhang tu xi zhen zhu gang.chd
荣誉勋章 先锋部队,荣誉勋章 先锋部队.chd,rong yu xun zhang xian feng bu dui.chd
荣誉之战 （李连杰 义气）,荣誉之战 （李连杰 义气）.chd,rong yu zhi zhan （ li lian jie yi qi ）.chd
三国志战记,三国志战记.chd,san guo zhi zhan ji.chd
神之手,神之手.chd,shen zhi shou.chd
生化危机4 国语配音,生化危机4 国语配音.chd,sheng hua wei ji 4 guo yu pei yin.chd
生化危机 爆发2,生化危机 爆发2.chd,sheng hua wei ji bao fa 2.chd
生化危机 代号维罗尼卡,生化危机 代号维罗尼卡.chd,sheng hua wei ji dai hao wei luo ni ka.chd
实况足球10,实况足球10.chd,shi kuang zu qiu 10.chd
实况足球2007 日本J联盟俱乐部 欧洲联赛,实况足球2007 日本J联盟俱乐部 欧洲联赛.chd,shi kuang zu qiu 2007 ri ben J lian meng ju le bu ou zhou lian sai.chd
实况足球2008 J联盟2008合辑,实况足球2008 J联盟2008合辑.chd,shi kuang zu qiu 2008 J lian meng 2008 he ji.chd
实况足球2010 蓝色武士的挑战,实况足球2010 蓝色武士的挑战.chd,shi kuang zu qiu 2010 lan se wu shi de tiao zhan.chd
实况足球2010 中文解说,实况足球2010 中文解说.chd,shi kuang zu qiu 2010 zhong wen jie shuo.chd
实况足球2011,实况足球2011.chd,shi kuang zu qiu 2011.chd
实况足球2012 中文解说,实况足球2012 中文解说.chd,shi kuang zu qiu 2012 zhong wen jie shuo.chd
实况足球2013,实况足球2013.chd,shi kuang zu qiu 2013.chd
实况足球2014,实况足球2014.chd,shi kuang zu qiu 2014.chd
实况足球6 最终进化版,实况足球6 最终进化版.chd,shi kuang zu qiu 6 zui zhong jin hua ban.chd
实况足球7 国际版 中文解说,实况足球7 国际版 中文解说.chd,shi kuang zu qiu 7 guo ji ban zhong wen jie shuo.chd
实况足球8 J联盟 亚洲冠军联赛,实况足球8 J联盟 亚洲冠军联赛.chd,shi kuang zu qiu 8 J lian meng ya zhou guan jun lian sai.chd
实况足球8 网络进化版 中文解说,实况足球8 网络进化版 中文解说.chd,shi kuang zu qiu 8 wang luo jin hua ban zhong wen jie shuo.chd
实况足球9,实况足球9.chd,shi kuang zu qiu 9.chd
兽王记,兽王记.chd,shou wang ji.chd
水星领航员 蓝色行星的天空,水星领航员 蓝色行星的天空.chd,shui xing ling hang yuan lan se xing xing de tian kong.chd
水星领航员 遥远记忆的幻象,水星领航员 遥远记忆的幻象.chd,shui xing ling hang yuan yao yuan ji yi de huan xiang.chd
死魂曲1,死魂曲1.chd,si hun qu 1.chd
死魂曲2,死魂曲2.chd,si hun qu 2.chd
宿命传说2,宿命传说2.chd,su ming chuan shuo 2.chd
天诛红,天诛红.chd,tian zhu hong.chd
旺达与巨像,旺达与巨像.chd,wang da yu ju xiang.chd
薇欧蕾特的工房 古拉姆那特的炼金术士2,薇欧蕾特的工房 古拉姆那特的炼金术士2.chd,wei ou lei te de gong fang gu la mu na te de lian jin shu shi 2.chd
卧虎藏龙,卧虎藏龙.chd,wo hu cang long.chd
新纪幻想 圣魔之魂2,新纪幻想 圣魔之魂2.chd,xin ji huan xiang sheng mo zhi hun 2.chd
新天魔界 混沌世代4,新天魔界 混沌世代4.chd,xin tian mo jie hun dun shi dai 4.chd
亚克传承 妖精战士 精灵的黄昏,亚克传承 妖精战士 精灵的黄昏.chd,ya ke chuan cheng yao jing zhan shi jing ling de huang hun.chd
异度传说3,异度传说3/menu.m3u,yi du chuan shuo 3
伊苏4 太阳的假面,伊苏4 太阳的假面.chd,yi su 4 tai yang de jia mian.chd
伊苏5 失落的沙之都凯芬,伊苏5 失落的沙之都凯芬.chd,yi su 5 shi luo de sha zhi dou kai fen.chd
樱花大战1 炽热之血,樱花大战1 炽热之血.chd,ying hua da zhan 1 chi re zhi xue.chd
樱花大战5 荒野的少女武士,樱花大战5 荒野的少女武士.chd,ying hua da zhan 5 huang ye de shao nv wu shi.chd
影之心1,影之心1.chd,ying zhi xin 1.chd
影之心2 导演剪辑版,影之心2 导演剪辑版/menu.m3u,ying zhi xin 2 dao yan jian ji ban
勇者斗恶龙8,勇者斗恶龙8.chd,yong zhe dou e long 8.chd
源氏 武士的黎明,源氏 武士的黎明.chd,yuan shi wu shi de li ming.chd
战栗杀机 铁拳妮娜威廉斯,战栗杀机 铁拳妮娜威廉斯.chd,zhan li sha ji tie quan ni na wei lian si.chd
战神1 D9和谐,战神1 D9和谐.chd,zhan shen 1 D9 he xie.chd
战神1 D9原版,战神1 D9原版.chd,zhan shen 1 D9 yuan ban.chd
战神2 D9和谐,战神2 D9和谐.chd,zhan shen 2 D9 he xie.chd
战神2 D9原版,战神2 D9原版.chd,zhan shen 2 D9 yuan ban.chd
真魂斗罗,真魂斗罗.chd,zhen hun dou luo.chd
真女神转生3 夜曲狂热编年史版,真女神转生3 夜曲狂热编年史版.chd,zhen nv shen zhuan sheng 3 ye qu kuang re bian nian shi ban.chd
真三国无双2,真三国无双2.chd,zhen san guo wu shuang 2.chd
真三国无双4,真三国无双4.chd,zhen san guo wu shuang 4.chd
真三国无双5,真三国无双5.chd,zhen san guo wu shuang 5.chd
指环王 第三纪元,指环王 第三纪元.chd,zhi huan wang di san ji yuan.chd
指环王 双塔奇兵,指环王 双塔奇兵.chd,zhi huan wang shuang ta qi bing.chd
指环王 王者归来,指环王 王者归来.chd,zhi huan wang wang zhe gui lai.chd
钟楼3,钟楼3.chd,zhong lou 3.chd
重装机兵 沙尘之锁,重装机兵 沙尘之锁.chd,zhong zhuang ji bing sha chen zhi suo.chd
装甲核心2（机战佣兵2） 另一个时代,装甲核心2（机战佣兵2） 另一个时代.chd,zhuang jia he xin 2（ ji zhan yong bing 2） ling yi ge shi dai.chd
捉猴啦2,捉猴啦2.chd,zhuo hou la 2.chd
捉猴啦3,捉猴啦3.chd,zhuo hou la 3.chd
捉猴啦 百万猴军劲爆大出击,捉猴啦 百万猴军劲爆大出击.chd,zhuo hou la bai wan hou jun jin bao da chu ji.chd
最终幻想X 国际版 V14,最终幻想X 国际版 V14/menu.m3u,zui zhong huan xiang X guo ji ban V14
最终幻想XII,最终幻想XII.chd,zui zhong huan xiang XII.chd
