死神 灵魂升温6,死神 灵魂升温6.iso,si shen ling hun sheng wen 6.iso
死神 灵魂升温7,死神 灵魂升温7.iso,si shen ling hun sheng wen 7.iso
宿命传说2,宿命传说2.iso,su ming chuan shuo 2.iso
太阁立志传4,太阁立志传4.iso,tai ge li zhi chuan 4.iso
太鼓达人1,太鼓达人1.iso,tai gu da ren 1.iso
太鼓达人2,太鼓达人2.iso,tai gu da ren 2.iso
太鼓达人DX,太鼓达人DX.iso,tai gu da ren DX.iso
太空侵略者EX,太空侵略者EX.iso,tai kong qin lve zhe EX.iso
讨鬼传,讨鬼传.iso,tao gui chuan.iso
提亚拉之泪 花冠的大地,提亚拉之泪 花冠的大地.iso,ti ya la zhi lei hua guan de da di.iso
天才麻将少女 阿知贺篇,天才麻将少女 阿知贺篇.iso,tian cai ma jiang shao nv a zhi he pian.iso
天才麻将少女,天才麻将少女.iso,tian cai ma jiang shao nv.iso
天地之门1,天地之门1.iso,tian di zhi men 1.iso
天地之门2,天地之门2.iso,tian di zhi men 2.iso
天神乱漫 无忧无虑,天神乱漫 无忧无虑.iso,tian shen luan man wu you wu lv.iso
天外魔境 第四默示录,天外魔境 第四默示录.iso,tian wai mo jing di si mo shi lu.iso
天诛4 影子刺客,天诛4 影子刺客.iso,tian zhu 4 ying zi ci ke.iso
铁拳5,铁拳5.iso,tie quan 5.iso
铁拳6,铁拳6.iso,tie quan 6.iso
头文字D,头文字D.iso,tou wen zi D.iso
突击！战车队,突击！战车队.iso,tu ji ！ zhan che dui.iso
脱逃大师1,脱逃大师1.cso,tuo tao da shi 1.cso
脱逃大师2,脱逃大师2.iso,tuo tao da shi 2.iso
瓦尔哈拉骑士,瓦尔哈拉骑士.iso,wa er ha la qi shi.iso
完美大战略 战场的霸者,完美大战略 战场的霸者.iso,wan mei da zhan lve zhan chang de ba zhe.iso
王国之心 梦中诞生,王国之心 梦中诞生.iso,wang guo zhi xin meng zhong dan sheng.iso
王牌鉴定人,王牌鉴定人.iso,wang pai jian ding ren.iso
未名传奇 刀锋兄弟会,未名传奇 刀锋兄弟会.iso,wei ming chuan qi dao feng xiong di hui.iso
维纳斯与布雷斯,维纳斯与布雷斯.iso,wei na si yu bu lei si.iso
未闻花名,未闻花名.iso,wei wen hua ming.iso
我的出租车,我的出租车.cso,wo de chu zu che.cso
我的妹妹不可能那么可爱 不可能有续作 汉化版 Disc1,我的妹妹不可能那么可爱 不可能有续作 汉化版 Disc1.iso,wo de mei mei bu ke neng na me ke ai bu ke neng you xu zuo han hua ban Disc1.iso
我的妹妹不可能那么可爱 不可能有续作,我的妹妹不可能那么可爱 不可能有续作,wo de mei mei bu ke neng na me ke ai bu ke neng you xu zuo.我的妹妹不可能那么可爱 不可能有续作
我的妹妹不可能那么可爱,我的妹妹不可能那么可爱.iso,wo de mei mei bu ke neng na me ke ai.iso
我的暑假4 濑户内少年侦探团 我和秘密的地图,我的暑假4 濑户内少年侦探团 我和秘密的地图.iso,wo de shu jia 4 lai hu nei shao nian zhen tan tuan wo he mi mi de di tu.iso
我的暑假 昆虫博士与天边山的秘密,我的暑假 昆虫博士与天边山的秘密.iso,wo de shu jia kun chong bo shi yu tian bian shan de mi mi.iso
我的造型师,我的造型师.iso,wo de zao xing shi.iso
我是航空管制官 成田机场,我是航空管制官 成田机场.iso,wo shi hang kong guan zhi guan cheng tian ji chang.iso
我是航空管制官 关空篇,我是航空管制官 关空篇.iso,wo shi hang kong guan zhi guan guan kong pian.iso
我是航空管制官 机场英雄那霸,我是航空管制官 机场英雄那霸.iso,wo shi hang kong guan zhi guan ji chang ying xiong na ba.iso
无双大蛇 魔王再临,无双大蛇 魔王再临.iso,wu shuang da she mo wang zai lin.iso
无双大蛇,无双大蛇.iso,wu shuang da she.iso
无头骑士异闻录,无头骑士异闻录.iso,wu tou qi shi yi wen lu.iso
无限回廊,无限回廊.iso,wu xian hui lang.iso
武装神姬 战斗大师Mk.2,武装神姬 战斗大师Mk.2.iso,wu zhuang shen ji zhan dou da shi Mk.2.iso
小小大星球,小小大星球.iso,xiao xiao da xing qiu.iso
小小克星,小小克星.iso,xiao xiao ke xing.iso
新纪幻想 圣魔战记2,新纪幻想 圣魔战记2.iso,xin ji huan xiang sheng mo zhan ji 2.iso
新牧场物语 无暇人生,新牧场物语 无暇人生.iso,xin mu chang wu yu wu xia ren sheng.iso
新世纪福音战士 钢铁女友1,新世纪福音战士 钢铁女友1.iso,xin shi ji fu yin zhan shi gang tie nv you 1.iso
新世纪福音战士 钢铁女友2,新世纪福音战士 钢铁女友2.iso,xin shi ji fu yin zhan shi gang tie nv you 2.iso
新天魔界 混沌世代4,新天魔界 混沌世代4.iso,xin tian mo jie hun dun shi dai 4.iso
新天魔界 混沌世代5,新天魔界 混沌世代5.cso,xin tian mo jie hun dun shi dai 5.cso
新天魔界 混沌世代6,新天魔界 混沌世代6.iso,xin tian mo jie hun dun shi dai 6.iso
心跳回忆4,心跳回忆4.iso,xin tiao hui yi 4.iso
心之彼端2,心之彼端2.iso,xin zhi bi duan 2.iso
星之海洋 初次启航,星之海洋 初次启航.iso,xing zhi hai yang chu ci qi hang.iso
星之梦,星之梦.iso,xing zhi meng.iso
喧哗番长兄弟 塔京大混战,喧哗番长兄弟 塔京大混战.iso,xuan hua fan zhang xiong di ta jing da hun zhan.iso
旋转方块,旋转方块.cso,xuan zhuan fang kuai.cso
学生会的一己之见Lv.2,学生会的一己之见Lv.2.iso,xue sheng hui de yi ji zhi jian Lv.2.iso
雪之少女 KANON,雪之少女 KANON.iso,xue zhi shao nv KANON.iso
一骑当千 交叉冲击,一骑当千 交叉冲击.iso,yi qi dang qian jiao cha chong ji.iso
一骑当千 雄辩之拳,一骑当千 雄辩之拳.iso,yi qi dang qian xiong bian zhi quan.iso
伊苏6,伊苏6.iso,yi su 6.iso
伊苏7,伊苏7.iso,yi su 7.iso
伊苏 菲尔迦纳的誓约,伊苏 菲尔迦纳的誓约.iso,yi su fei er jia na de shi yue.iso
伊苏vs空之轨迹 抉择传奇,伊苏vs空之轨迹 抉择传奇.iso,yi su vs kong zhi gui ji jue ze chuan qi.iso
异形战机,异形战机.iso,yi xing zhan ji.iso
银魂的双六,银魂的双六.iso,yin hun de shuang liu.iso
隐形妖怪,隐形妖怪.iso,yin xing yao guai.iso
音乐方块2,音乐方块2.iso,yin yue fang kuai 2.iso
音乐节拍,音乐节拍.cso,yin yue jie pai.cso
樱花大战1&2,樱花大战1&2.iso,ying hua da zhan 1&2.iso
樱花庄的宠物女孩,樱花庄的宠物女孩.iso,ying hua zhuang de chong wu nv hai.iso
英雄传说3 白发魔女,英雄传说3 白发魔女.iso,ying xiong chuan shuo 3 bai fa mo nv.iso
英雄传说4 朱红之泪,英雄传说4 朱红之泪.iso,ying xiong chuan shuo 4 zhu hong zhi lei.iso
英雄传说5 海之槛歌,英雄传说5 海之槛歌.iso,ying xiong chuan shuo 5 hai zhi kan ge.iso
英雄传说 碧之轨迹,英雄传说 碧之轨迹.iso,ying xiong chuan shuo bi zhi gui ji.iso
英雄传说 空之轨迹3RD,英雄传说 空之轨迹3RD.iso,ying xiong chuan shuo kong zhi gui ji 3RD.iso
英雄传说 空之轨迹FC,英雄传说 空之轨迹FC.iso,ying xiong chuan shuo kong zhi gui ji FC.iso
英雄传说 空之轨迹SC,英雄传说 空之轨迹SC.iso,ying xiong chuan shuo kong zhi gui ji SC.iso
英雄传说 零之轨迹,英雄传说 零之轨迹.iso,ying xiong chuan shuo ling zhi gui ji.iso
勇敢的故事 新的冒险者,勇敢的故事 新的冒险者.iso,yong gan de gu shi xin de mao xian zhe.iso
永恒传说,永恒传说.cso,yong heng chuan shuo.cso
勇者别嚣张1,勇者别嚣张1.iso,yong zhe bie xiao zhang 1.iso
勇者别嚣张2,勇者别嚣张2.iso,yong zhe bie xiao zhang 2.iso
勇者别嚣张3D,勇者别嚣张3D.iso,yong zhe bie xiao zhang 3D.iso
游戏王5D's 卡片力量4,游戏王5D's 卡片力量4.iso,you xi wang 5D's ka pian li liang 4.iso
游戏王5D's 卡片力量5,游戏王5D's 卡片力量5.iso,you xi wang 5D's ka pian li liang 5.iso
游戏王5D's 卡片力量6,游戏王5D's 卡片力量6.iso,you xi wang 5D's ka pian li liang 6.iso
游戏王对战怪兽GX 卡片力量1,游戏王对战怪兽GX 卡片力量1.iso,you xi wang dui zhan guai shou GX ka pian li liang 1.iso
游戏王对战怪兽GX 卡片力量2,游戏王对战怪兽GX 卡片力量2.iso,you xi wang dui zhan guai shou GX ka pian li liang 2.iso
游戏王对战怪兽GX 卡片力量3,游戏王对战怪兽GX 卡片力量3.iso,you xi wang dui zhan guai shou GX ka pian li liang 3.iso
游戏王 卡片力量SP,游戏王 卡片力量SP.iso,you xi wang ka pian li liang SP.iso
游戏也要听爸爸的话,游戏也要听爸爸的话.iso,you xi ye yao ting ba ba de hua.iso
约束之地 利维艾拉,约束之地 利维艾拉.iso,yue shu zhi di li wei ai la.iso
炸弹人,炸弹人.iso,zha dan ren.iso
战场女武神2,战场女武神2.iso,zhan chang nv wu shen 2.iso
战场女武神3,战场女武神3.iso,zhan chang nv wu shen 3.iso
战国BASARA 历代英雄记,战国BASARA 历代英雄记.iso,zhan guo BASARA li dai ying xiong ji.iso
战国BASARA 战斗英雄,战国BASARA 战斗英雄.iso,zhan guo BASARA zhan dou ying xiong.iso
战国加农,战国加农.iso,zhan guo jia nong.iso
战神 奥林匹斯之链,战神 奥林匹斯之链.iso,zhan shen ao lin pi si zhi lian.iso
战神 斯巴达之魂,战神 斯巴达之魂.iso,zhan shen si ba da zhi hun.iso
召唤之夜4,召唤之夜4.iso,zhao huan zhi ye 4.iso
召唤之夜5,召唤之夜5.iso,zhao huan zhi ye 5.iso
这间活动室被不回家部占领了 学园瞬息万变篇,这间活动室被不回家部占领了 学园瞬息万变篇.iso,zhe jian huo dong shi bei bu hui jia bu zhan ling le xue yuan shun xi wan bian pian.iso
这间活动室被不回家部占领了 学园夏日战争篇,这间活动室被不回家部占领了 学园夏日战争篇.iso,zhe jian huo dong shi bei bu hui jia bu zhan ling le xue yuan xia ri zhan zheng pian.iso
真三国无双5,真三国无双5.iso,zhen san guo wu shuang 5.iso
真三国无双6,真三国无双6.iso,zhen san guo wu shuang 6.iso
真三国无双 二度进化,真三国无双 二度进化.iso,zhen san guo wu shuang er du jin hua.iso
真三国无双 联合突袭1,真三国无双 联合突袭1.iso,zhen san guo wu shuang lian he tu xi 1.iso
真三国无双 联合突袭2,真三国无双 联合突袭2.iso,zhen san guo wu shuang lian he tu xi 2.iso
侦探歌剧 少女福尔摩斯1.5,侦探歌剧 少女福尔摩斯1.5.iso,zhen tan ge ju shao nv fu er mo si 1.5.iso
侦探歌剧 少女福尔摩斯2,侦探歌剧 少女福尔摩斯2.iso,zhen tan ge ju shao nv fu er mo si 2.iso
智代后记,智代后记.iso,zhi dai hou ji.iso
智商狂热,智商狂热.iso,zhi shang kuang re.iso
中华雀士 天和牌娘Remix,中华雀士 天和牌娘Remix.cso,zhong hua que shi tian he pai niang Remix.cso
重生传说,重生传说.iso,zhong sheng chuan shuo.iso
周刊少年大乱斗 集结顶上大决战,周刊少年大乱斗 集结顶上大决战.iso,zhou kan shao nian da luan dou ji jie ding shang da jue zhan.iso
装甲核心 方程式前线,装甲核心 方程式前线.iso,zhuang jia he xin fang cheng shi qian xian.iso
捉猴啦 比波猴学院2,捉猴啦 比波猴学院2.iso,zhuo hou la bi bo hou xue yuan 2.iso
捉猴啦 比波猴学院外传,捉猴啦 比波猴学院外传.iso,zhuo hou la bi bo hou xue yuan wai zhuan.iso
捉猴啦 猴子爱作战,捉猴啦 猴子爱作战.iso,zhuo hou la hou zi ai zuo zhan.iso
最后的约定的故事,最后的约定的故事.iso,zui hou de yue ding de gu shi.iso
最后的战士,最后的战士.iso,zui hou de zhan shi.iso
最终幻想2,最终幻想2.iso,zui zhong huan xiang 2.iso
最终幻想3,最终幻想3.iso,zui zhong huan xiang 3.iso
最终幻想4,最终幻想4.iso,zui zhong huan xiang 4.iso
最终幻想7 核心危机,最终幻想7 核心危机.iso,zui zhong huan xiang 7 he xin wei ji.iso
最终幻想 纷争012,最终幻想 纷争012.iso,zui zhong huan xiang fen zheng 012.iso
最终幻想 纷争,最终幻想 纷争.iso,zui zhong huan xiang fen zheng.iso
最终幻想 零式,最终幻想 零式.iso,zui zhong huan xiang ling shi.iso
最终幻想战略版 狮子战争,最终幻想战略版 狮子战争.iso,zui zhong huan xiang zhan lve ban shi zi zhan zheng.iso
