428被封锁的涩谷,428被封锁的涩谷.iso,428 bei feng suo de se gu.iso
DJ MAX便携版1,DJ MAX便携版1.iso,DJ MAX bian xie ban 1.iso
DJ MAX便携版2,DJ MAX便携版2.iso,DJ MAX bian xie ban 2.iso
DJ MAX便携版3 酷懒之味,DJ MAX便携版3 酷懒之味.iso,DJ MAX bian xie ban 3 ku lan zhi wei.iso
Ever17,Ever17.iso,Ever17.iso
Fate Tiger大乱斗,Fate Tiger大乱斗.iso,Fate Tiger da luan dou.iso
GT赛车,GT赛车.iso,GT sai che.iso
GTA 血战唐人街,GTA 血战唐人街.iso,GTA xue zhan tang ren jie.iso
GTA 自由城的故事,GTA 自由城的故事.iso,GTA zi you cheng de gu shi.iso
GTA 罪恶都市传奇,GTA 罪恶都市传奇.iso,GTA zui e du shi chuan qi.iso
J联盟创造球会6,J联盟创造球会6.iso,J lian meng chuang zao qiu hui 6.iso
Love at once 麻将,Love at once 麻将.iso,Love at once ma jiang.iso
NeoGeo英雄 终极射击,NeoGeo英雄 终极射击.iso,NeoGeo ying xiong zhong ji she ji.iso
Never7,Never7.iso,Never7.iso
PM 德古拉 亡灵复苏,PM 德古拉 亡灵复苏.iso,PM de gu la wang ling fu su.iso
PM 糕点棋,PM 糕点棋.cso,PM gao dian qi.cso
PM 将棋,PM 将棋.cso,PM jiang qi.cso
PM 金属决斗,PM 金属决斗.cso,PM jin shu jue dou.cso
PM 绝对音感,PM 绝对音感.iso,PM jue dui yin gan.iso
PM 空间魔球 进化,PM 空间魔球 进化.iso,PM kong jian mo qiu jin hua.iso
PM 拉面天国,PM 拉面天国.cso,PM la mian tian guo.cso
PM 梦幻棒球,PM 梦幻棒球.cso,PM meng huan bang qiu.cso
PM 绵羊防御,PM 绵羊防御.cso,PM mian yang fang yu.cso
PM 喷嚏泡泡,PM 喷嚏泡泡.cso,PM pen ti pao pao.cso
PM 数独与数迷,PM 数独与数迷.iso,PM shu du yu shu mi.iso
PM 双人划艇,PM 双人划艇.cso,PM shuang ren hua ting.cso
PM 水下大作战,PM 水下大作战.cso,PM shui xia da zuo zhan.cso
PM 甜点工厂,PM 甜点工厂.cso,PM tian dian gong chang.cso
PM 旋转弹珠,PM 旋转弹珠.cso,PM xuan zhuan dan zhu.cso
PM 雅蜜雅蜜厨房,PM 雅蜜雅蜜厨房.iso,PM ya mi ya mi chu fang.iso
PM 指尖传情,PM 指尖传情.cso,PM zhi jian chuan qing.cso
Remember11,Remember11.iso,Remember11.iso
SD高达G世纪 超越世界,SD高达G世纪 超越世界.iso,SD gao da G shi ji chao yue shi jie.iso
SD高达G世纪 世界,SD高达G世纪 世界.iso,SD gao da G shi ji shi jie.iso
SD高达G世纪,SD高达G世纪.iso,SD gao da G shi ji.iso
阿克西斯的威胁V,阿克西斯的威胁V.iso,a ke xi si de wei xie V.iso
安琪莉可 魔恋之六骑士,安琪莉可 魔恋之六骑士.iso,an qi li ke mo lian zhi liu qi shi.iso
傲气雄鹰,傲气雄鹰.iso,ao qi xiong ying.iso
白骑士物语,白骑士物语.iso,bai qi shi wu yu.iso
白色相簿2 序章,白色相簿2 序章.iso,bai se xiang bu 2 xu zhang.iso
白衣性恋爱症候群 复诊,白衣性恋爱症候群 复诊.iso,bai yi xing lian ai zheng hou qun fu zhen.iso
半分钟英雄1,半分钟英雄1.iso,ban fen zhong ying xiong 1.iso
半分钟英雄2,半分钟英雄2.iso,ban fen zhong ying xiong 2.iso
北斗神拳雷奥外传 天之霸王,北斗神拳雷奥外传 天之霸王.iso,bei dou shen quan lei ao wai zhuan tian zhi ba wang.iso
被光守护的坡道,被光守护的坡道.iso,bei guang shou hu de po dao.iso
北欧女神 蕾娜斯,北欧女神 蕾娜斯.iso,bei ou nv shen lei na si.iso
笨蛋测试召唤兽,笨蛋测试召唤兽.iso,ben dan ce shi zhao huan shou.iso
比翼恋理的爱人,比翼恋理的爱人.iso,bi yi lian li de ai ren.iso
便利店,便利店.iso,bian li dian.iso
变态王子与不笑猫,变态王子与不笑猫.iso,bian tai wang zi yu bu xiao mao.iso
玻璃心公主,玻璃心公主.iso,bo li xin gong zhu.iso
不可饶恕,不可饶恕.iso,bu ke rao shu.iso
不可思议之国的冒险酒场,不可思议之国的冒险酒场.iso,bu ke si yi zhi guo de mao xian jiu chang.iso
苍翼默示录 厄运扳机,苍翼默示录 厄运扳机.iso,cang yi mo shi lu e yun ban ji.iso
苍翼默示录 连锁反应2,苍翼默示录 连锁反应2.iso,cang yi mo shi lu lian suo fan ying 2.iso
长门有希的暴走,长门有希的暴走.iso,chang men you xi de bao zou.iso
超级弹丸论破2 再见绝望学园,超级弹丸论破2 再见绝望学园.iso,chao ji dan wan lun po 2 zai jian jue wang xue yuan.iso
超级机器人大战A,超级机器人大战A.iso,chao ji ji qi ren da zhan A.iso
超级机器人大战MX,超级机器人大战MX.iso,chao ji ji qi ren da zhan MX.iso
超级星尘,超级星尘.iso,chao ji xing chen.iso
超杰交融,超杰交融.iso,chao jie jiao rong.iso
超时空要塞,超时空要塞.iso,chao shi kong yao sai.iso
出发！阿源君 夕阳下的大工物语,出发！阿源君 夕阳下的大工物语.iso,chu fa ！ a yuan jun xi yang xia de da gong wu yu.iso
初音 将全部的歌献给未来的你 汉化版,初音 将全部的歌献给未来的你 汉化版/,chu yin jiang quan bu de ge xian gei wei lai de ni han hua ban
初音 将全部的歌献给未来的你,初音 将全部的歌献给未来的你.PBP,chu yin jiang quan bu de ge xian gei wei lai de ni.PBP
初音未来 歌姬计划1,初音未来 歌姬计划1.iso,chu yin wei lai ge ji ji hua 1.iso
初音未来 歌姬计划2,初音未来 歌姬计划2.iso,chu yin wei lai ge ji ji hua 2.iso
初音未来 歌姬计划 扩展版,初音未来 歌姬计划 扩展版.iso,chu yin wei lai ge ji ji hua kuo zhan ban.iso
初音之歌 铃音之声,初音之歌 铃音之声.iso,chu yin zhi ge ling yin zhi sheng.iso
初音 注视着你瞳里的未来歌谣,初音 注视着你瞳里的未来歌谣.iso,chu yin zhu shi zhe ni tong li de wei lai ge yao.iso
传颂之物,传颂之物.iso,chuan song zhi wu.iso
纯白交响曲,纯白交响曲.iso,chun bai jiao xiang qu.iso
刺客信条 血缘,刺客信条 血缘.iso,ci ke xin tiao xue yuan.iso
大航海时代4,大航海时代4.iso,da hang hai shi dai 4.iso
大家的狂欢节,大家的狂欢节.iso,da jia de kuang huan jie.iso
大江户千两箱,大江户千两箱.iso,da jiang hu qian liang xiang.iso
大空军,大空军.iso,da kong jun.iso
大骑士物语,大骑士物语.iso,da qi shi wu yu.iso
大众高尔夫2,大众高尔夫2.iso,da zhong gao er fu 2.iso
大众网球,大众网球.iso,da zhong wang qiu.iso
打砖块 龙之王国,打砖块 龙之王国.iso,da zhuan kuai long zhi wang guo.iso
但丁的地狱,但丁的地狱.iso,dan ding de di yu.iso
蛋糕成堆,蛋糕成堆.iso,dan gao cheng dui.iso
弹丸论破 希望的学园和绝望的高中生,弹丸论破 希望的学园和绝望的高中生.iso,dan wan lun po xi wang de xue yuan he jue wang de gao zhong sheng.iso
刀魂 破碎命运,刀魂 破碎命运.iso,dao hun po sui ming yun.iso
刀剑神域 无限的瞬间,刀剑神域 无限的瞬间.iso,dao jian shen yu wu xian de shun jian.iso
德贝赛马时代,德贝赛马时代.iso,de bei sai ma shi dai.iso
第二次超级机器人大战Z 破界篇,第二次超级机器人大战Z 破界篇.iso,di er ci chao ji ji qi ren da zhan Z po jie pian.iso
抵抗 惩罚,抵抗 惩罚.iso,di kang cheng fa.iso
第七龙神2020-1,第七龙神2020-1.iso,di qi long shen 2020-1.iso
第七龙神2020-2,第七龙神2020-2.iso,di qi long shen 2020-2.iso
地狱犬计划,地狱犬计划.iso,di yu quan ji hua.iso
电击的皮罗德 天空之绊,电击的皮罗德 天空之绊.iso,dian ji de pi luo de tian kong zhi ban.iso
订购吧 我们的世界!,订购吧 我们的世界!.iso,ding gou ba wo men de shi jie !.iso
东方雀神,东方雀神.iso,dong fang que shen.iso
冬季恋歌,冬季恋歌.iso,dong ji lian ge.iso
东京鬼祓师 鸦乃杜学园奇谭,东京鬼祓师 鸦乃杜学园奇谭.iso,dong jing gui fu shi ya nai du xue yuan qi tan.iso
恶代官漫游记 正义之刃,恶代官漫游记 正义之刃.iso,e dai guan man you ji zheng yi zhi ren.iso
恶魔城X历代记,恶魔城X历代记.cso,e mo cheng X li dai ji.cso
恶魔猎人 驱魔圣女,恶魔猎人 驱魔圣女.iso,e mo lie ren qu mo sheng nv.iso
发明工坊,发明工坊.iso,fa ming gong fang.iso
翻译精灵 欧洲语言,翻译精灵 欧洲语言.iso,fan yi jing ling ou zhou yu yan.iso
翻译精灵,翻译精灵.iso,fan yi jing ling.iso
方块精灵,方块精灵.iso,fang kuai jing ling.iso
风来的西林3,风来的西林3.iso,feng lai de xi lin 3.iso
风来的西林4,风来的西林4.iso,feng lai de xi lin 4.iso
富豪街,富豪街.iso,fu hao jie.iso
高达AGE 领域加速,高达AGE 领域加速.iso,gao da AGE ling yu jia su.iso
高达AGE 宇宙驱动,高达AGE 宇宙驱动.iso,gao da AGE yu zhou qu dong.iso
高达SEED 联合VS扎夫特,高达SEED 联合VS扎夫特.iso,gao da SEED lian he VS zha fu te.iso
高达VS高达 Next Plus,高达VS高达 Next Plus.iso,gao da VS gao da Next Plus.iso
高达VS高达,高达VS高达.iso,gao da VS gao da.iso
高达 大混战,高达 大混战.iso,gao da da hun zhan.iso
高达 生存突击,高达 生存突击.iso,gao da sheng cun tu ji.iso
高达 战斗编年史,高达 战斗编年史.iso,gao da zhan dou bian nian shi.iso
高达 战斗宇宙,高达 战斗宇宙.iso,gao da zhan dou yu zhou.iso
高达 战术对决,高达 战术对决.iso,gao da zhan shu dui jue.iso
给牺牲者的通告 第一卷,给牺牲者的通告 第一卷.iso,gei xi sheng zhe de tong gao di yi juan.iso
公主联盟,公主联盟.iso,gong zhu lian meng.iso
咕噜小天使,咕噜小天使.iso,gu lu xiao tian shi.iso
古墓丽影7 传奇,古墓丽影7 传奇.iso,gu mu li ying 7 chuan qi.iso
古墓丽影 十周年,古墓丽影 十周年.iso,gu mu li ying shi zhou nian.iso
怪猎日记 暖洋洋的猫猫村G,怪猎日记 暖洋洋的猫猫村G.iso,guai lie ri ji nuan yang yang de mao mao cun G.iso
怪物猎人P1,怪物猎人P1.iso,guai wu lie ren P1.iso
怪物猎人P2,怪物猎人P2.iso,guai wu lie ren P2.iso
怪物猎人P2G,怪物猎人P2G.iso,guai wu lie ren P2G.iso
怪物猎人P3 HD版,怪物猎人P3 HD版.iso,guai wu lie ren P3 HD ban.iso
怪物猎人P3 普通版,怪物猎人P3 普通版.iso,guai wu lie ren P3 pu tong ban.iso
怪物塔防,怪物塔防.iso,guai wu ta fang.iso
光明之刃,光明之刃.iso,guang ming zhi ren.iso
光明之舟,光明之舟.iso,guang ming zhi zhou.iso
光之圣女 诸神的黄昏,光之圣女 诸神的黄昏.iso,guang zhi sheng nv zhu shen de huang hun.iso
鬼魂力量 遗产,鬼魂力量 遗产.iso,gui hun li liang yi chan.iso
诡计x逻辑 第二季,诡计x逻辑 第二季.iso,gui ji x luo ji di er ji.iso
诡计x逻辑 第一季,诡计x逻辑 第一季.iso,gui ji x luo ji di yi ji.iso
海猫鸣泣之时1,海猫鸣泣之时1.iso,hai mao ming qi zhi shi 1.iso
海猫鸣泣之时2,海猫鸣泣之时2.iso,hai mao ming qi zhi shi 2.iso
海贼王 冒险的黎明,海贼王 冒险的黎明.iso,hai zei wang mao xian de li ming.iso
寒蝉鸣泣之时,寒蝉鸣泣之时.iso,han chan ming qi zhi shi.iso
撼天神塔 黑暗回归,撼天神塔 黑暗回归.iso,han tian shen ta hei an hui gui.iso
合金弹头1-6合集 HACK,合金弹头1-6合集 HACK.iso,he jin dan tou 1-6 he ji HACK.iso
合金弹头XX 日版 HACK,合金弹头XX 日版 HACK.iso,he jin dan tou XX ri ban HACK.iso
合金装备 和平行者,合金装备 和平行者.iso,he jin zhuang bei he ping xing zhe.iso
合金装备 掌上行动,合金装备 掌上行动.iso,he jin zhuang bei zhang shang xing dong.iso
黑白棋大战,黑白棋大战.iso,hei bai qi da zhan.iso
虹吸战士 洛根之影,虹吸战士 洛根之影.cso,hong xi zhan shi luo gen zhi ying.cso
互动剧场 季节拥抱,互动剧场 季节拥抱.iso,hu dong ju chang ji jie yong bao.iso
互动剧场 茉莉花,互动剧场 茉莉花.iso,hu dong ju chang mo li hua.iso
互动剧场 双重角色,互动剧场 双重角色.iso,hu dong ju chang shuang chong jue se.iso
互动剧场 雪割花,互动剧场 雪割花.iso,hu dong ju chang xue ge hua.iso
互动剧场 最后的吸血鬼,互动剧场 最后的吸血鬼.iso,hu dong ju chang zui hou de xi xue gui.iso
幻想传说X 换装迷宫,幻想传说X 换装迷宫.iso,huan xiang chuan shuo X huan zhuang mi gong.iso
幻想传说,幻想传说.iso,huan xiang chuan shuo.iso
幻想国物语 可可利亚王国,幻想国物语 可可利亚王国.iso,huan xiang guo wu yu ke ke li ya wang guo.iso
幻想国物语 那鲁鲁王国,幻想国物语 那鲁鲁王国.iso,huan xiang guo wu yu na lu lu wang guo.iso
幻想水浒传1+2,幻想水浒传1+2.iso,huan xiang shui hu zhuan 1+2.iso
幻想水浒传 编织百年时光,幻想水浒传 编织百年时光.iso,huan xiang shui hu zhuan bian zhi bai nian shi guang.iso
欢迎来到绵羊村,欢迎来到绵羊村.iso,huan ying lai dao mian yang cun.iso
换装大战 强化,换装大战 强化.iso,huan zhuang da zhan qiang hua.iso
皇家骑士团 命运之轮,皇家骑士团 命运之轮.iso,huang jia qi shi tuan ming yun zhi lun.iso
皇牌空战X 诡影苍穹,皇牌空战X 诡影苍穹.iso,huang pai kong zhan X gui ying cang qiong.iso
皇牌空战X2 联合攻击,皇牌空战X2 联合攻击.iso,huang pai kong zhan X2 lian he gong ji.iso
荒野兵器 交叉火力,荒野兵器 交叉火力.iso,huang ye bing qi jiao cha huo li.iso
回转逆转变色龙,回转逆转变色龙.iso,hui zhuan ni zhuan bian se long.iso
混沌之脑 LOVE ChuChu,混沌之脑 LOVE ChuChu.iso,hun dun zhi nao LOVE ChuChu.iso
火影忍者疾风传 究极冲击,火影忍者疾风传 究极冲击.iso,huo ying ren zhe ji feng chuan jiu ji chong ji.iso
激斗传说,激斗传说.iso,ji dou chuan shuo.iso
寂静岭 破碎的记忆,寂静岭 破碎的记忆.iso,ji jing ling po sui de ji yi.iso
寂静岭 起源,寂静岭 起源.iso,ji jing ling qi yuan.iso
机密武装,机密武装.iso,ji mi wu zhuang.iso
极魔界村改,极魔界村改.iso,ji mo jie cun gai.iso
寄生前夜 第三次生日,寄生前夜 第三次生日.iso,ji sheng qian ye di san ci sheng ri.iso
加雷特编年史 红辉的魔石,加雷特编年史 红辉的魔石.iso,jia lei te bian nian shi hong hui de mo shi.iso
家庭教师 HR 战斗竞技场,家庭教师 HR 战斗竞技场.iso,jia ting jiao shi HR zhan dou jing ji chang.iso
家庭星空,家庭星空.iso,jia ting xing kong.iso
简单2000 麻将,简单2000 麻将.iso,jian dan 2000 ma jiang.iso
剑斗士 起源,剑斗士 起源.iso,jian dou shi qi yuan.iso
剑舞者 千年之约定,剑舞者 千年之约定.iso,jian wu zhe qian nian zhi yue ding.iso
街 命运的交叉点,街 命运的交叉点.iso,jie ming yun de jiao cha dian.iso
进攻!防守!战斗!,进攻!防守!战斗!.iso,jin gong ! fang shou ! zhan dou !.iso
劲舞团,劲舞团.iso,jin wu tuan.iso
经典迷宫 扶翼的魔装阵,经典迷宫 扶翼的魔装阵.iso,jing dian mi gong fu yi de mo zhuang zhen.iso
就算要我努力工作乙,就算要我努力工作乙.iso,jiu suan yao wo nu li gong zuo yi.iso
就算要我努力工作,就算要我努力工作.iso,jiu suan yao wo nu li gong zuo.iso
绝对迷宫格林童话,绝对迷宫格林童话.iso,jue dui mi gong ge lin tong hua.iso
绝对英雄改造计划,绝对英雄改造计划.iso,jue dui ying xiong gai zao ji hua.iso
绝体绝命都市3,绝体绝命都市3.iso,jue ti jue ming du shi 3.iso
克兰娜德 CLANNAD,克兰娜德 CLANNAD.iso,ke lan na de CLANNAD.iso
克鲁顿方块,克鲁顿方块.iso,ke lu dun fang kuai.iso
科学超电磁炮,科学超电磁炮.iso,ke xue chao dian ci pao.iso
库特Wafter,库特Wafter.iso,ku te Wafter.iso
跨越真实,跨越真实.iso,kua yue zhen shi.iso
困兽骑士,困兽骑士.iso,kun shou qi shi.iso
兰岛物语 少女的约定,兰岛物语 少女的约定.iso,lan dao wu yu shao nv de yue ding.iso
蓝色玫瑰 妖精和青眼的战士,蓝色玫瑰 妖精和青眼的战士.iso,lan se mei gui yao jing he qing yan de zhan shi.iso
乐克乐克1,乐克乐克1.iso,le ke le ke 1.iso
乐克乐克2,乐克乐克2.iso,le ke le ke 2.iso
乐克乐克 午夜狂欢节,乐克乐克 午夜狂欢节.iso,le ke le ke wu ye kuang huan jie.iso
离子射线++,离子射线++.iso,li zi she xian ++.iso
恋爱丘比特,恋爱丘比特.iso,lian ai qiu bi te.iso
恋爱与选举与巧克力,恋爱与选举与巧克力.iso,lian ai yu xuan ju yu qiao ke li.iso
炼狱1 洗罪塔,炼狱1 洗罪塔.iso,lian yu 1 xi zui ta.iso
炼狱2 通向天国的阶梯,炼狱2 通向天国的阶梯.iso,lian yu 2 tong xiang tian guo de jie ti.iso
凉宫春日的约定,凉宫春日的约定.iso,liang gong chun ri de yue ding.iso
凉宫春日的追忆,凉宫春日的追忆.iso,liang gong chun ri de zhui yi.iso
灵魂触发者,灵魂触发者.iso,ling hun chu fa zhe.iso
流行之神2,流行之神2.iso,liu xing zhi shen 2.iso
流行之神3,流行之神3.iso,liu xing zhi shen 3.iso
龙虎斗,龙虎斗.iso,long hu dou.iso
龙士传说 无限,龙士传说 无限.iso,long shi chuan shuo wu xian.iso
龙战士3,龙战士3.iso,long zhan shi 3.iso
龙之舞,龙之舞.cso,long zhi wu.cso
龙珠Z 真武道会2,龙珠Z 真武道会2.iso,long zhu Z zhen wu dao hui 2.iso
露娜 银星和声,露娜 银星和声.iso,lu na yin xing he sheng.iso
洛克人 反乱猎人X,洛克人 反乱猎人X.iso,luo ke ren fan luan lie ren X.iso
洛克人洛克人,洛克人洛克人.iso,luo ke ren luo ke ren.iso
萝球社!秘密的失物,萝球社!秘密的失物.iso,luo qiu she ! mi mi de shi wu.iso
萝球社,萝球社.iso,luo qiu she.iso
玛娜传奇 学园的炼金术士们,玛娜传奇 学园的炼金术士们.iso,ma na chuan qi xue yuan de lian jin shu shi men.iso
漫画同人会,漫画同人会.iso,man hua tong ren hui.iso
梅泽由香里的简单围棋,梅泽由香里的简单围棋.iso,mei ze you xiang li de jian dan wei qi.iso
梦幻骑士,梦幻骑士.iso,meng huan qi shi.iso
梦幻之星2 无限,梦幻之星2 无限.iso,meng huan zhi xing 2 wu xian.iso
梦幻之星2,梦幻之星2.iso,meng huan zhi xing 2.iso
萌坑之魔法使,萌坑之魔法使.iso,meng keng zhi mo fa shi.iso
萌麻将,萌麻将.iso,meng ma jiang.iso
萌妹梦工场EX,萌妹梦工场EX.iso,meng mei meng gong chang EX.iso
梦想灯笼,梦想灯笼.iso,meng xiang deng long.iso
迷失王国 魔窟的皇帝,迷失王国 魔窟的皇帝.iso,mi shi wang guo mo ku de huang di.iso
密室献祭 密室的祭品,密室献祭 密室的祭品.iso,mi shi xian ji mi shi de ji pin.iso
密域奇魂 伊底亚传承,密域奇魂 伊底亚传承.iso,mi yu qi hun yi di ya chuan cheng.iso
明日的世界,明日的世界.iso,ming ri de shi jie.iso
命运石之门,命运石之门.iso,ming yun shi zhi men.iso
魔法飞球,魔法飞球.cso,mo fa fei qiu.cso
魔法禁书目录,魔法禁书目录.iso,mo fa jin shu mu lu.iso
魔法少女奈叶A's 命运齿轮,魔法少女奈叶A's 命运齿轮.iso,mo fa shao nv nai ye A's ming yun chi lun.iso
魔法少女奈叶A's 王牌之战,魔法少女奈叶A's 王牌之战.iso,mo fa shao nv nai ye A's wang pai zhi zhan.iso
魔法少女小圆,魔法少女小圆.iso,mo fa shao nv xiao yuan.iso
魔唤精灵,魔唤精灵.iso,mo huan jing ling.iso
魔界战记1,魔界战记1.iso,mo jie zhan ji 1.iso
魔界战记2,魔界战记2.iso,mo jie zhan ji 2.iso
模拟人生2 宠物当家,模拟人生2 宠物当家.iso,mo ni ren sheng 2 chong wu dang jia.iso
模组世界赛车,模组世界赛车.iso,mo zu shi jie sai che.iso
某魔术与科学的群奏活剧,某魔术与科学的群奏活剧.iso,mou mo shu yu ke xue de qun zou huo ju.iso
牧场物语 蜜糖村和大家的愿望,牧场物语 蜜糖村和大家的愿望.iso,mu chang wu yu mi tang cun he da jia de yuan wang.iso
那由多之轨迹,那由多之轨迹.iso,na you duo zhi gui ji.iso
脑力锻炼2,脑力锻炼2.cso,nao li duan lian 2.cso
粘土人世纪,粘土人世纪.iso,nian tu ren shi ji.iso
鸟之诗 AIR,鸟之诗 AIR.iso,niao zhi shi AIR.iso
女皇之门 螺旋混沌,女皇之门 螺旋混沌.iso,nv huang zhi men luo xuan hun dun.iso
女神异闻录3,女神异闻录3.iso,nv shen yi wen lu 3.iso
偶像大师SP 思念之月,偶像大师SP 思念之月.iso,ou xiang da shi SP si nian zhi yue.iso
偶像大师 闪耀祭典 奇妙旋律,偶像大师 闪耀祭典 奇妙旋律.iso,ou xiang da shi shan yao ji dian qi miao xuan lv.iso
偶像大师 闪耀祭典 特殊音符,偶像大师 闪耀祭典 特殊音符.iso,ou xiang da shi shan yao ji dian te shu yin fu.iso
偶像大师 闪耀祭典 甜蜜音响,偶像大师 闪耀祭典 甜蜜音响.iso,ou xiang da shi shan yao ji dian tian mi yin xiang.iso
啪嗒砰1,啪嗒砰1.iso,pa da peng 1.iso
啪嗒砰2,啪嗒砰2.iso,pa da peng 2.iso
啪嗒砰3,啪嗒砰3.iso,pa da peng 3.iso
叛逆的鲁鲁修 失去的色彩,叛逆的鲁鲁修 失去的色彩.iso,pan ni de lu lu xiu shi qu de se cai.iso
胖公主 蛋糕一把抓,胖公主 蛋糕一把抓.iso,pang gong zhu dan gao yi ba zhua.iso
泡泡龙 口袋版,泡泡龙 口袋版.cso,pao pao long kou dai ban.cso
坡上台风,坡上台风.iso,po shang tai feng.iso
普利尼 俺当主角行吗,普利尼 俺当主角行吗.iso,pu li ni an dang zhu jue xing ma.iso
欺诈女神 Apate,欺诈女神 Apate.iso,qi zha nv shen Apate.iso
枪声与钻石,枪声与钻石.iso,qiang sheng yu zuan shi.iso
强袭魔女 白银之翼,强袭魔女 白银之翼.iso,qiang xi mo nv bai yin zhi yi.iso
青空下的约定 掌中乐园,青空下的约定 掌中乐园.iso,qing kong xia de yue ding zhang zhong le yuan.iso
轻音！放学后演唱会,轻音！放学后演唱会.iso,qing yin ！ fang xue hou yan chang hui.iso
秋叶原之旅 加强版,秋叶原之旅 加强版.iso,qiu ye yuan zhi lv jia qiang ban.iso
秋叶原之旅,秋叶原之旅.iso,qiu ye yuan zhi lv.iso
秋之回忆1,秋之回忆1.iso,qiu zhi hui yi 1.iso
秋之回忆2 雨后,秋之回忆2 雨后.iso,qiu zhi hui yi 2 yu hou.iso
秋之回忆2,秋之回忆2.iso,qiu zhi hui yi 2.iso
秋之回忆3 想君,秋之回忆3 想君.iso,qiu zhi hui yi 3 xiang jun.iso
秋之回忆4 again,秋之回忆4 again.iso,qiu zhi hui yi 4 again.iso
秋之回忆4 从今以后,秋之回忆4 从今以后.iso,qiu zhi hui yi 4 cong jin yi hou.iso
秋之回忆5 安可,秋之回忆5 安可.iso,qiu zhi hui yi 5 an ke.iso
秋之回忆5,秋之回忆5.iso,qiu zhi hui yi 5.iso
秋之回忆6 三角波澜,秋之回忆6 三角波澜.iso,qiu zhi hui yi 6 san jiao bo lan.iso
秋之回忆6 下一篇章,秋之回忆6 下一篇章.iso,qiu zhi hui yi 6 xia yi pian zhang.iso
秋之回忆7 两人的风流庵,秋之回忆7 两人的风流庵.iso,qiu zhi hui yi 7 liang ren de feng liu an.iso
秋之回忆7 誓约的记忆,秋之回忆7 誓约的记忆.iso,qiu zhi hui yi 7 shi yue de ji yi.iso
去北方,去北方.iso,qu bei fang.iso
全职猎人 奇迹冒险,全职猎人 奇迹冒险.iso,quan zhi lie ren qi ji mao xian.iso
忍道 焰,忍道 焰.iso,ren dao yan.iso
融合方块,融合方块.iso,rong he fang kuai.iso
三国将星传 中原之霸者,三国将星传 中原之霸者.iso,san guo jiang xing chuan zhong yuan zhi ba zhe.iso
三国志5,三国志5.iso,san guo zhi 5.iso
三国志6,三国志6.iso,san guo zhi 6.iso
三国志7,三国志7.iso,san guo zhi 7.iso
三国志8,三国志8.iso,san guo zhi 8.iso
三国志9,三国志9.iso,san guo zhi 9.iso
杀手赞歌,杀手赞歌.iso,sha shou zan ge.iso
山脊赛车2,山脊赛车2.iso,shan ji sai che 2.iso
上吧！噗露喵们,上吧！噗露喵们.iso,shang ba ！ pu lu miao men.iso
上海,上海.iso,shang hai.iso
赏金猎犬,赏金猎犬.iso,shang jin lie quan.iso
深红房间 逆转,深红房间 逆转.iso,shen hong fang jian ni zhuan.iso
神眷之力,神眷之力.iso,shen juan zhi li.iso
神秘岛,神秘岛.iso,shen mi dao.iso
神隐,神隐.iso,shen yin.iso
圣诞之吻 加强版,圣诞之吻 加强版.iso,sheng dan zhi wen jia qiang ban.iso
圣女贞德,圣女贞德.iso,sheng nv zhen de.iso
侍道1,侍道1.iso,shi dao 1.iso
侍道2,侍道2.iso,shi dao 2.iso
十二勇士 战国封神传,十二勇士 战国封神传.cso,shi er yong shi zhan guo feng shen chuan.cso
时间幻想,时间幻想.iso,shi jian huan xiang.iso
时间旅行者,时间旅行者.iso,shi jian lv xing zhe.iso
世界传说 光明神话2,世界传说 光明神话2.iso,shi jie chuan shuo guang ming shen hua 2.iso
世界上最NG的恋爱,世界上最NG的恋爱.iso,shi jie shang zui NG de lian ai.iso
世界树与恋爱的魔法师,世界树与恋爱的魔法师.iso,shi jie shu yu lian ai de mo fa shi.iso
实况力量职业棒球2010,实况力量职业棒球2010.iso,shi kuang li liang zhi ye bang qiu 2010.iso
实况足球10,实况足球10.iso,shi kuang zu qiu 10.iso
实况足球2008,实况足球2008.iso,shi kuang zu qiu 2008.iso
实况足球2009,实况足球2009.iso,shi kuang zu qiu 2009.iso
实况足球2010,实况足球2010.iso,shi kuang zu qiu 2010.iso
实况足球2011,实况足球2011.iso,shi kuang zu qiu 2011.iso
实况足球2012,实况足球2012.iso,shi kuang zu qiu 2012.iso
实况足球2013,实况足球2013.iso,shi kuang zu qiu 2013.iso
实况足球2014,实况足球2014.iso,shi kuang zu qiu 2014.iso
噬神者2,噬神者2.iso,shi shen zhe 2.iso
噬神者 爆裂,噬神者 爆裂.iso,shi shen zhe bao lie.iso
尸体派对 暗影之书,尸体派对 暗影之书.iso,shi ti pai dui an ying zhi shu.iso
尸体派对 幸子的恋爱游戏,尸体派对 幸子的恋爱游戏.iso,shi ti pai dui xing zi de lian ai you xi.iso
尸体派对 血色笼罩,尸体派对 血色笼罩.iso,shi ti pai dui xue se long zhao.iso
失忆症CROWD,失忆症CROWD.iso,shi yi zheng CROWD.iso
失忆症LATER,失忆症LATER.iso,shi yi zheng LATER.iso
失忆症,失忆症.iso,shi yi zheng.iso
十一只眼睛 交叉十字,十一只眼睛 交叉十字.iso,shi yi zhi yan jing jiao cha shi zi.iso
十字架引导 给有爱的人,十字架引导 给有爱的人.iso,shi zi jia yin dao gei you ai de ren.iso
数独10000问,数独10000问.iso,shu du 10000 wen.iso
数码宝贝大冒险,数码宝贝大冒险.iso,shu ma bao bei da mao xian.iso
数码宝贝世界 复元,数码宝贝世界 复元.iso,shu ma bao bei shi jie fu yuan.iso
双星物语,双星物语.iso,shuang xing wu yu.iso
水晶守卫,水晶守卫.iso,shui jing shou wei.iso
死或生 热带天堂,死或生 热带天堂.iso,si huo sheng re dai tian tang.iso
死神 灵魂嘉年华1,死神 灵魂嘉年华1.iso,si shen ling hun jia nian hua 1.iso
死神 灵魂嘉年华2,死神 灵魂嘉年华2.iso,si shen ling hun jia nian hua 2.iso
