3D弹珠台,3D弹珠台.chd,3D dan zhu tai.chd
声音幻想曲S 失去的声音力量,声音幻想曲S 失去的声音力量/menu.m3u,sheng yin huan xiang qu S shi qu de sheng yin li liang
侍魂真说 武士道烈传,侍魂真说 武士道烈传.chd,shi hun zhen shuo wu shi dao lie chuan.chd
世嘉观览车大赛,世嘉观览车大赛.chd,shi jia guan lan che da sai.chd
世嘉经典 宝石方块合集,世嘉经典 宝石方块合集.chd,shi jia jing dian bao shi fang kuai he ji.chd
世嘉经典 梦幻之星合集 日文版,世嘉经典 梦幻之星合集 日文版.chd,shi jia jing dian meng huan zhi xing he ji ri wen ban.chd
世嘉三四郎 真剑游戏,世嘉三四郎 真剑游戏.chd,shi jia san si lang zhen jian you xi.chd
世嘉土星上发现!蛋仔公园,世嘉土星上发现!蛋仔公园.chd,shi jia tu xing shang fa xian ! dan zai gong yuan.chd
世嘉足球世界杯’98 日文版,世嘉足球世界杯’98 日文版.chd,shi jia zu qiu shi jie bei ’98 ri wen ban.chd
时空侦探DD 幻之罗蕾莱,时空侦探DD 幻之罗蕾莱/menu.m3u,shi kong zhen tan DD huan zhi luo lei lai
实况F-1,实况F-1.chd,shi kuang F-1.chd
实况力量棒球 95开幕版 日文版,实况力量棒球 95开幕版 日文版.chd,shi kuang li liang bang qiu 95 kai mu ban ri wen ban.chd
实况力量棒球S 日文版,实况力量棒球S 日文版.chd,shi kuang li liang bang qiu S ri wen ban.chd
失落的世界之侏罗纪公园,失落的世界之侏罗纪公园.chd,shi luo de shi jie zhi zhu luo ji gong yuan.chd
失落的维京人2,失落的维京人2.chd,shi luo de wei jing ren 2.chd
尸体杀手 墓地版,尸体杀手 墓地版/menu.m3u,shi ti sha shou mu di ban
室友 W 2个人,室友 W 2个人/menu.m3u,shi you W 2 ge ren
室友 井上凉子3 风的闪耀清晨,室友 井上凉子3 风的闪耀清晨.chd,shi you jing shang liang zi 3 feng de shan yao qing chen.chd
室友 井上凉子,室友 井上凉子.chd,shi you jing shang liang zi.chd
室友 凉子在暑假,室友 凉子在暑假.chd,shi you liang zi zai shu jia.chd
十字军 英文版,十字军 英文版.chd,shi zi jun ying wen ban.chd
守护力量,守护力量.chd,shou hu li liang.chd
数码弹珠台 亡灵之书,数码弹珠台 亡灵之书.chd,shu ma dan zhu tai wang ling zhi shu.chd
数码弹珠台 最后的斗士,数码弹珠台 最后的斗士.chd,shu ma dan zhu tai zui hou de dou shi.chd
数码弹珠台,数码弹珠台.chd,shu ma dan zhu tai.chd
数码怪兽 Ver.S,数码怪兽 Ver.S.chd,shu ma guai shou Ver.S.chd
双调转术 英文版,双调转术 英文版/menu.m3u,shuang diao zhuan shu ying wen ban
水浒传 天导108星,水浒传 天导108星.chd,shui hu zhuan tian dao 108 xing.chd
水浒传 天命之誓,水浒传 天命之誓.chd,shui hu zhuan tian ming zhi shi.chd
水獭大冒险,水獭大冒险.chd,shui ta da mao xian.chd
四国战机,四国战机.chd,si guo zhan ji.chd
死亡扼杀 逃离被隔绝的城市,死亡扼杀 逃离被隔绝的城市.chd,si wang e sha tao li bei ge jue de cheng shi.chd
死亡火枪,死亡火枪.chd,si wang huo qiang.chd
死亡逻辑,死亡逻辑.chd,si wang luo ji.chd
死亡面具,死亡面具/menu.m3u,si wang mian ju
松方弘树的超级钓鱼,松方弘树的超级钓鱼.chd,song fang hong shu de chao ji diao yu.chd
苏醒的勇者 飞翔篇,苏醒的勇者 飞翔篇/menu.m3u,su xing de yong zhe fei xiang pian
苏醒的勇者 觉醒篇,苏醒的勇者 觉醒篇/menu.m3u,su xing de yong zhe jue xing pian
塔克拉玛干 敦煌传奇,塔克拉玛干 敦煌传奇.chd,ta ke la ma gan dun huang chuan qi.chd
太平洋之岚2,太平洋之岚2.chd,tai ping yang zhi lan 2.chd
泰坦战争,泰坦战争.chd,tai tan zhan zheng.chd
太阳罪恶,太阳罪恶.chd,tai yang zui e.chd
桃太郎道中记,桃太郎道中记.chd,tao tai lang dao zhong ji.chd
特搜机动队,特搜机动队.chd,te sou ji dong dui.chd
提督决断2,提督决断2.chd,ti du jue duan 2.chd
提督决断3 加强版,提督决断3 加强版.chd,ti du jue duan 3 jia qiang ban.chd
天地无用!登校无用,天地无用!登校无用/menu.m3u,tian di wu yong ! deng xiao wu yong
天地无用!连锁必要,天地无用!连锁必要.chd,tian di wu yong ! lian suo bi yao.chd
天空战记1,天空战记1.chd,tian kong zhan ji 1.chd
天空战记2,天空战记2.chd,tian kong zhan ji 2.chd
天空战记世界 苍空之翼,天空战记世界 苍空之翼/menu.m3u,tian kong zhan ji shi jie cang kong zhi yi
天下制霸,天下制霸.chd,tian xia zhi ba.chd
铁球 真实弹珠,铁球 真实弹珠.chd,tie qiu zhen shi dan zhu.chd
铁翼雄风,铁翼雄风.chd,tie yi xiong feng.chd
痛快!槽射!,痛快!槽射!.chd,tong kuai ! cao she !.chd
涂鸦弹珠台,涂鸦弹珠台.chd,tu ya dan zhu tai.chd
涂鸦天使S 你的侧脸,涂鸦天使S 你的侧脸.chd,tu ya tian shi S ni de ce lian.chd
秃子岛,秃子岛.chd,tu zi dao.chd
挖金子 回归版,挖金子 回归版.chd,wa jin zi hui gui ban.chd
挖金子 加强版,挖金子 加强版.chd,wa jin zi jia qiang ban.chd
外卖骑士,外卖骑士.chd,wai mai qi shi.chd
湾岸赛车 真实改编,湾岸赛车 真实改编/menu.m3u,wan an sai che zhen shi gai bian
湾岸赛车,湾岸赛车.chd,wan an sai che.chd
玩具比赛车,玩具比赛车.chd,wan ju bi sai che.chd
王国传说1,王国传说1.chd,wang guo chuan shuo 1.chd
王国传说2,王国传说2.chd,wang guo chuan shuo 2.chd
网络世界,网络世界.chd,wang luo shi jie.chd
危机世代,危机世代.chd,wei ji shi dai.chd
未解之谜,未解之谜/menu.m3u,wei jie zhi mi
维新之岚,维新之岚.chd,wei xin zhi lan.chd
文明,文明.chd,wen ming.chd
我的梦,我的梦/menu.m3u,wo de meng
我亲爱的6英寸,我亲爱的6英寸.chd,wo qin ai de 6 ying cun.chd
舞动的偶像,舞动的偶像.chd,wu dong de ou xiang.chd
无尽的爱 想要遇见你,无尽的爱 想要遇见你/menu.m3u,wu jin de ai xiang yao yu jian ni
巫师哈莫妮1,巫师哈莫妮1.chd,wu shi ha mo ni 1.chd
巫师哈莫妮2,巫师哈莫妮2.chd,wu shi ha mo ni 2.chd
巫术 6+7,巫术 6+7.chd,wu shu 6+7.chd
巫术 起点传说,巫术 起点传说.chd,wu shu qi dian chuan shuo.chd
巫术天罚 冒险之卷,巫术天罚 冒险之卷/menu.m3u,wu shu tian fa mao xian zhi juan
乌鸦2 天使之城,乌鸦2 天使之城.chd,wu ya 2 tian shi zhi cheng.chd
乌鸦 热血高校,乌鸦 热血高校.chd,wu ya re xue gao xiao.chd
午夜风暴S,午夜风暴S.chd,wu ye feng bao S.chd
武装斗士,武装斗士.chd,wu zhuang dou shi.chd
小鳄鱼 哥布斯传说,小鳄鱼 哥布斯传说.chd,xiao e yu ge bu si chuan shuo.chd
小玉 冒险球迷宫,小玉 冒险球迷宫.chd,xiao yu mao xian qiu mi gong.chd
新海底战舰 钢铁的孤独,新海底战舰 钢铁的孤独.chd,xin hai di zhan jian gang tie de gu du.chd
信使危机,信使危机.chd,xin shi wei ji.chd
心跳回忆 对战方块,心跳回忆 对战方块.chd,xin tiao hui yi dui zhan fang kuai.chd
心跳回忆 解谜方块,心跳回忆 解谜方块.chd,xin tiao hui yi jie mi fang kuai.chd
心跳回忆外传1 虹色青春,心跳回忆外传1 虹色青春.chd,xin tiao hui yi wai zhuan 1 hong se qing chun.chd
心跳回忆外传2 彩之爱歌,心跳回忆外传2 彩之爱歌/menu.m3u,xin tiao hui yi wai zhuan 2 cai zhi ai ge
心跳回忆外传3 旅立之诗,心跳回忆外传3 旅立之诗/menu.m3u,xin tiao hui yi wai zhuan 3 lv li zhi shi
心跳回忆 永远和你在一起,心跳回忆 永远和你在一起.chd,xin tiao hui yi yong yuan he ni zai yi qi.chd
信长之野望 回归,信长之野望 回归.chd,xin zhang zhi ye wang hui gui.chd
信长之野望 将星录,信长之野望 将星录.chd,xin zhang zhi ye wang jiang xing lu.chd
信长之野望 天翔记 加强版,信长之野望 天翔记 加强版.chd,xin zhang zhi ye wang tian xiang ji jia qiang ban.chd
信长之野望 战国群雄传,信长之野望 战国群雄传.chd,xin zhang zhi ye wang zhan guo qun xiong chuan.chd
新主题公园,新主题公园.chd,xin zhu ti gong yuan.chd
刑警哈罗德 蓝色芝加哥,刑警哈罗德 蓝色芝加哥/menu.m3u,xing jing ha luo de lan se zhi jia ge
星球杰克,星球杰克.chd,xing qiu jie ke.chd
行星攻击SS,行星攻击SS.chd,xing xing gong ji SS.chd
续 豆豆君,续 豆豆君.chd,xu dou dou jun.chd
虚拟梦幻仙境,虚拟梦幻仙境.chd,xu ni meng huan xian jing.chd
雪人方块,雪人方块.chd,xue ren fang kuai.chd
学校的恐怖故事 花子来了!,学校的恐怖故事 花子来了!.chd,xue xiao de kong bu gu shi hua zi lai le !.chd
学校怪谈,学校怪谈.chd,xue xiao guai tan.chd
血腥工厂,血腥工厂.chd,xue xing gong chang.chd
亚特兰蒂斯 失落的传说 英文版,亚特兰蒂斯 失落的传说 英文版/menu.m3u,ya te lan di si shi luo de chuan shuo ying wen ban
妖霸天下,妖霸天下.chd,yao ba tian xia.chd
妖精猎手1,妖精猎手1/menu.m3u,yao jing lie shou 1
妖精魔法宝石,妖精魔法宝石.chd,yao jing mo fa bao shi.chd
异形三部曲,异形三部曲.chd,yi xing san bu qu.chd
银河少女警察,银河少女警察/menu.m3u,yin he shao nv jing cha
银河少女警察 2086,银河少女警察 2086.chd,yin he shao nv jing cha 2086.chd
银河英雄传说 PLUS,银河英雄传说 PLUS.chd,yin he ying xiong chuan shuo PLUS.chd
银河英雄传说,银河英雄传说.chd,yin he ying xiong chuan shuo.chd
樱花大战 帝国华击团队员名单,樱花大战 帝国华击团队员名单.chd,ying hua da zhan di guo hua ji tuan dui yuan ming dan.chd
樱花大战 花组方块,樱花大战 花组方块.chd,ying hua da zhan hua zu fang kuai.chd
樱花大战 花组通信,樱花大战 花组通信.chd,ying hua da zhan hua zu tong xin.chd
樱花大战 蒸汽广播歌谣秀,樱花大战 蒸汽广播歌谣秀/menu.m3u,ying hua da zhan zheng qi guang bo ge yao xiu
樱桃小丸子 对战解谜方块,樱桃小丸子 对战解谜方块.chd,ying tao xiao wan zi dui zhan jie mi fang kuai.chd
英雄传说 1+2,英雄传说 1+2.chd,ying xiong chuan shuo 1+2.chd
英雄传说 白发魔女,英雄传说 白发魔女/menu.m3u,ying xiong chuan shuo bai fa mo nv
英雄志愿,英雄志愿.chd,ying xiong zhi yuan.chd
永恒的蝙蝠侠,永恒的蝙蝠侠.chd,yong heng de bian fu xia.chd
永远的毁灭公爵3D,永远的毁灭公爵3D.chd,yong yuan de hui mie gong jue 3D.chd
悠久的小箱,悠久的小箱.chd,you jiu de xiao xiang.chd
悠久幻想曲1,悠久幻想曲1.chd,you jiu huan xiang qu 1.chd
悠久幻想曲2,悠久幻想曲2.chd,you jiu huan xiang qu 2.chd
悠久幻想曲合唱版1,悠久幻想曲合唱版1.chd,you jiu huan xiang qu he chang ban 1.chd
悠久幻想曲合唱版2,悠久幻想曲合唱版2.chd,you jiu huan xiang qu he chang ban 2.chd
幽灵,幽灵/menu.m3u,you ling
游咪咪,游咪咪.chd,you mi mi.chd
优诺牌DX,优诺牌DX.chd,you nuo pai DX.chd
游戏的青春,游戏的青春.chd,you xi de qing chun.chd
游戏天国,游戏天国.chd,you xi tian guo.chd
与你同在,与你同在/menu.m3u,yu ni tong zai
宇宙骑警,宇宙骑警/menu.m3u,yu zhou qi jing
宇宙巡航机合集,宇宙巡航机合集.chd,yu zhou xun hang ji he ji.chd
圆石滩高尔夫球场 斯塔德勒的挑战 日文版,圆石滩高尔夫球场 斯塔德勒的挑战 日文版.chd,yuan shi tan gao er fu qiu chang si ta de lei de tiao zhan ri wen ban.chd
元祖爆烈猎人,元祖爆烈猎人/menu.m3u,yuan zu bao lie lie ren
约翰尼 巴祖卡,约翰尼 巴祖卡.chd,yue han ni ba zu ka.chd
月花雾幻谭,月花雾幻谭/menu.m3u,yue hua wu huan tan
月面摇篮,月面摇篮/menu.m3u,yue mian yao lan
越野车 异世界拦截,越野车 异世界拦截.chd,yue ye che yi shi jie lan jie.chd
在海边听牌,在海边听牌.chd,zai hai bian ting pai.chd
炸弹人 战争,炸弹人 战争.chd,zha dan ren zhan zheng.chd
战斗怪物,战斗怪物.chd,zhan dou guai wu.chd
真女神转生 恶魔召唤师 恶魔全书 第二集,真女神转生 恶魔召唤师 恶魔全书 第二集.chd,zhen nv shen zhuan sheng e mo zhao huan shi e mo quan shu di er ji.chd
真女神转生 恶魔召唤师 恶魔全书 第一集,真女神转生 恶魔召唤师 恶魔全书 第一集.chd,zhen nv shen zhuan sheng e mo zhao huan shi e mo quan shu di yi ji.chd
真女神转生 恶魔召唤师,真女神转生 恶魔召唤师.chd,zhen nv shen zhuan sheng e mo zhao huan shi.chd
真人快打2,真人快打2.chd,zhen ren kuai da 2.chd
真人快打3 英文版,真人快打3 英文版.chd,zhen ren kuai da 3 ying wen ban.chd
真人快打 三部曲 英文版,真人快打 三部曲 英文版.chd,zhen ren kuai da san bu qu ying wen ban.chd
真说梦见馆,真说梦见馆.chd,zhen shuo meng jian guan.chd
真像之夜,真像之夜.chd,zhen xiang zhi ye.chd
政界立志传,政界立志传.chd,zheng jie li zhi chuan.chd
蒸汽齿轮,蒸汽齿轮.chd,zheng qi chi lun.chd
正午,正午.chd,zheng wu.chd
正义之纹章 重置版,正义之纹章 重置版.chd,zheng yi zhi wen zhang zhong zhi ban.chd
智力大战Q,智力大战Q.chd,zhi li da zhan Q.chd
职业棒球 最强9人‘98 日文版,职业棒球 最强9人‘98 日文版.chd,zhi ye bang qiu zui qiang 9 ren ‘98 ri wen ban.chd
指针解谜,指针解谜.chd,zhi zhen jie mi.chd
中环拳击,中环拳击.chd,zhong huan quan ji.chd
重装甲少女组,重装甲少女组.chd,zhong zhuang jia shao nv zu.chd
专家兔,专家兔.chd,zhuan jia tu.chd
撞击赛车,撞击赛车.chd,zhuang ji sai che.chd
自我中心派 东京麻将乐园,自我中心派 东京麻将乐园.chd,zi wo zhong xin pai dong jing ma jiang le yuan.chd
足球英雄S 日文版,足球英雄S 日文版.chd,zu qiu ying xiong S ri wen ban.chd
卒业专辑,卒业专辑.chd,zu ye zhuan ji.chd
最喜欢你,最喜欢你/menu.m3u,zui xi huan ni
