3D弹珠台,3D弹珠台.chd,3D dan zhu tai.chd
3D旅鼠,3D旅鼠.chd,3D lv shu.chd
3D使命射击 入围,3D使命射击 入围.chd,3D shi ming she ji ru wei.chd
3X3只眼 吸精公主 S,3X3只眼 吸精公主 S/menu.m3u,3X3 zhi yan xi jing gong zhu S
51区,51区.chd,51 qu.chd
A.M.O.K,A.M.O.K.chd,A.M.O.K.chd
DX人生游戏 游戏人生1,DX人生游戏 游戏人生1.chd,DX ren sheng you xi you xi ren sheng 1.chd
DX人生游戏 游戏人生2,DX人生游戏 游戏人生2.chd,DX ren sheng you xi you xi ren sheng 2.chd
DX 日本特急旅行游戏 让我们一起去日本旅行,DX 日本特急旅行游戏 让我们一起去日本旅行.chd,DX ri ben te ji lv xing you xi rang wo men yi qi qu ri ben lv xing.chd
EVA 第2印象,EVA 第2印象.chd,EVA di 2 yin xiang.chd
EVA 钢铁女友,EVA 钢铁女友/menu.m3u,EVA gang tie nv you
EVA 数码卡片博物馆,EVA 数码卡片博物馆.chd,EVA shu ma ka pian bo wu guan.chd
EVA 愉快的同伴们,EVA 愉快的同伴们.chd,EVA yu kuai de tong ban men.chd
EVA,EVA.chd,EVA.chd
FIST格斗,FIST格斗.chd,FIST ge dou.chd
Falcom合集1,Falcom合集1/menu.m3u,Falcom he ji 1
Falcom合集2,Falcom合集2.chd,Falcom he ji 2.chd
G战机,G战机.chd,G zhan ji.chd
J联盟 创造球会2 日文版,J联盟 创造球会2 日文版.chd,J lian meng chuang zao qiu hui 2 ri wen ban.chd
J联盟 创造球会 日文版,J联盟 创造球会 日文版.chd,J lian meng chuang zao qiu hui ri wen ban.chd
J联盟 胜利足球'97 日文版,J联盟 胜利足球'97 日文版.chd,J lian meng sheng li zu qiu '97 ri wen ban.chd
Junclassic C.C. & Rope高尔夫俱乐部,Junclassic C.C. & Rope高尔夫俱乐部.chd,Junclassic C.C. & Rope gao er fu ju le bu.chd
K-1格斗 幻影翔,K-1格斗 幻影翔.chd,K-1 ge dou huan ying xiang.chd
M 把爱传递给你,M 把爱传递给你.chd,M ba ai chuan di gei ni.chd
NBA Action‘98 英文版,NBA Action‘98 英文版.chd,NBA Action‘98 ying wen ban.chd
NBA Jam 极限 日文版,NBA Jam 极限 日文版.chd,NBA Jam ji xian ri wen ban.chd
NBA 实况’98 英文版,NBA 实况’98 英文版.chd,NBA shi kuang ’98 ying wen ban.chd
NHL冰球98 英文版,NHL冰球98 英文版.chd,NHL bing qiu 98 ying wen ban.chd
NHL 全明星冰球’98 英文版,NHL 全明星冰球’98 英文版.chd,NHL quan ming xing bing qiu ’98 ying wen ban.chd
Q版赛车公园,Q版赛车公园.chd,Q ban sai che gong yuan.chd
RPG工具,RPG工具.chd,RPG gong ju.chd
Rox 6=Six,Rox 6=Six.chd,Rox 6=Six.chd
SD高达 G世代S,SD高达 G世代S.chd,SD gao da G shi dai S.chd
Savaki,Savaki.chd,Savaki.chd
VR赌场,VR赌场.chd,VR du chang.chd
VR 开幕网球 日文版,VR 开幕网球 日文版.chd,VR kai mu wang qiu ri wen ban.chd
VR 排球 日文版,VR 排球 日文版.chd,VR pai qiu ri wen ban.chd
WWF 狂热摔角街机版 日文版,WWF 狂热摔角街机版 日文版.chd,WWF kuang re shuai jiao jie ji ban ri wen ban.chd
Z零4杯赛车 类型R,Z零4杯赛车 类型R.chd,Z ling 4 bei sai che lei xing R.chd
Z 英文版,Z 英文版.chd,Z ying wen ban.chd
阿鲁卡那战记 Texthoth Ludo,阿鲁卡那战记 Texthoth Ludo.chd,a lu ka na zhan ji Texthoth Ludo.chd
阿鲁卡那战记,阿鲁卡那战记.chd,a lu ka na zhan ji.chd
阿斯特拉 超级之星,阿斯特拉 超级之星.chd,a si te la chao ji zhi xing.chd
埃及艳后宝石方块,埃及艳后宝石方块.chd,ai ji yan hou bao shi fang kuai.chd
安得雷蒂赛车,安得雷蒂赛车.chd,an de lei di sai che.chd
安琪莉可 特别篇1,安琪莉可 特别篇1.chd,an qi li ke te bie pian 1.chd
安琪莉可 特别篇2,安琪莉可 特别篇2.chd,an qi li ke te bie pian 2.chd
暗之追击者,暗之追击者.chd,an zhi zhui ji zhe.chd
巴洛克 日文版,巴洛克 日文版/menu.m3u,ba luo ke ri wen ban
百物语,百物语/menu.m3u,bai wu yu
百战天虫,百战天虫.chd,bai zhan tian chong.chd
半龙少女外传,半龙少女外传.chd,ban long shao nv wai zhuan.chd
半龙少女,半龙少女.chd,ban long shao nv.chd
爆裂方块 世界动物园管理员大赛,爆裂方块 世界动物园管理员大赛.chd,bao lie fang kuai shi jie dong wu yuan guan li yuan da sai.chd
爆裂方块,爆裂方块.chd,bao lie fang kuai.chd
爆破间,爆破间.chd,bao po jian.chd
必杀!,必杀!.chd,bi sha !.chd
蝙蝠狼,蝙蝠狼.chd,bian fu lang.chd
便利店 独占那条街的市场,便利店 独占那条街的市场.chd,bian li dian du zhan na tiao jie de shi chang.chd
病毒,病毒/menu.m3u,bing du
兵蜂合集 豪华公园,兵蜂合集 豪华公园.chd,bing feng he ji hao hua gong yuan.chd
彩虹镇的逻辑谜题,彩虹镇的逻辑谜题.chd,cai hong zhen de luo ji mi ti.chd
策略格斗,策略格斗.chd,ce lve ge dou.chd
超级赌场 特别版,超级赌场 特别版.chd,chao ji du chang te bie ban.chd
超级方块霸王2X,超级方块霸王2X.chd,chao ji fang kuai ba wang 2X.chd
超级复仇,超级复仇.chd,chao ji fu chou.chd
超级节拍,超级节拍.chd,chao ji jie pai.chd
超现实主义者 隐藏的七道光芒,超现实主义者 隐藏的七道光芒.chd,chao xian shi zhu yi zhe yin cang de qi dao guang mang.chd
超兄贵 究极 逆袭之男,超兄贵 究极 逆袭之男.chd,chao xiong gui jiu ji ni xi zhi nan.chd
超真实麻将 夏日华尔兹 在海边,超真实麻将 夏日华尔兹 在海边.chd,chao zhen shi ma jiang xia ri hua er zi zai hai bian.chd
成为魔法使的方法,成为魔法使的方法.chd,cheng wei mo fa shi de fang fa.chd
虫虫战士1,虫虫战士1.chd,chong chong zhan shi 1.chd
虫虫战士2,虫虫战士2.chd,chong chong zhan shi 2.chd
创造职业棒球队!日文版,创造职业棒球队!日文版.chd,chuang zao zhi ye bang qiu dui ! ri wen ban.chd
春风战队,春风战队/menu.m3u,chun feng zhan dui
大毁灭,大毁灭.chd,da hui mie.chd
大恐怖,大恐怖.chd,da kong bu.chd
大力神的冒险,大力神的冒险.chd,da li shen de mao xian.chd
大牌砦,大牌砦.chd,da pai zhai.chd
打破日本职业麻将联盟 公认的道场,打破日本职业麻将联盟 公认的道场.chd,da po ri ben zhi ye ma jiang lian meng gong ren de dao chang.chd
大头拳击F Plus 日文版,大头拳击F Plus 日文版.chd,da tou quan ji F Plus ri wen ban.chd
大头拳击F 日文版,大头拳击F 日文版.chd,da tou quan ji F ri wen ban.chd
大小姐 特急,大小姐 特急/menu.m3u,da xiao jie te ji
大运动会,大运动会.chd,da yun dong hui.chd
大战略 钢铁战风,大战略 钢铁战风.chd,da zhan lve gang tie zhan feng.chd
大战略 强硬风格,大战略 强硬风格.chd,da zhan lve qiang ying feng ge.chd
大战略 作战方案,大战略 作战方案.chd,da zhan lve zuo zhan fang an.chd
大追逐者 竞速,大追逐者 竞速.chd,da zhui zhu zhe jing su.chd
代号R,代号R.chd,dai hao R.chd
蛋蛋乐,蛋蛋乐.chd,dan dan le.chd
弹珠台 网络时代,弹珠台 网络时代.chd,dan zhu tai wang luo shi dai.chd
弹珠台,弹珠台.chd,dan zhu tai.chd
道化师杀人事件,道化师杀人事件.chd,dao hua shi sha ren shi jian.chd
蒂尔克 来自蓝色大海的少女,蒂尔克 来自蓝色大海的少女.chd,di er ke lai zi lan se da hai de shao nv.chd
地窖杀手,地窖杀手.chd,di jiao sha shou.chd
地牢大师 连结,地牢大师 连结.chd,di lao da shi lian jie.chd
电波少年的游戏,电波少年的游戏.chd,dian bo shao nian de you xi.chd
电车GO!EX,电车GO!EX.chd,dian che GO!EX.chd
电脑天使SS,电脑天使SS.chd,dian nao tian shi SS.chd
电脑战机,电脑战机.chd,dian nao zhan ji.chd
电梯大盗 回归,电梯大盗 回归.chd,dian ti da dao hui gui.chd
钓鱼甲子园,钓鱼甲子园.chd,diao yu jia zi yuan.chd
碟形世界1,碟形世界1.chd,die xing shi jie 1.chd
碟形世界2,碟形世界2.chd,die xing shi jie 2.chd
顶级垂钓者 超级钓鱼大战2,顶级垂钓者 超级钓鱼大战2.chd,ding ji chui diao zhe chao ji diao yu da zhan 2.chd
冬季奥运会 日文版,冬季奥运会 日文版.chd,dong ji ao yun hui ri wen ban.chd
东京暗影,东京暗影/menu.m3u,dong jing an ying
豆豆君S,豆豆君S.chd,dou dou jun S.chd
斗龙传说,斗龙传说.chd,dou long chuan shuo.chd
斗神传S,斗神传S.chd,dou shen chuan S.chd
斗神传URA,斗神传URA.chd,dou shen chuan URA.chd
斗士历史,斗士历史.chd,dou shi li shi.chd
俄罗斯方块Plus,俄罗斯方块Plus.chd,e luo si fang kuai Plus.chd
俄罗斯方块S,俄罗斯方块S.chd,e luo si fang kuai S.chd
恶魔召唤师 灵魂黑客,恶魔召唤师 灵魂黑客/menu.m3u,e mo zhao huan shi ling hun hei ke
恶魔召唤师 灵魂黑客 额外迷宫,恶魔召唤师 灵魂黑客 额外迷宫.chd,e mo zhao huan shi ling hun hei ke e wai mi gong.chd
恶神传,恶神传.chd,e shen chuan.chd
法国世界杯98 胜利之路 日文版,法国世界杯98 胜利之路 日文版.chd,fa guo shi jie bei 98 sheng li zhi lu ri wen ban.chd
反射对战,反射对战.chd,fan she dui zhan.chd
反重力赛车XL,反重力赛车XL.chd,fan zhong li sai che XL.chd
犯罪高潮,犯罪高潮.chd,fan zui gao chao.chd
犯罪巡逻队,犯罪巡逻队.chd,fan zui xun luo dui.chd
方程式锦标赛 模拟团队运营,方程式锦标赛 模拟团队运营.chd,fang cheng shi jin biao sai mo ni tuan dui yun ying.chd
飞毛腿 英文版,飞毛腿 英文版.chd,fei mao tui ying wen ban.chd
肥瘦大盗 2度归来,肥瘦大盗 2度归来.chd,fei shou da dao 2 du gui lai.chd
疯狂的伊凡,疯狂的伊凡.chd,feng kuang de yi fan.chd
疯狂枪支,疯狂枪支.chd,feng kuang qiang zhi.chd
钢铁侠 重金属之战,钢铁侠 重金属之战.chd,gang tie xia zhong jin shu zhi zhan.chd
高速 山地赛车挑战,高速 山地赛车挑战.chd,gao su shan di sai che tiao zhan.chd
高塔,高塔.chd,gao ta.chd
格斗之蛇,格斗之蛇.chd,ge dou zhi she.chd
格兰蒂亚数字博物馆,格兰蒂亚数字博物馆.chd,ge lan di ya shu zi bo wu guan.chd
哥斯拉 列岛震撼,哥斯拉 列岛震撼.chd,ge si la lie dao zhen han.chd
公路飚车,公路飚车.chd,gong lu biao che.chd
公元1999 法老的复活,公元1999 法老的复活.chd,gong yuan 1999 fa lao de fu huo.chd
公主任务,公主任务.chd,gong zhu ren wu.chd
古大陆传说,古大陆传说.chd,gu da lu chuan shuo.chd
古大陆物语 破亡之舞,古大陆物语 破亡之舞.chd,gu da lu wu yu po wang zhi wu.chd
古怪幻想,古怪幻想.chd,gu guai huan xiang.chd
古墓丽影,古墓丽影.chd,gu mu li ying.chd
怪兽大师 新时代,怪兽大师 新时代.chd,guai shou da shi xin shi dai.chd
怪物拆楼 英文版,怪物拆楼 英文版.chd,guai wu chai lou ying wen ban.chd
光暗包围战,光暗包围战.chd,guang an bao wei zhan.chd
光明力量3 特典,光明力量3 特典.chd,guang ming li liang 3 te dian.chd
鬼马小精灵,鬼马小精灵.chd,gui ma xiao jing ling.chd
鬼太郎 幻冬怪奇谭,鬼太郎 幻冬怪奇谭.chd,gui tai lang huan dong guai qi tan.chd
鬼屋魔影2 日文版,鬼屋魔影2 日文版.chd,gui wu mo ying 2 ri wen ban.chd
鬼屋魔影2 英文版,鬼屋魔影2 英文版.chd,gui wu mo ying 2 ying wen ban.chd
龟有公园前派出所,龟有公园前派出所.chd,gui you gong yuan qian pai chu suo.chd
海物语 有你相伴,海物语 有你相伴.chd,hai wu yu you ni xiang ban.chd
航海大冒险 圣埃尔莫斯的奇迹,航海大冒险 圣埃尔莫斯的奇迹.chd,hang hai da mao xian sheng ai er mo si de qi ji.chd
航空大亨’96,航空大亨’96.chd,hang kong da heng ’96.chd
和吻相比,和吻相比.chd,he wen xiang bi.chd
黑暗猎手(上) 异次元学院,黑暗猎手(上) 异次元学院.chd,hei an lie shou ( shang ) yi ci yuan xue yuan.chd
黑暗猎手(下) 妖魔之森,黑暗猎手(下) 妖魔之森.chd,hei an lie shou ( xia ) yao mo zhi sen.chd
黑暗之盅1,黑暗之盅1.chd,hei an zhi zhong 1.chd
黑暗之盅2,黑暗之盅2.chd,hei an zhi zhong 2.chd
黑暗坠落,黑暗坠落.chd,hei an zhui luo.chd
黑巴斯钓鱼1,黑巴斯钓鱼1.chd,hei ba si diao yu 1.chd
黑巴斯钓鱼2,黑巴斯钓鱼2.chd,hei ba si diao yu 2.chd
黑金战机,黑金战机.chd,hei jin zhan ji.chd
横断美国问答,横断美国问答.chd,heng duan mei guo wen da.chd
后院摔角 日文版,后院摔角 日文版.chd,hou yuan shuai jiao ri wen ban.chd
虎胆龙威三部曲,虎胆龙威三部曲.chd,hu dan long wei san bu qu.chd
华丽击坠王,华丽击坠王.chd,hua li ji zhui wang.chd
花式滑雪 日文版,花式滑雪 日文版.chd,hua shi hua xue ri wen ban.chd
花式撞球3 日文版,花式撞球3 日文版.chd,hua shi zhuang qiu 3 ri wen ban.chd
踝兄弟剧场 第一卷 麻将篇,踝兄弟剧场 第一卷 麻将篇.chd,huai xiong di ju chang di yi juan ma jiang pian.chd
幻想水浒传,幻想水浒传.chd,huan xiang shui hu zhuan.chd
皇龙三国演义,皇龙三国演义.chd,huang long san guo yan yi.chd
毁灭战士 英文版,毁灭战士 英文版.chd,hui mie zhan shi ying wen ban.chd
辉水晶传说,辉水晶传说.chd,hui shui jing chuan shuo.chd
魂斗罗 战争的遗产 英文版,魂斗罗 战争的遗产 英文版.chd,hun dou luo zhan zheng de yi chan ying wen ban.chd
混沌控制Remix,混沌控制Remix.chd,hun dun kong zhi Remix.chd
魂兽女忍传一番 加强版,魂兽女忍传一番 加强版/menu.m3u,hun shou nv ren chuan yi fan jia qiang ban
火爆摔角 炽热龙卷风,火爆摔角 炽热龙卷风.chd,huo bao shuai jiao chi re long juan feng.chd
火爆职业摔跤S 六人争夺战 日文版,火爆职业摔跤S 六人争夺战 日文版.chd,huo bao zhi ye shuai jiao S liu ren zheng duo zhan ri wen ban.chd
火凤凰3D,火凤凰3D.chd,huo feng huang 3D.chd
火热火热 怪物篇,火热火热 怪物篇.chd,huo re huo re guai wu pian.chd
火热火热噗呦噗呦迷宫,火热火热噗呦噗呦迷宫.chd,huo re huo re pu you pu you mi gong.chd
惑星强袭1,惑星强袭1.chd,huo xing qiang xi 1.chd
惑星强袭2,惑星强袭2/menu.m3u,huo xing qiang xi 2
机动战舰抚子号 空白3年,机动战舰抚子号 空白3年/menu.m3u,ji dong zhan jian fu zi hao kong bai 3 nian
机动战舰抚子号 最后还是爱赢了,机动战舰抚子号 最后还是爱赢了.chd,ji dong zhan jian fu zi hao zui hou hai shi ai ying le.chd
机动战士高达 基连的野望,机动战士高达 基连的野望.chd,ji dong zhan shi gao da ji lian de ye wang.chd
机动战士高达 基连野望 攻略指令书,机动战士高达 基连野望 攻略指令书.chd,ji dong zhan shi gao da ji lian ye wang gong lve zhi ling shu.chd
机动战士高达外传1 战栗的深蓝,机动战士高达外传1 战栗的深蓝.chd,ji dong zhan shi gao da wai zhuan 1  zhan li de shen lan.chd
机动战士高达外传2 青色继承者,机动战士高达外传2 青色继承者.chd,ji dong zhan shi gao da wai zhuan 2 qing se ji cheng zhe.chd
机动战士高达外传3 谁是审判者,机动战士高达外传3 谁是审判者.chd,ji dong zhan shi gao da wai zhuan 3 shui shi shen pan zhe.chd
机动战士高达,机动战士高达.chd,ji dong zhan shi gao da.chd
机甲战士2,机甲战士2.chd,ji jia zhan shi 2.chd
机器猫 大雄与复活之星,机器猫 大雄与复活之星.chd,ji qi mao da xiong yu fu huo zhi xing.chd
极上Q版沙罗曼蛇,极上Q版沙罗曼蛇.chd,ji shang Q ban sha luo man she.chd
剑与魔杖,剑与魔杖.chd,jian yu mo zhang.chd
戒备状态5,戒备状态5.chd,jie bei zhuang tai 5.chd
结婚,结婚.chd,jie hun.chd
杰克龙,杰克龙.chd,jie ke long.chd
街头霸王2 动画版,街头霸王2 动画版/menu.m3u,jie tou ba wang 2 dong hua ban
街头霸王2 十五周年纪念版,街头霸王2 十五周年纪念版.chd,jie tou ba wang 2 shi wu zhou nian ji nian ban.chd
街头霸王 电影版,街头霸王 电影版.chd,jie tou ba wang dian ying ban.chd
街头霸王 合集,街头霸王 合集/menu.m3u,jie tou ba wang he ji
金牌女警S,金牌女警S.chd,jin pai nv jing S.chd
金田一少年事件簿 星见岛悲伤的复仇鬼,金田一少年事件簿 星见岛悲伤的复仇鬼.chd,jin tian yi shao nian shi jian bu xing jian dao bei shang de fu chou gui.chd
究极虎2 Plus,究极虎2 Plus.chd,jiu ji hu 2 Plus.chd
巨大的打击,巨大的打击.chd,ju da de da ji.chd
掘尸乐团,掘尸乐团.chd,jue shi yue tuan.chd
卡牌召唤师,卡牌召唤师.chd,ka pai zhao huan shi.chd
科乐美MSX游戏合集,科乐美MSX游戏合集.chd,ke le mei MSX you xi he ji.chd
克苏鲁传说 南极冰怪,克苏鲁传说 南极冰怪.chd,ke su lu chuan shuo nan ji bing guai.chd
恐龙岛(大负荷),恐龙岛(大负荷).chd,kong long dao ( da fu he ).chd
恐龙佣兵,恐龙佣兵.chd,kong long yong bing.chd
空想科学世界,空想科学世界/menu.m3u,kong xiang ke xue shi jie
骷髅战士 英文版,骷髅战士 英文版.chd,ku lou zhan shi ying wen ban.chd
库罗斯侦探物语,库罗斯侦探物语/menu.m3u,ku luo si zhen tan wu yu
昆腾之门,昆腾之门.chd,kun teng zhi men.chd
蜡笔女神,蜡笔女神.chd,la bi nv shen.chd
蓝色破坏者,蓝色破坏者.chd,lan se po huai zhe.chd
雷电风暴道路爆炸机,雷电风暴道路爆炸机/menu.m3u,lei dian feng bao dao lu bao zha ji
雷曼,雷曼.chd,lei man.chd
雷鸟黄金包1,雷鸟黄金包1.chd,lei niao huang jin bao 1.chd
雷鸟黄金包2,雷鸟黄金包2.chd,lei niao huang jin bao 2.chd
雷神之锤 英文版,雷神之锤 英文版.chd,lei shen zhi chui ying wen ban.chd
雷亚战机1,雷亚战机1.chd,lei ya zhan ji 1.chd
雷亚战机2,雷亚战机2.chd,lei ya zhan ji 2.chd
立方体画廊 Edy&Disy,立方体画廊 Edy&Disy.chd,li fang ti hua lang Edy&Disy.chd
立体战士 安娜的故事,立体战士 安娜的故事.chd,li ti zhan shi an na de gu shi.chd
立体战士 翔的故事,立体战士 翔的故事.chd,li ti zhan shi xiang de gu shi.chd
恋爱麻雀二合一 可爱的流行,恋爱麻雀二合一 可爱的流行.chd,lian ai ma que er he yi ke ai de liu xing.chd
恋爱热线 3 并非数码,恋爱热线 3 并非数码/menu.m3u,lian ai re xian 3 bing fei shu ma
恋爱物语,恋爱物语/menu.m3u,lian ai wu yu
恋爱物语 特别版 恋爱与魔法的学园生活,恋爱物语 特别版 恋爱与魔法的学园生活.chd,lian ai wu yu te bie ban lian ai yu mo fa de xue yuan sheng huo.chd
恋爱夏日幻想 奥菜惠,恋爱夏日幻想 奥菜惠.chd,lian ai xia ri huan xiang ao cai hui.chd
炼金术士 玛丽的工作室,炼金术士 玛丽的工作室.chd,lian jin shu shi ma li de gong zuo shi.chd
练习曲 序章 动摇的心情,练习曲 序章 动摇的心情.chd,lian xi qu xu zhang dong yao de xin qing.chd
恋之千年王国,恋之千年王国.chd,lian zhi qian nian wang guo.chd
烈风赛车,烈风赛车.chd,lie feng sai che.chd
临界战斗,临界战斗.chd,lin jie zhan dou.chd
零式格斗 最终编辑版,零式格斗 最终编辑版.chd,ling shi ge dou zui zhong bian ji ban.chd
另一个回忆,另一个回忆.chd,ling yi ge hui yi.chd
龙的五千年,龙的五千年.chd,long de wu qian nian.chd
龙之心 火与钢,龙之心 火与钢.chd,long zhi xin huo yu gang.chd
乱步谜案,乱步谜案/menu.m3u,luan bu mi an
乱斗赛车,乱斗赛车.chd,luan dou sai che.chd
轮舞曲,轮舞曲/menu.m3u,lun wu qu
逻辑绘图方块,逻辑绘图方块.chd,luo ji hui tu fang kuai.chd
掠夺者,掠夺者.chd,lve duo zhe.chd
麻雀大会2 特别版,麻雀大会2 特别版.chd,ma que da hui 2 te bie ban.chd
麦斯超级机车赛,麦斯超级机车赛.chd,mai si chao ji ji che sai.chd
满弹枪手,满弹枪手.chd,man dan qiang shou.chd
冒险活剧 物物,冒险活剧 物物.chd,mao xian huo ju wu wu.chd
美国橄榄球联盟‘97 英文版,美国橄榄球联盟‘97 英文版.chd,mei guo gan lan qiu lian meng ‘97 ying wen ban.chd
美少女画线SS,美少女画线SS.chd,mei shao nv hua xian SS.chd
美少女梦工场1,美少女梦工场1.chd,mei shao nv meng gong chang 1.chd
美少女梦工场2,美少女梦工场2.chd,mei shao nv meng gong chang 2.chd
每天都会更换的解谜节目 365解谜,每天都会更换的解谜节目 365解谜.chd,mei tian dou hui geng huan de jie mi jie mu 365 jie mi.chd
猛冲!滑雪板 '98 日文版,猛冲!滑雪板 '98 日文版.chd,meng chong ! hua xue ban '98 ri wen ban.chd
猛冲的戴比,猛冲的戴比.chd,meng chong de dai bi.chd
梦幻脚步,梦幻脚步.chd,meng huan jiao bu.chd
梦幻侠影,梦幻侠影.chd,meng huan xia ying.chd
蒙面黑客,蒙面黑客.chd,meng mian hei ke.chd
梦想时代,梦想时代.chd,meng xiang shi dai.chd
秘密战队V,秘密战队V.chd,mi mi zhan dui V.chd
迷你四驱车 超级工厂,迷你四驱车 超级工厂.chd,mi ni si qu che chao ji gong chang.chd
迷失之城,迷失之城.chd,mi shi zhi cheng.chd
谜之魔界村,谜之魔界村.chd,mi zhi mo jie cun.chd
命令与征服,命令与征服/menu.m3u,ming ling yu zheng fu
明尼苏达的胖子 台球 日文版,明尼苏达的胖子 台球 日文版.chd,ming ni su da de pang zi tai qiu ri wen ban.chd
明星保龄球 日文版,明星保龄球 日文版/menu.m3u,ming xing bao ling qiu ri wen ban
明星之梦,明星之梦.chd,ming xing zhi meng.chd
魔导物语,魔导物语.chd,mo dao wu yu.chd
魔法彩球1,魔法彩球1.chd,mo fa cai qiu 1.chd
魔法彩球2,魔法彩球2.chd,mo fa cai qiu 2.chd
魔法彩球3,魔法彩球3.chd,mo fa cai qiu 3.chd
魔法草蠓,魔法草蠓.chd,mo fa cao meng.chd
魔法气泡叠叠乐,魔法气泡叠叠乐.chd,mo fa qi pao die die le.chd
魔法少女莎美 心的感觉,魔法少女莎美 心的感觉.chd,mo fa shao nv sha mei xin de gan jue.chd
魔法少女莎美,魔法少女莎美.chd,mo fa shao nv sha mei.chd
魔法学院 露娜,魔法学院 露娜.chd,mo fa xue yuan lu na.chd
魔鬼高尔夫球场 日文版,魔鬼高尔夫球场 日文版.chd,mo gui gao er fu qiu chang ri wen ban.chd
魔剑美神1,魔剑美神1.chd,mo jian mei shen 1.chd
魔剑美神2,魔剑美神2.chd,mo jian mei shen 2.chd
模拟城市2000,模拟城市2000.chd,mo ni cheng shi 2000.chd
模拟动物园,模拟动物园.chd,mo ni dong wu yuan.chd
魔物危机,魔物危机.chd,mo wu wei ji.chd
纳斯卡赛车98 英文版,纳斯卡赛车98 英文版.chd,na si ka sai che 98 ying wen ban.chd
南方珀堂登场,南方珀堂登场/menu.m3u,nan fang po tang deng chang
脑死亡 13,脑死亡 13.chd,nao si wang 13.chd
逆鳞弹,逆鳞弹.chd,ni lin dan.chd
帕尼尔塔大冒险,帕尼尔塔大冒险.chd,pa ni er ta da mao xian.chd
啪啪方块,啪啪方块.chd,pa pa fang kuai.chd
潘神迷宫,潘神迷宫.chd,pan shen mi gong.chd
泡泡龙1,泡泡龙1.chd,pao pao long 1.chd
泡泡龙2X,泡泡龙2X.chd,pao pao long 2X.chd
泡泡龙3,泡泡龙3.chd,pao pao long 3.chd
朋友们 青春的光辉,朋友们 青春的光辉/menu.m3u,peng you men qing chun de guang hui
平成天才笨蛋波恩,平成天才笨蛋波恩.chd,ping cheng tian cai ben dan bo en.chd
破发点网球 日文版,破发点网球 日文版.chd,po fa dian wang qiu ri wen ban.chd
噗哟噗哟 Sun,噗哟噗哟 Sun.chd,pu yo pu yo Sun.chd
噗哟噗哟通,噗哟噗哟通.chd,pu yo pu yo tong.chd
七彩梦 虹色町的奇迹,七彩梦 虹色町的奇迹.chd,qi cai meng hong se ting de qi ji.chd
企鹅忍满丸,企鹅忍满丸.chd,qi e ren man wan.chd
七龙珠Z 伟大龙珠传说,七龙珠Z 伟大龙珠传说.chd,qi long zhu Z wei da long zhu chuan shuo.chd
七之秘馆,七之秘馆/menu.m3u,qi zhi mi guan
青涩之恋,青涩之恋/menu.m3u,qing se zhi lian
青涩之恋 第一扇窗,青涩之恋 第一扇窗.chd,qing se zhi lian di yi shan chuang.chd
庆应游击队 无忧无虑的玉手箱,庆应游击队 无忧无虑的玉手箱.chd,qing ying you ji dui wu you wu lv de yu shou xiang.chd
蚯蚓吉姆2,蚯蚓吉姆2.chd,qiu yin ji mu 2.chd
球转界,球转界.chd,qiu zhuan jie.chd
雀帝,雀帝/menu.m3u,que di
忍空 火爆的家伙们 大冲突,忍空 火爆的家伙们 大冲突.chd,ren kong huo bao de jia huo men da chong tu.chd
人造人间,人造人间.chd,ren zao ren jian.chd
忍者茶茶丸 鬼斩忍法帖金,忍者茶茶丸 鬼斩忍法帖金.chd,ren zhe cha cha wan gui zhan ren fa tie jin.chd
日本超经典钓鲈 '96,日本超经典钓鲈 '96.chd,ri ben chao jing dian diao lu '96.chd
日本代表队监督!足球RPG 日文版,日本代表队监督!足球RPG 日文版.chd,ri ben dai biao dui jian du ! zu qiu RPG ri wen ban.chd
日产展示 超越驾驶,日产展示 超越驾驶.chd,ri chan zhan shi chao yue jia shi.chd
荣格节律,荣格节律.chd,rong ge jie lv.chd
赛马大亨3 程序'98,赛马大亨3 程序'98.chd,sai ma da heng 3 cheng xu '98.chd
赛马风'96 武丰育马游戏,赛马风'96 武丰育马游戏.chd,sai ma feng '96 wu feng yu ma you xi.chd
赛马冠军2 最强马传说,赛马冠军2 最强马传说.chd,sai ma guan jun 2 zui qiang ma chuan shuo.chd
赛马冠军 GI完全称霸之路,赛马冠军 GI完全称霸之路.chd,sai ma guan jun GI wan quan cheng ba zhi lu.chd
三国志4 威力加强版,三国志4 威力加强版.chd,san guo zhi 4 wei li jia qiang ban.chd
三国志 回归,三国志 回归.chd,san guo zhi hui gui.chd
三国志 孔明传,三国志 孔明传.chd,san guo zhi kong ming chuan.chd
闪电出击2,闪电出击2.chd,shan dian chu ji 2.chd
山顶赛车1,山顶赛车1.chd,shan ding sai che 1.chd
山顶赛车2,山顶赛车2.chd,shan ding sai che 2.chd
上海 万里长城,上海 万里长城.chd,shang hai wan li chang cheng.chd
上海 伟大的时刻,上海 伟大的时刻.chd,shang hai wei da de shi ke.chd
上升2 复活,上升2 复活.chd,shang sheng 2 fu huo.chd
少年佣兵团,少年佣兵团.chd,shao nian yong bing tuan.chd
少女革命 终将迎来革命的故事,少女革命 终将迎来革命的故事/menu.m3u,shao nv ge ming zhong jiang ying lai ge ming de gu shi
神宫寺三郎 梦的终结,神宫寺三郎 梦的终结.chd,shen gong si san lang meng de zhong jie.chd
神秘岛2,神秘岛2/menu.m3u,shen mi dao 2
神秘的世界EL HAZARD,神秘的世界EL HAZARD.chd,shen mi de shi jie EL HAZARD.chd
神秘医院,神秘医院.chd,shen mi yi yuan.chd
神奇传说2 时空道标,神奇传说2 时空道标.chd,shen qi chuan shuo 2 shi kong dao biao.chd
生物冲击,生物冲击/menu.m3u,sheng wu chong ji
生物冲击 特别版,生物冲击 特别版/menu.m3u,sheng wu chong ji te bie ban
