DJ快手,DJ快手.zip,DJ kuai shou.zip
SD高达 G世代1,SD高达 G世代1.zip,SD gao da G shi dai 1.zip
SD高达 激震篇,SD高达 激震篇.zip,SD gao da ji zhen pian.zip
SD高达 加藤战记 首部曲,SD高达 加藤战记 首部曲.zip,SD gao da jia teng zhan ji shou bu qu.zip
爆走卡车传说,爆走卡车传说.zip,bao zou ka che chuan shuo.zip
播种鸟,播种鸟.zip,bo zhong niao.zip
彩虹岛,彩虹岛.zip,cai hong dao.zip
超火爆摔跤,超火爆摔跤.zip,chao huo bao shuai jiao.zip
超级机器人大战 精华版2 第1部 地上激动篇,超级机器人大战 精华版2 第1部 地上激动篇.zip,chao ji ji qi ren da zhan jing hua ban 2 di 1 bu di shang ji dong pian.zip
超级机器人大战 精华版2 第2部 宇宙激震篇,超级机器人大战 精华版2 第2部 宇宙激震篇.zip,chao ji ji qi ren da zhan jing hua ban 2 di 2 bu yu zhou ji zhen pian.zip
超级机器人大战 精华版2 第3部 银河决战篇,超级机器人大战 精华版2 第3部 银河决战篇.zip,chao ji ji qi ren da zhan jing hua ban 2 di 3 bu yin he jue zhan pian.zip
超级机器人大战 精华版,超级机器人大战 精华版.zip,chao ji ji qi ren da zhan jing hua ban.zip
超时空要塞 真爱之歌,超时空要塞 真爱之歌.zip,chao shi kong yao sai zhen ai zhi ge.zip
超兄贵 男人的魂札,超兄贵 男人的魂札.zip,chao xiong gui nan ren de hun zha.zip
磁力方块,磁力方块.zip,ci li fang kuai.zip
大家来海钓,大家来海钓.zip,da jia lai hai diao.zip
诞生,诞生.zip,dan sheng.zip
电车 GO! 1,电车 GO! 1.zip,dian che GO! 1.zip
电车 GO! 2,电车 GO! 2.zip,dian che GO! 2.zip
东京魔人学园 符咒封魔录,东京魔人学园 符咒封魔录.zip,dong jing mo ren xue yuan fu zhou feng mo lu.zip
返家十万里,返家十万里.zip,fan jia shi wan li.zip
疯狂爬楼者,疯狂爬楼者.zip,feng kuang pa lou zhe.zip
风之少年,风之少年.zip,feng zhi shao nian.zip
格斗料理传说 激斗篇,格斗料理传说 激斗篇.zip,ge dou liao li chuan shuo ji dou pian.zip
哈罗机器人,哈罗机器人.zip,ha luo ji qi ren.zip
哈姆太郎,哈姆太郎.zip,ha mu tai lang.zip
海贼王 目标是海贼王,海贼王 目标是海贼王.zip,hai zei wang mu biao shi hai zei wang.zip
华尔兹之剑,华尔兹之剑.zip,hua er zi zhi jian.zip
花札,花札.zip,hua zha.zip
绘图逻辑方块,绘图逻辑方块.zip,hui tu luo ji fang kuai.zip
徽章战士 独角仙版,徽章战士 独角仙版.zip,hui zhang zhan shi du jiao xian ban.zip
徽章战士 鍬形虫版,徽章战士 鍬形虫版.zip,hui zhang zhan shi qiao xing chong ban.zip
混乱齿轮,混乱齿轮.zip,hun luan chi lun.zip
机动战士高达 MSVS,机动战士高达 MSVS.zip,ji dong zhan shi gao da MSVS.zip
將棋登龙门,將棋登龙门.zip,jiang qi deng long men.zip
街头舞者,街头舞者.zip,jie tou wu zhe.zip
劲上果岭,劲上果岭.zip,jin shang guo ling.zip
竞走马育成,竞走马育成.zip,jing zou ma yu cheng.zip
看谁在说话,看谁在说话.zip,kan shui zai shuo hua.zip
恐怖传说1,恐怖传说1.zip,kong bu chuan shuo 1.zip
口袋战士,口袋战士.zip,kou dai zhan shi.zip
口袋撞球,口袋撞球.zip,kou dai zhuang qiu.zip
狂钓黑巴斯,狂钓黑巴斯.zip,kuang diao hei ba si.zip
狂热节拍,狂热节拍.zip,kuang re jie pai.zip
恋爱时代 海边小夜曲,恋爱时代 海边小夜曲.zip,lian ai shi dai hai bian xiao ye qu.zip
领域争夺战,领域争夺战.zip,ling yu zheng duo zhan.zip
六角拼盘,六角拼盘.zip,liu jiao pin pan.zip
陆行鸟不可思议的迷宫,陆行鸟不可思议的迷宫.zip,lu xing niao bu ke si yi de mi gong.zip
洛克人与佛鲁迪 来自未来的挑战者,洛克人与佛鲁迪 来自未来的挑战者.zip,luo ke ren yu fu lu di lai zi wei lai de tiao zhan zhe.zip
麻雀登龙门,麻雀登龙门.zip,ma que deng long men.zip
梦幻模拟战,梦幻模拟战.zip,meng huan mo ni zhan.zip
谜王,谜王.zip,mi wang.zip
名侦探柯南 魔术师之挑战书,名侦探柯南 魔术师之挑战书.zip,ming zhen tan ke nan mo shu shi zhi tiao zhan shu.zip
名侦探柯南 西之名侦探最大之危机,名侦探柯南 西之名侦探最大之危机.zip,ming zhen tan ke nan xi zhi ming zhen tan zui da zhi wei ji.zip
魔法方块大战,魔法方块大战.zip,mo fa fang kuai da zhan.zip
魔法气泡,魔法气泡.zip,mo fa qi pao.zip
魔界村,魔界村.zip,mo jie cun.zip
魔卡少女樱的不可思议库洛牌,魔卡少女樱的不可思议库洛牌.zip,mo ka shao nv ying de bu ke si yi ku luo pai.zip
趴趴熊方块,趴趴熊方块.zip,pa pa xiong fang kuai.zip
泡泡龙,泡泡龙.zip,pao pao long.zip
奇迹棒球 99,奇迹棒球 99.zip,qi ji bang qiu 99.zip
奇迹棒球,奇迹棒球.zip,qi ji bang qiu.zip
七夜怪谈,七夜怪谈.zip,qi ye guai tan.zip
全职猎人 意志的继承者,全职猎人 意志的继承者.zip,quan zhi lie ren yi zhi de ji cheng zhe.zip
燃烧吧!!职业棒球,燃烧吧!!职业棒球.zip,ran shao ba !! zhi ye bang qiu.zip
日本职业麻雀联盟公认 彻万,日本职业麻雀联盟公认 彻万.zip,ri ben zhi ye ma que lian meng gong ren che wan.zip
三国志 I,三国志 I.zip,san guo zhi I.zip
三国志 II,三国志 II.zip,san guo zhi II.zip
三京柏青哥机模拟大攻略,三京柏青哥机模拟大攻略.zip,san jing bai qing ge ji mo ni da gong lve.zip
森田将棋,森田将棋.zip,sen tian jiang qi.zip
上海,上海.zip,shang hai.zip
时间飞船系列 飞船传说,时间飞船系列 飞船传说.zip,shi jian fei chuan xi lie fei chuan chuan shuo.zip
兽人竞走,兽人竞走.zip,shou ren jing zou.zip
数回,数回.zip,shu hui.zip
数码宝贝冒险02 附属团队,数码宝贝冒险02 附属团队.zip,shu ma bao bei mao xian 02 fu shu tuan dui.zip
数码宝贝 数位拍档,数码宝贝 数位拍档.zip,shu ma bao bei shu wei pai dang.zip
太空侵略者,太空侵略者.zip,tai kong qin lve zhe.zip
淘金者,淘金者.zip,tao jin zhe.zip
铁拳卡片挑战赛,铁拳卡片挑战赛.zip,tie quan ka pian tiao zhan sai.zip
铁人28号,铁人28号.zip,tie ren 28 hao.zip
五子棋登龙门,五子棋登龙门.zip,wu zi qi deng long men.zip
仙界传1,仙界传1.zip,xian jie chuan 1.zip
线脑,线脑.zip,xian nao.zip
线条方块,线条方块.zip,xian tiao fang kuai.zip
携帶鱼群探知机,携帶鱼群探知机.zip,xie dai yu qun tan zhi ji.zip
新日本摔角联盟 斗魂烈传,新日本摔角联盟 斗魂烈传.zip,xin ri ben shuai jiao lian meng dou hun lie chuan.zip
新世纪福音战士 使徒育成 汉化版,新世纪福音战士 使徒育成 汉化版.zip,xin shi ji fu yin zhan shi shi tu yu cheng han hua ban.zip
新世纪福音战士 使徒育成,新世纪福音战士 使徒育成.zip,xin shi ji fu yin zhan shi shi tu yu cheng.zip
信长之野望,信长之野望.zip,xin zhang zhi ye wang.zip
漩涡 怪奇篇,漩涡 怪奇篇.zip,xuan wo guai qi pian.zip
漩涡 魔咒篇,漩涡 魔咒篇.zip,xuan wo mo zhou pian.zip
妖符魔界,妖符魔界.zip,yao fu mo jie.zip
语乐王,语乐王.zip,yu le wang.zip
预想进化论,预想进化论.zip,yu xiang jin hua lun.zip
元祖忍者 茶茶丸君,元祖忍者 茶茶丸君.zip,yuan zu ren zhe cha cha wan jun.zip
纸牌革命 I,纸牌革命 I.zip,zhi pai ge ming I.zip
纸牌革命 II,纸牌革命 II.zip,zhi pai ge ming II.zip
职业麻雀 极,职业麻雀 极.zip,zhi ye ma que ji.zip
钟楼,钟楼.zip,zhong lou.zip
装甲部队,装甲部队.zip,zhuang jia bu dui.zip
子育问答我的天使,子育问答我的天使.zip,zi yu wen da wo de tian shi.zip
足球野郎挑战全世界,足球野郎挑战全世界.zip,zu qiu ye lang tiao zhan quan shi jie.zip
卒业,卒业.zip,zu ye.zip
最后冲刺 2000,最后冲刺 2000.zip,zui hou chong ci 2000.zip
最后防线,最后防线.zip,zui hou fang xian.zip
